rapper,song,year,lyrics
N.O.R.E.,Set It Off,,"Set It Off Lyrics[Intro: Swizz Beatz] (N.O.R.E.)|Set it off in this mother-mother-mother jump it off! (Yeah!)|Set it off in this mother-mother-mother jump it off! (Swizz!)|Set it off in this mother-mother-mother jump it off!|Set it off in this mother HEY!!! Jump it off! (N.O.!!!)||[Hook: Swizz Beatz] (N.O.R.E.)|Set it off in this mother-mother-mother jump it off! (YO! YO! YO! YO!)|Set it off in this mother-mother-mother set it off! (YO! YO! YO! YO!)|Set it off in this mother-mother-mother jump it off! (YO! YO! YO! YO!)|Set it off in this mother-mother-mother jump it off! (YO! YO! YO! YO!)|Set it off in this mother-mother-mother jump it off! (YO! YO! YO! YO!)|Set it off in this mother-mother-mother set it off! (YO! YO! YO! YO!)|Set it off in this mother-mother-mother jump it off! (YO! YO! YO! YO!)|Set it off in this mother-mother-mother jump it off! (YO! YO! YO! YO!)|[Verse 1: N.O.R.E.]|Aiyyo, ridin with my burner, rollin with my earner|L.I.E. Expressway bangin that Uncle Murda|BULLET BULLET!!! I rep New York to the FULLEST FULLEST!!!|I got guns, don't think I won't PULL IT PULL IT!!!|Gat off safety, dudes won't face me|Both of them hoes like, Cagney & Lacey|And N.O.R.E. (YEP!!) I'm respected in the projects|Filled out my O.G. card, it's in the process|I used to get a pass, now I give a pass (Ha!)|And got a gun that go RAH!!!! like summer splash|Thug club music that you listen to late|Yep! That's that style that I helped create, tell 'em Swizz!||[Hook: Swizz Beatz]|Set it off in this mother-mother-mother jump it off!|Set it off in this mother-mother-mother set it off!|Set it off in this mother-mother-mother jump it off!|Set it off in this mother-mother-mother jump it off!||[Verse 2: N.O.R.E.]|Aiyyo we got the Patron, Hennesey, Cranberry and Vodka|Mami down for takin on poppa|Opa locka, where I buy that|No heroin cocaine, no I never try that|I just fly pass, thinkin 'bout, gettin a bypass|Surgery, stomach and small ass|Bitches with small ass, go tell your managers|N.O.R.E.'s in the building with keys they call me janitors|Go hard, sort a feel like a slave|And even on the block when it rain like meter maids|Cause, I heard that Peter paid Paul from a jena maid|But if he didn't pay me, he would see the grave!|You might also like[Hook: Swizz Beatz]|Set it off in this mother-mother-mother jump it off!|Set it off in this mother-mother-mother set it off!|Set it off in this mother-mother-mother jump it off!|Set it off in this mother-mother-mother jump it off!|Set it off in this mother-mother-mother jump it off!|Set it off in this mother-mother-mother set it off!|Set it off in this mother-mother-mother jump it off!|Set it off in this mother-mother-mother jump it off!||[Verse 3: J. Russ]|Swizzy! Let me jump on this track and get busy|N.O.R.E. man I got you let me roll up the splizzy|Good grippy, that's all I expect|Now I'm a set it off like I'm Ron Artest|Now who you with hey we the best! But this ain't Khaled|This your boy J. Russ from Palm Beach!|Let the boy set it off with them big choppers|And you can have it your weay like a fuckin whopper|Or matter of fact nigga pop a double sack|Two for twenty five you be rollin like a cadillac|It's for them big guns that have your ass jumpin back|It's time to set it off nigga where the money at?!||[Hook: Swizz Beatz]|Set it off in this mother-mother-mother jump it off!|Set it off in this mother-mother-mother set it off!|Set it off in this mother-mother-mother jump it off!|Set it off in this mother-mother-mother jump it off!|[Outro: Swizz Beatz]|Set it! Set! Set it! Set! Set it off! Set it! Set It off!|Set it off! Set it! Set It off!Embed"
N.O.R.E.,Hare Krishna,2019,"Hare Krishna Lyrics[Intro: RZA]|Yeah, we in the building|My boy N.O.R.E., Nor' in the building|The RZA Rah Rah in the building|QZA Queens in the building|Straight up and down, Wu-Tang in the building||[Hook: RZA (N.O.R.E.)]|Hare hare krishna, a good learner's a good listener|(It's the N.O.R.E., huh?) He come with the RZA|Say hadi hadi rama, control your karma|Stop that drama, President Obama|RZA, you get trapped in six|Up, you better grab your crucifix, it's the remix|Digitech, back inside your set|[Verse 1: N.O.R.E.]|Mind design like assassin, I drink with a passion|Guns like cameras, cuz them things stay flashing|But I'm an architect, I build with my own hands|Foundation nation, I have your Haitian facing|Fruit juices, raw vegetables|Castrate that ass, how you roll with no testicles|And I don't fuck with niggas, cuz they assholes|They like hoes, they get touched in they ass hole|I throw diamonds on my bullets, call it icey hot|Cuz I still buck you down on a pricey block|You too relaxed now, fuck you in your canape|Distribute the rock, you can call that Lin-Sanity|You say I plan to be, greater then your family|Send the word out, I got bombs in your Camry|And things change, since my days of the hand to hand|Cuz now the fucking hustlers is customers, sniffing grams||[Hook: RZA (N.O.R.E.)]|Hare hare krishna, a good learner's a good listener|(It's the N.O.R.E., huh?) He come with the RZA|Say hadi hadi rama, control your karma|Stop that drama, President Obama|RZA, you get trapped in six|Up, you better grab your crucifix, it's the remix|Digitech, back inside your set|You might also like[Verse 2: N.O.R.E.]|It go mixtape Illuminati-lumni, some die|Some cry, used to let the tech fly, you sun fry|Awkward, orthodox, you pork face, porky pot|Shoot you in your toe, now your hoe can't walk a lot|Stand still accurate, shoot accurate|Tell 'em niggas stand still, they best fall back a bit|I'm from the era of the golden, original|Style never stolen, these wack dudes lame, and they stealing niggas lingo|Split a Reynolds wrap, from a kush from a mango, smacking niggas tangos|Snap backs and all that, bifocals smashed up|Bitches wanna sleep with me, I roll like a boss|So the niggas wanna eat with me, fly admired frequently|Hand to hand secretly, your boss wanna speak with me|You see my ladies, yeah, they smell like a tangerine|Every day's a photo shoot, live in the magazine||[Hook: RZA (N.O.R.E.)]|Hare hare krishna, a good learner's a good listener|(It's the N.O.R.E., huh?) He come with the RZA|Say hadi hadi rama, control your karma|Stop that drama, President Obama|RZA, you get trapped in six|Up, you better grab your crucifix, it's the remix|Digitech, back inside your set|[Outro: RZA]|Hare hare krishna|A good learner's a good listener|DJ Fricktion, he come with the RZA|Saying hadi hadi rama, control your karma|Stop that drama, President Obama|RZA, you get trapped in six|Up, you better grab your crucifix, it's the remix|The RZA up inside the building, you got my boy N.O.R.E|That's the end of the storyEmbed"
N.O.R.E.,Parade,2018,"Parade Lyrics[Intro]|Get up, get up!|Get up, goddamnit!||[Chorus]|Everybody know who the fuck I am|I'm back, I'm back, okay (okay)|I tell 'em throw me a parade (tell 'em throw me a parade)|I tell 'em throw me a parade (tell 'em throw me a parade)|(Get up!)|I'm back, I'm back, okay (okay)|I tell 'em throw me a parade (tell 'em throw me a parade)|I tell 'em throw me a parade (tell 'em throw me a parade)|Yeah, yeah|[Verse 1]|Yo, do you miss me?|You know I hope you do|I was destined to make it|I know I'm overdue|The podcast on smash I'm jumping over you|Talkin' ten millions in streams with no sober view|Cabrón! Maricón!|[?] I feel right at home|They want with some Gucci and my hoodie down|Cause I've been running wild at least 20 now|And I would never think this when I'm selling weight|2017, feel like 1998|I knew this was it, soon as I heard it|This my parade and I deserve it||[Chorus]|I'm back, I'm back, okay (okay)|I tell 'em throw me a parade (tell 'em throw me a parade)|I tell 'em throw me a parade (tell 'em throw me a parade)|(Get up!)|I'm back, I'm back, okay (okay)|I tell 'em throw me a parade (tell 'em throw me a parade)|I tell 'em throw me a parade (tell 'em throw me a parade)|Yeah, yeah|You might also like[Verse 2]|Ay yo it's been a long time|I shouldn't have left you|Without that N.O.R. shit to step to|Know these weak dudes that you slept through|Times up, I'm sorry I kept you|Streets love me, I get love there|Superthug raised in the mud there|Camouflage morning with the thug there|[?] in Dubai, but ain't no bud yet|Slime on this grown man|Surfboards and beaches, permanent gold tan|I knew this was it, soon as I heard of it|Haz [?] and Swiss Beatz they murdered it||[Chorus]|I'm back, I'm back, okay (okay)|I tell 'em throw me a parade (tell 'em throw me a parade)|I tell 'em throw me a parade (tell 'em throw me a parade)|(Get up!)|I'm back, I'm back, okay (okay)|I tell 'em throw me a parade (tell 'em throw me a parade)|I tell 'em throw me a parade (tell 'em throw me a parade)|Yeah, yeah||[Verse 3]|She said it feel like it's New Years (yeah, yeah)|That's because everything is new here|She said it feel like it's New Years (yeah, yeah)|That's because everything is new here|She said it feel like it's New York(yeah, yeah)|That's because every day is new year|I had that old bitch for 12 months|And I call my new bitch on new year's|[Chorus]|I'm back, I'm back, okay (okay)|I tell 'em throw me a parade (tell 'em throw me a parade)|I tell 'em throw me a parade (tell 'em throw me a parade)|(Get up!)|I'm back, I'm back, okay (okay)|I tell 'em throw me a parade (tell 'em throw me a parade)|I tell 'em throw me a parade (tell 'em throw me a parade)|Yeah, yeah||Tell 'em throw me a parade|Poppin' bottles in the hood|Like I just beat a case (Gotti)|Barely in the town, prolly somewhere out of state|Sitting in the sun, while they still throwing shade|Let the haters hate, cause they going through a phase|Tunnel vision on the money, know you see the Cartiers|And y'all know my name from the streets to the stage|Screamin I'm back got me feelin like I'm Mase||[Chorus]|I'm back, I'm back, okay (okay)|I tell 'em throw me a parade (tell 'em throw me a parade)|I tell 'em throw me a parade (tell 'em throw me a parade)|(Get up!)|I'm back, I'm back, okay (okay)|I tell 'em throw me a parade (tell 'em throw me a parade)|I tell 'em throw me a parade (tell 'em throw me a parade)|Yeah, yeah||[Outro]|I'm back, I'm back, okay|I tell 'em throw me a parade|I tell 'em throw me a parade|I'm back, I'm back, okay|I tell 'em throw me a parade|I tell 'em throw me a parade|Yeah, yeahEmbed"
N.O.R.E.,Rap Rushmore,2014,"Rap Rushmore Lyrics[Intro]|We on top of the world|On top of the game||[Verse 1: Nature]|Yo, Yo|I turn it up like the stove on|In Miami Marvin’ out with whole bomb|I got fiends that been waiting for a whole month|Niggas still tryna sell them what they don’t want|I run around higher than the age rate|Big 9s on my side never aim straight|100 grams but it’s looking more like 6|5 rounds with the champion the fight’s fixed|4 EPs dropping in the same year|3 Clubs a night, Henny in the same year|2 Hoes a town when we on a world tour|Everyday been the same since ‘04|Money, money, money, money, money, money, credit|Getting too much of it now we burn it up or shred it|Spend it in the strip club or may then we bet it|Top of the game now I wonder where we headed|[Verse 2: N.O.R.E]|This is New York, guerilla rhymes|Stop signs, killer crimes|Old niggas reminisce, dream bout the benefits|Talk about they day when they was doin they shit|Hand to hand fights all day we just spray shit|Nowadays they do a crime on Vine|Record they own self, evidence for one-time|The reason you got caught with your work|Because you was on Instagram with the same damn shirt|I don’t like niggas checking ma phone|I got dick pics that I send to dick chicks|Chicks drink cum like a mystic|Exquisite|I ain’t going trip shit|I just rip shit|Stripper bowl, tip shit|I used to have a chick named Monica|All she wanted do is run drills with Veronica|Always had something in her mouth, thermometer|Fuck it, a 100 miles per hour||[Verse 3: Capone]|I been one to have these new niggas under my left arm|Flow game weak like they balls is stepped on|Duffle gang niggas get hogtied|Paper never passing me by like the far side|You can either get a soft 9 or a hard 5|Play your cards right you be like Diamond, those large piles|Ball for ball, I’m a prison dawg you a halfway house|Pump with the smoking nigga pull an ashtray out|Since 96 been a bull in the game like Hinrich|They fighting in the lab im in the streets with 9 bricks|Still puttin in work all I need is a hard hat|I’m flying in a new G5 on the tarmac|Every time you see me in the street know I’m walking with the heat|I ain't talking Lebrons on my feet|Fucking with made men, there’s dons on the beat|Give me whatever promise and be gone in a week|You might also like[Verse 4: Cormega]|I’m rising up the in line|With rhyming but|Lining up the father of rhyme|Punk if you try to front|I give em some bullshit|I’m talking the years Michael one|Numbers don’t lie it’s clear I’m not the one|Peep the structure I’m built different I bought a house|So field niggas can chill in it|My realism is rare|If you don’t feel me deal with it|I’m so focused on winning I don’t know what failure is|Not acceptable I acknowledge the big picture|My arts impeccable even my arms immeasurable|Dope schemes, short range, ply for revenue|Dollars reign supreme don’t bow to ineptitude|I’m a very lyrical unique individual|Livin’ free ever since I cut the beat’s umbilical|Visual, but niggas can't see me|I’ve been the truth, no lie|Killin cause i’m playing by different rules||[Outro]|Yo NORE should I hold back cause|Some of these suckas in the crowd wanna hear|We got gas to get that strip, moving a fast lip|Before rap my name was ringing in the projects|[Repeat]Embed"
N.O.R.E.,Camouflage Unicorns,2013,"Camouflage Unicorns Lyrics[Verse 1 - N.O.R.E.]|These moissanite fake jewelry niggas, faker than they chain|The audio, the mix show, I still obtain|Queens legend, it's Nas then it's me|Anyone that disagree I'll smack em out they misery|Sixteen years, blood, sweat, and my tears|I wanna do a last ""Report"" for everyone that cares|Or maybe I'm just anxious like a dude for a settlement|Maybe people don't think that CNN is relevant|It's uphill battle, when you're still rich|And your first hit date back to '96|Like that y'all, it's like that y'all|I heard ahk, I told him rep Lefrak y'all|He said wait a year or two, you ain't gotta press me|He gon' fuck hoes for free, and get a little sexy|Yeah, he was right about that|And many years later, he still right about that|Cause I'm the Lefrak king, I don't care what you say to me|Say I don't make sense, cool, that's okay with me|Same niggas wanna hang all day with me|And DJs gonna play what I play|And I could break down everything that I say|Sutter Home Moscato that I drink everyday|And I be daydreaming in the night time|Feeling like a boxer when it's fight time|[Hook x2 - Havoc]|It's a uphill battle, y'all niggas probably hang up|Uphill battle, and my niggas never changed up|Uphill battle, son they pussy and just play tough|My uphill battle, have you leaking on that pavement||[Verse 2 - Tragedy]|Fly, what I rock is murder, get indicted for what I wear|Life is beautiful, I cherish every breath of air|Disregard the past like I was never there|They try to run with my style like I was Fred Astaire|Yeah, robberies and Rovers|Bitches love Mahdi more than they love Sosa|Salute old boy OG soldier|Carrera shades on, Louis Vuitton loafers|Everything healthy, I stay fed|I hold toast, I ain't talking bout baked bread|Shake feds, no matter the odds we can make it|We been married the game, y'all still newlyweds|Militainment, 25, shit is sacred|I rock shades when my future look too bright|I rep the east, similar to Tru Life|Shit on your craps table, snake eyes, two dice|Supreme like Kenneth McGriff, all I'm seeing is green|Dirty Sprite, codeine got me on lean|For my g's with they dreams on a triple beam|Freedom ain't free but the money game mean|Fuck your swag, we super fly|And my doors commit suicide|Never fall off, QB, Top of New York|Spit flames, cocktail nigga like a Molotov|Self-made, student of the game|Killa Queens, I'm a boss, rep that at all costs|You might also like[Hook]Embed"
N.O.R.E.,Set It Off (Remix),,"Set It Off (Remix) Lyrics[Intro: Swizz Beatz]|Set it off in this mother-mother-mother jump it off!|Set it off in this mother-mother-mother jump it off!|Set it off in this mother-mother-mother jump it off!|Set it off in this mother HEY!!! Jump it off!||[Hook: Swizz Beatz] (Sho)|Set it off in this mother-mother-mother jump it off!|Set it off in this mother-mother-mother set it off!|Set it off in this mother-mother-mother jump it off!|Set it off in this mother-mother-mother jump it off!|Set it off in this mother-mother-mother jump it off! (This is not a remix! This is a me mix!)|Set it off in this mother-mother-mother set it off!|Set it off in this mother-mother-mother jump it off!  (It's all me!!!)|Set it off in this mother-mother-mother jump it off!|[Verse 1: N.O.R.E.] (Sho)|Yo N.O.R. I'm on the mound (Got Sho in the bullpen)|It's Q.U. homey and we back on that bullshit|(We now interrupt your regularly scheduled program for the dope man)|For Lindsay Lohan, fuck soundscan number one on the coke scan|(First week with the yay I pulled a Kanye)|Yo Sho! It's your turn to show and prove|(Yo N.O.R. I swear I'm a Youtube one of these dudes)|(It's S.H.Ofiicial tissue barbershop's new topic your bosses new issue)|N.O.R.E. been back in this game since mixtapes with Ron G|(See I) Stay on my B.I. (They tryin to set me up) Like them faggot ass feds did T.I|We set it off, niggas disappear (And kids get tooken like they Britney Spears, set it off||[Hook: Swizz Beatz]|Set it off in this mother-mother-mother jump it off!|Set it off in this mother-mother-mother set it off!|Set it off in this mother-mother-mother jump it off!|Set it off in this mother-mother-mother jump it off!|Set it off in this mother-mother-mother jump it off!|Set it off in this mother-mother-mother set it off!|Set it off in this mother-mother-mother jump it off!|Set it off in this mother-mother-mother jump it off!||[Verse 2: Busta Rhymes]|Put your money where your mouth is nigga|Place a bet again, better put your money on the god|I'm back to smash everything!|Shakin up some shit and then erase you like an Etch-N-Sketch|From the way we put it down and how I finish niggas effortless!|ALWAYS been described as a beast, that you should never test|And from the West to the East, you should decribe me as the very best|That ever do it and said it and jump it off I'm sick with this|Niggas already know just how we body chumps - RIDICULOUS|You might also like[Verse 3: Talib Kweli]|We set it off like alarms, set it off like a bomb|Set it, I was calm before I set it like Saddam|And you read it like a psalm in the Bible in Islamic|That Koran what you nervous cause we wet it like a palm?|We you sweatin like a can of Coke, bust ya in ya canteloupe|Your brain in an antedote, runnin through my veins like an antelope|Runnin through the Serengeti plains|Contemporary while I'm spittin legendary game||[Hook: Swizz Beatz] (Cassidy)|Set it off in this mother-mother-mother jump it off!|Set it off in this mother-mother-mother set it off!|Set it off in this mother-mother-mother jump it off! (YEAH! YEAH!|Set it off in this mother-mother-mother jump it off!|Set it off in this mother-mother-mother jump it off! (Full Surface! Swizzy!)|Set it off in this mother-mother-mother set it off!|Set it off in this mother-mother-mother jump it off! (Larceny Family!)|Set it off in this mother-mother-mother jump it off! (The hustler's home!)||[Verse 4: Cassidy]|N.O.R.E. it's whatever dog you know I set it off|Start poppin the desert off one shot and his head is off|You know the feds involved when clappin the led involved|But I'm marrying my gat I ain't callin the wedding off|NAH!!! I'm not a clown I'll body you now|I got the pound that'll spin your whole body around|The ambulance will tell the dispatch a body is found|And ain't no tellin when your body is found, MU'FUCKER!!!!!|[Verse 5: Red Cafe]|Uh! Let me set it off, let me set it off|I'm a put in the  work, you watch for the NARCs'|I'm the Dopeman get at me, get at me|I got D fo' real no ""Laffy Taffy""|Picture on mine get your shit rock (WHAT ELSE?)|We don't fight over hoes like Kid Rock (WHAT ELSE?)|I bang bang then I'm cool like Altoids|In Brooklyn I'm the Cocaine Cowboy||[Hook: Swizz Beatz]|Set it off in this mother-mother-mother jump it off!|Set it off in this mother-mother-mother set it off!|Set it off in this mother-mother-mother jump it off!|Set it off in this mother-mother-mother jump it off!||[Outro: Swizz Beatz]|Set it! Set! Set it! Set! Set it off! Set it! Set It off!|Set it off! Set it! Set It off!||[Hook: Swizz Beatz]|Set it off in this mother-mother-mother jump it off!|Set it off in this mother-mother-mother set it off!|Set it off in this mother-mother-mother jump it off!|Set it off in this mother-mother-mother jump it off!||[Outro: Swizz Beatz]|Set it! Set! Set it! Set! Set it off! Set it! Set It off!|Set it off! Set it! Set It off!Embed"
N.O.R.E.,Hablar de amor,,Hablar de amor LyricsHoy voy a hablar de amor|Hoy dame tu calor|Vamos a hablar de amor|Hoy dame tu calor|Si quiero estar a tu lado|Ya me doy cuenta que de ti|Yo me he enamorado||Ay no me mientas|Ay papi dime|Dime que esto es real|Yo te lo juro|Te repito negrita|Nunca he sentido algo igual||He sentido el corazón|Se me heriza el amor|Y si dices que es verdad|No hay mas que hablar||Hoy voy a hablar de amor|Hoy dame tu calor|Vamos a hablar de amor|Hoy dame tu calor|Si quiero estar a tu lado|Ya me doy cuenta que de ti|Yo me he enamorado||Ay no me mientas|Hay papi dime|Dime que esto es real||Yo te lo juro|Te repito negrita|Nunca he sentido algo igual||He sentido el corazón|Se me heriza el amor|Y si dices que es verdad|No hay mas que hablar|You might also like(Gracias a Laura por esta letra)Embed
N.O.R.E.,Now I Pray,2002,"Now I Pray Lyrics[Noreaga - talking]|Uh, (yeah), gangsta, killa (killa)|Killa beats nigga (beats nigga) Iraqians (Iraqians)|Do it like this (send Iraq to the heavens)||[Noreaga]|Yo, yo, yo guns, wars, banana clips holdin|Tec nine's the wet clothin|These niggas heard we mack moldin|It's all gravy how I fuckin my eighties|No women, no babies, Versace niggas get crump crazy|You think I'm soft how I'm up in the loft|And gettin sucked off, with some Cristal on my cock|And plus duck sauce and two Spanish bitches lickin it off|Nah, ain't shit changed I'm still pickin you off|I stay drunk wit a lot of reefer|These niggas gay like the guard that was in ""Sleepers""|Two ways without beepers|These little niggas more leapers|I got gangstas that gangbang on all creatures|Shoot your whole face up and fucked up your features|Iraq soldier, see the Henny made me fall over|And still fuck 'til I'm dead sober|I don't care about your balls, your hood, or your weed|Fuck your whack ass thoughts I can throw some speed|[Hook] - 2X|Now I lay me down to sleep|I pray the lord my soul to keep|If I should die before I wake|I pray the lord my soul to take (uh)||[Noreaga]|I desecrate the nations, gee I'm a sick individual|Jose Louis yo, Analog digital|Cigliari Trarabelly, Run Isreali my niggas run deep in your roots|Allah Kelly got your project shook, everytime you look|Cause I pray fifty niggas every flight they book|Your more story, get up outta the club, it's drunk NORE|Hands around my two Spanish bitches holdin my liquor|Across the street these niggas scopin me, hopin I slip|Like I ain't on point, but what point is this|Do they know my fingers stay itchy, my whip do a buck sixty|Do a 360 donut, and shoot 50 niggas in they fuckin faces|I dumped their bodies by the horse races bloody valore, a couple Nore faces|Yo keep hatin until you will see|More volts in your chest plate it's hard to breathe|It go||[Hook]||[Break - Musaliny]|Uh, ah|Hey yo this street life we live it|This thug life we live it|If you ain't frontin, we live this shit|You might also likeHey yo this street life we live it|This thug shit we live it|Thugged out ain't playin, we live this shit||[Muze]|Hey yo, hey yo, it's Muze vinity chin tap your chin|Send a shot through your limb, think we ain't gonna win|Stuff valar I know they way I'm livin ain't right|But's that's life live and learn 'til I get my game tight|I came up a broken home, rolled wit chrome|Pops was never known on the block 'til my cheddar's blown|Fiendin for the day I was on, fat beats since the day I was born|Too know he snatched me and my other half|Thugged out never gettin cash|No mom would put a foot in nigga's ass, mash|Coast to coast wit the Cali most|Tally wit toast and party wit my cousin's ghost|You bitch nigga, what||[Hook]||(*talking*)||Uh, Now I lay me down to sleep|I pray the lord my soul to keep|If I should die before I wakeEmbed"
