rapper,song,year,lyrics
Black Thought,Thank You,2018,"Thank You Lyrics[Verse 1: Black Thought]|Uh|Thanks for the memories|For 1st and 3rd of the month check deliveries|Agencies in the early '80s for givin' cheese|To families with parents who had drug dependencies|Masjids and storefront ministries|Dinners from the chicken lady, Miss Genevieve|For every lesson I received as I live and breathe|And all the blessings I believed in and then achieved|Thanks to my moms for never gettin' rid of me|And to my lady baby thank you for forgivin' me|I climbed from the lower level to the mezzanine|Honestly, I really wanna say thanks for everything|Images of strange fruits hangin' from the trees|Laces on my gym shoes, skatin' from police|Kids playin' on the stoops wearing dungarees|Unbeknownst to them they livin' in the city under seige|Two Sierra Leonians and a Senegalese|Honey and lemon teas, sincere sympathies|The power of positive energy as opposed|To hatred as a motivative, thank you to my enemies|From Memphis, Tennessee|And kitchen chemistry|Atari Centipede, Heineken and Hennessy|The barbershop that used to be at 6th and Emily|For all the history and all you did for me, thank you|[Chorus: KIRBY & Black Thought]|It's such a blessing, blessing, blessing to know you|Blessing to know you|I learned my lesson, lesson, why would I hurt you?|Don't wanna hurt you (Thank you)|I wanna thank you, thank you, thank you for givin' me|Thank you for givin' me love|I wanna thank you, thank you, thank you for givin' me (Yeah)|Thank you for givin' me love||[Verse 2: Black Thought]|Places that I've known|Many of which I've outgrown, thanks for the ride home|Some motherfuckas tried to make me give what's mine to 'em|Thank goodness for my decent aim with one eye closed|Gangsta and fly hoes, freaks and side shows|Mistakes I've made in the past that only God knows|Usually my preference would be to travel the high road|Sometimes I strayed from the path, that's no surprise though|I had to use this expression of my gratitude|That my attitude didn't limit my latitude|In cases when I had to do, what I had to do|Even though I was spazzin' boo, I wasn't mad at you|This unbroken token of appreciation|For frequencies and stations not keepin' the people waitin'|For players who supported, remainin' completely patient|And each and every record in the basement|Listen, thank youYou might also likeEmbed"
Black Thought,Streets,2018,"Streets Lyrics[Intro: Black Thought]|Yeah, that shit hard||[Verse 1: Black Thought]|I said my cranium is vibranium, my brain is uranium and titanium|Forty-fives, who aimin' 'em? Organize the stadium|Tell 'em, ""Take cover, I warned you not to play wit' 'em""|Them borderline war crimes, you got away wit' 'em|Who came to save the day and brought the K wit' 'em?|Tariq the people's champ from the equal team|Tryna keep it clean 'long as all my people solid deen|I've been in the music scene long as Allen Leeds|Make they salaries, still accumulatin' calories|Demonstratin' how to breathe, Senegalese, Genovese|I been a reason to freeze, reek G's in the league|On my own, gettin' cheese|I will hurt Hercules, I will merc most MCs|I'm the last one to show up, the first one to leave the crime scene|The obscene, Salam theme, the ridiculous rhyme scheme|The stick to the grind gene, the hell with the hygiene|It's a dirty bomb, word to seven thirty time|Disaster level nine eleven meets the eleven nine|Catastrophe beyond incredible, I redefine the seventh sign|Faster, scarier, mass hysteria from Damascus, Syria|To middle America, school cafeterias and cul-de-sacs|I told you that the boss is back, know what I'm sayin'?|[Chorus: Tish Hyman]|In these streets that I call home|Unless you're blind, you'll see it all|In these streets it's cold at night|Sirens screamin' by, gunshots all the time||[Verse 2: Black Thought]|Yo, omertà code meets the Hippocratic oath|Observin' his whole circus from a diplomatic post|My word and his whole purpose, a cinematic scope|The Earth and its whole surface, I consider that his toast|Same as Sammy Davis, Bellafonte, Quincy Jones|Mahatma Gandhi, James Balwdin, Jesse Owens|Runnin' from a cop car, me and Akbar|I changed from a rock boy to a rock star|Hijack the elevator to the top floor|I'm takin' everything that's left like a southpaw|Crash and burn and learn through osmosis|And watch the word spread like Tuberculosis|I took a snapshot but it hurt to post it|I had a Black Thought and they called it wokeness|Overdoses, water bugs and roaches|Forty Cals and holsters, all halal and kosher|Twenty thousand jokers, one ain't playin'|I'm Claude Brown, Man-child in the Promised Land|You might also like[Chorus: Tish Hyman]|In these streets that I call home|Unless you're blind, you'll see it all|In these streets it's cold at night|Sirens screamin' by, gunshots all the timeEmbed"
Black Thought,Get Outlined,2018,"Get Outlined Lyrics[Intro]|Uh, LA, uh huh, Chi Town, Philadelphia, PA|Hey now, uh, LA, yeah, Chi Town, Philadelphia, PA||[Verse 1]|Listen, pick any city, the South side, the outside|It isn't pretty, the tots cryin’ and shots fired|Protection there be the lopsided, cop kind|You see the scene of a crime like every stop sign|My section of twenty-one pound is downtown|They walkin' 'round wit’ the guns out, it's wild how|The youngings dumb proud, followin' the crowd now|Leading the blind with they minds up in the Soundcloud|Ain't a lotta sunshine when you on a frontline|Listenin' to that ghetto drumline, duckin' one-time|Thinkin' how the Devil doesn't tire, even sometimes|Wonderin’ how the fuck could one’s rhyme be this unkind|Everybody cold to me, seeming through this bullshit|The only thing that sold to me bein' told, we should hold on|Gettin’ old to me I'm about to buckle|'Cause holdin' tight got my hands fully white-knuckled|And to be honest, tomorrow is not promised|Whether you on the streets of Chicago or Botswana|You gotta be rock solid, not to be outsmarted|The rise from rock-bottom to one of the top scholars|I never ask what’s the secret of success|With a target on your back and a scarlet on your chest|Listen, just get it, not a minute to rest|This is not a test, settle for the best, nothin' less, dig it|[Bridge]|Pick any city, the South side, the drought side|Where E-M-S has arrived, well, it's about time|People who just get they tops fried get outlined|Minutes and seconds go clockwise but not mine||[Verse 2]|Where I'm from it's a war scene|Where more fiends scream for Morphines, Zoloft and Thorazine|We don't subscribe to the grand scheme|The plans seems to be keepin' us all sick, sellin' them vaccines|Ain't a lot of fun time when your only son dyin'|And the world's comin' untied from the inside|That's between affection and depression, it's a thin line|Stress and pressure here is multiplied ten times|Everything is blurred to me, lessons deferred for me|Fam said it's been a long term since they heard from me|My lil' homie never made it out of surgery|Sometimes I feel like South Philly tryna murder me||[Interlude]|First, everybody's upset 'cause you died|They like, ""Wait a minute, man|I ain't the ones who's dead, he's the one that's brown bread""|Hah, so in comes the second lie, ya dig?You might also likeEmbed"
Black Thought,Long Liveth,2018,"Long Liveth Lyrics[Intro]|Uh, yo||[Verse 1]|Greetings and salutations, I'm runnin' outta patience|So everything in moderation, even moderation|Check every single allegation for re-calibration|Call that the big pay back, it's debt consolidation|The credit fell, what the hell, too much béchamel|Well, F-M-L, they desecrated the decibel|Go check the mail then let me know if it's heads or tails|My ears burn like desert trails and Jezebels|Uh, somebody must be talkin' 'bout me|For carryin' a big stick and walkin' loudly|Articles in the Times and the New Yorker 'bout me|My killer instinct is like Orchid, probably|I'm a Pulitzer Prize Fighter how I vaporize writers|Shut 'em down at one time, synchronize silence|Make the audience forget you, call it Alzheimer's|Child rhymers don't come at the old timers|Whether your fan base is lil' mommas or Obamas|How you claim to have somethin' in check with no commas?|You and Mary got the same request, it's No Drama|I'm the pinnacle of language, yes, the Dalai Lama|Who the clown talkin' down to the twenty-one pound?|I gotta send him some rounds to simmer him down|'Cause you're not worthy to even touch the hem of the gown|The brim of the crown, motherfucker, remember the sound|It's like|[Break]|Hey, yo|Yo||[Verse 2]|Since the second grade I been gainfully employed|Hustlin' for change everyday from three to four|When other kids was into playin' games and bein' bored|Goin' against the grain's what I painfully enjoyed|When they was into race cars, trains, TV and toys|I was thinkin' fat gold chains and freakazoids|Fillin' the deeper void, listenin' to that Indecent Noise|People used to tell me, ""Boy, your brain gon' be destroyed""|Left hand to the law, right hand to Allah|Both hands to applaud who brought sand to the shore|Confessin' all your sins to the dope man through a door|I seen a preacher man sniffin' cocaine through a straw|We almost had it all, just one more cannon ball|And two more Geritol with one more Adderall|I got the game sewn like the tailor of Panama|Now I go by the name of an untamed animal|Wonderin' how I can evolve to prestigious and less vicious|A more visceral individual, best wishes|Just on principle, I been answerin' death wishes|What the Lord giveth is a king, long livethYou might also likeEmbed"
Black Thought,Hurricane,2000,"Hurricane Lyrics[Intro: Flo Brown]|Same story, same target, different time|Cyclical reaction from the prisoners of the blind|Trying to fight time, it's a battle of the mind|Waiting for redemption, surviving in a bind|Same story, same target, different time|Cyclical reaction from the prisoners of the blind|Trying to fight time, it's a battle of the mind|Waiting for redemption, surviving in a bind||[Verse 1: Black Thought]|Yo, talk about paying the ultimate price|Hurricane been incarcerated all of his life|Started out at like twelve|Trapped in a belly of hell|Grew into a man inside of a cell|Yo, anger just swell up|At a early age that develop|Hot head and now it ain't shit y'all could tell him|They said he's on a road to become a felon|But instead he swung blows that'll spilt your melon|He did his thing and was the king of the ring, undisputed|Started making noise but they tried to mute it|They put him through it|For him to make the system look stupid, [yo]|They rather look you in the face and shoot it|And leave your spot looted [or what]|Or leave your whole life blank futured and caught|When you scream at it and do it|With sweat leaking from the outline of your soluid|Don't understand the point that you at|Or how the hell you came to it?|Flashback to images of that night, out in Patterson|They pulled him over heading home from a gathering|And when they told him the charge it kind of baffled him|Murder in the first for the champ, we on that again?|[Chorus: Jazzyfatnastees & Black Thought]|Hurricane|Accuse a Hurricane|Ain't change a damned shame|It's life for Hurricane, Hurricane|Forever, imagine your locked down forever|Could y'all stand the weather?|Could you hold it together?|You tell me that you know the pain|Yo, imagine if your life was like a hurricane, a hurricane|Forever, imagine your locked down forever|Could ya'll stand the weather?|You built for that weather?|Yo, know what'm saying?|Know what'm saying?||[Interlude: Common]|You gotta fight for what you believe in||[Verse 2: Common]|Nobody knows the troubles seen|This flick left me wondering|“What can become of kings and young kids?”|Summer dream deferred, incident occured, freedom blurred|A freedom that would only be retrieved again in words, later on|The cops, y'all know what they be on|A nigga's life is like a field that they play upon, away and gone from|Natural lifer, a soul he had to fight|Learn it himself, sleep days, stay up half the night|Amongst dead man walking, he got afterlife exercising|Developing his knack to write|Never leaving his cell, in this world he trapped himself|What he loved on the outside world, detached himself|You know the cards Blacks get dealt by the system|He drew a picture of freedom with many dimensions|This picture proved to be bigger than Black and White|A young soul named Lesra brought him back to life|It's amazing to a man what a book could do|And how certain books seem to look for you|This is the story of a champion's fall and rise|The story left me wiping my eyes|Peace Ru|You might also like[Chorus: Jazzyfatnastees & Black Thought]|Hurricane|Accuse a Hurricane|Ain't change a damned shame|It's life for Hurricane, Hurricane|Forever, imagine your locked down forever|Could y'all stand the weather?|Could you hold it together?|You tell me that you know the pain|Yo, imagine if your life was like a hurricane, a hurricane|Forever, imagine your locked down forever|Could ya'll stand the weather?|You built for that weather?|Yo, know what'm saying?|Know what'm saying?||[Verse 3: Mos Def]|Yes, I am the inescapable, the irresistable|The unnegotiable, the unchallenged [who dat?]|I am time|I scroll in measurements, control the elements|I hold the evidence, I tell the story [say what?]|I am time|I know no prejudice, I bare no sentiments|For wealth or settlement, I move forward [who you?]|I am time|You can't recover me, conceal or smuggle me|Retreat or run from me, crawl up or under me|You can't do much for me besides serve|Me well and have good dividends returned to you|Or attempt to kill me off and have me murder you|Many have wasted me but now they are facing me|Treated me unfaithfully and now endure me painfully|Plaintively, I wait to see what history will shape to be|Who's hearts will never die inside the sake of me|Angel's scribe the page for me|Keep a full account of all the names for me|And make a special mark for Hurricane who (?) patiently|[Chorus: Jazzyfatnastees & Black Thought]|Hurricane|Accuse a Hurricane|Ain't change a damned shame|It's life for Hurricane, Hurricane|Forever, imagine your locked down forever|Could y'all stand the weather?|Could you hold it together?|You tell me that you know the pain|Yo, imagine if your life was like a hurricane, a hurricane|Forever, imagine your locked down forever|Could ya'll stand the weather?|You built for that weather?|Yo, know what'm saying?|Know what'm saying?||[Verse 4: Dice Raw]|The clouds clashed and the heaven's gave birth to star|God placed it in a man on the day he was born|Convicted minutes after, a true natural disaster|Framed for manslaughter, the Hurricane Carter rising|From out the south water, like torrential rains|In the ring no opponent escaped unscathed|You can't believe the world we live in's injust|All I see is more proof, there's no place for us|They had my man Carter locked in a cage, like an animal|Drive him to the point where the mind work mechanical|Or works by remote control|It was done to all of us, they tapped directly into our soul|Either it's sing-sing, or it's bars around your mind|There's no where to run, no where to hide|In a six-by-six a guilty man cries|For repentance and lost is what innocence is||[Bridge: Flo Brown]|Same story, same target, different time|Cyclical reaction from the prisoners of the blind|Trying to fight time, it's a battle of the mind|Waiting for redemption, surviving in a bind|Same story, same target, different time|Cyclical reaction from the prisoners of the blind|Trying to fight time, it's a battle of the mind|Waiting for redemption, surviving in a bind||[Chorus: Jazzyfatnastees & Black Thought]|Hurricane|Accuse a Hurricane|Ain't change a damned shame|It's life for Hurricane, Hurricane|Forever, imagine your locked down forever|Could y'all stand the weather?|Could you hold it together?|You tell me that you know the pain|Yo, imagine if your life was like a hurricane, a hurricane|Forever, imagine your locked down forever|Could ya'll stand the weather?|You built for that weather?|Yo, know what'm saying?|Know what'm saying?||[Outro: Flo Brown]|Same story, same target, different time|Cyclical reaction from the prisoners of the blind|Trying to fight time, it's a battle of the mind|Waiting for redemption, surviving in a bind|Same story, same target, different time|Cyclical reaction from the prisoners of the blind|Trying to fight time, it's a battle of the mind|Waiting for redemption, surviving in a bind1Embed"
Black Thought,History Unfolds,2018,"History Unfolds Lyrics[Intro]|Ayo||[Verse]|I been pennin' the ""Iliad"" and the ""Odyssey""|A premonition I really had, it was prophecy|Back in the kitchen, now where we at is monopoly|The mathematician, I entered the system properly|This officially a Philly jawn, once again, it's on|I was born ringing alarms like Tenor Saw|My track record is what I ain't got a blemish on|Unless I remember wrong|Well, either way I'm 'bout to finish strong|Redemption songs of a Genghis Khan|Revenge is sworn later on, though the gang is called|You hit the nail on the head, bro, we don't bang with y'all|Your team different, we don't move with the same decorum|What I reflect is still a real feel temperature|Symptoms show I'm physically ill and still emperor|Track whisperer, carbon-colored conquistador|Kiss the jawns and make 'em cry, it's not difficult|Woah, a lot of rappers is rollin' in fear of Trotter|They far from rock solid, they soldiers, Terracotta|Of my philosophy, I'm the father like Aristotle|I will put a end to your whole saga, you Harry Potters is soft|Your rhymes E-M-O, mines is non-G-M-O|I'm a vessel, a vehicle, y'all don't see it, though|I'm comin' for the riches you stole like King Leopold|And keep the whole world on watch while history unfolds|[Outro]|AyoYou might also likeEmbed"
Black Thought,Welcome to America,2021,"Welcome to America Lyrics[Chorus: C. S. Armstrong]|Welcome to America|Where you can dream, as long as you can breathe|You can be the muh'fuckin' President of United States|And get murdered right on these streets|Welcome to America||[Verse 1: Black Thought & C. S. Armstrong]|The sins of the father my pop gave me to suffer|The friends I would follow was crack babies and hustlers|It's steel sharpen steel in the block, made me a cutler|My pen is from the future like Octavia Butler (Wеlcome to America, oh)|My grandmother suturеd a flag from bloody cotton|The fruits of her labor alas already rotten (Welcome to America, yeah, ayy)|My man said, ""Yo, it's crazy how fast that we've forgotten|That we used to pull boxes and plows like we were oxen|And cows"", without an option, and now it's this glorious|Victorious, story only pitched|For me to shut it down, they sold some of us down the rivers|It's such a poor level of thought, I get the shivers|It's insidious and it's always been hideous|I had to tread water and run, be amphibious|They do you so dirty for one, yo, what's cleanliness?|They make you wanna let off a gun into the emptiness like|[Bridge 1: Angela Hunte & C. S. Armstrong]|Preach now, lover, preach now, lover|That we runnin', runnin', runnin', runnin', runnin'|Welcome to America||[Verse 2: Black Thought & C. S. Armstrong]|Yo, I'm ill-fated and hated, I'm hella melanated|Blackness is my religion to that I'm dedicated (Welcome to America)|I follow the laws of nature by which I'm regulated|The universe my university, I'm educated|This one is for my very revolutionaries|After keeping it a hundred even though the truth is heavy|Who stand firmly and see their life is a journey|That either God or the gurney, my public defender burned me|So did the district attorney in a turbulent trial|They told me that time is master, well I'm serving it now|Tell my family I'll be making my return in a while|And every symbol of oppression, I'll be burning it down||[Chorus: C. S. Armstrong & Angela Hunte]|Welcome to America (Yeah)|Where you can dream, as long as you can breathe (Long as you breathe)|You can be the muh'fuckin' President of United States (That's right)|And get murdered right on these streets (Doo, doo)|Welcome to America|Land of the brave (Yeah) and home of the free (That's bullshit, man)|You can be a saint or a sinner or a billionaire (Yeah)|Or just stand on your feet|Welcome to America (Keep on runnin', runnin')|America, oh Lord (Keep on runnin', runnin')|Welcome to America (Keep on runnin', runnin')|America, oh yeah|You might also like[Post-Chorus: C. S. Armstrong]|'Cause when it's over, the world ain't over (The world ain't over)|What they say is what we'll do (It's what we gon' do now)|We outpowered, still have power (Still got power)|And that's what we cannot lose||[Bridge 2: Angela Hunte]|Runnin' in the shadows, got my eye on the sparrow|Tomorrow may not come, at least my soul felt this love (Uh)|If I let you go, at least my soul felt this love|Hey now, hang now, hey now, hang now||[Verse 3: Black Thought]|Now, a Black soul never passes alone|If its blood spilled on the ancestor's ashes and bone|From a pure heart, the Lord fashioned after His own|Went packaged and flown to the essence of his African throne|For every lost body, crossed, tarred, feathered, and tossed|It's no way I could measure the course or ever exhaust|But whether it's yours or mine, this American cloth|Has never been soft, while history was running its course|I ran hard from Jamestown with slaves, found Jesus|And foul demons that never be charged with malfeasance|I sat through they revival, though I never found credence|I found that we had never known shit about freedom|I've been charged with treason, I've been scarred and freezin'|I've been called a nigga and then called a heathen|When hounds found me, they couldn't even tell if I was breathin'|In America where on black men, it's open season1Embed"
Black Thought,How to Hold a Choppa,2018,"How to Hold a Choppa Lyrics[Intro]|Shit crazy||[Verse]|Dark room with the cloak draped over the mic|Colloquium light, the smoke from the opium pipe|Silk road is a code so the only advice|To bring truth to the light, play this only at night|If it's over your life, it's not only a fight|My homie called it a plight and my homie was right|How to speak truth to power is refuse to cower and teach youth|The hour of reckonin' is upon us, there's enemies among us|Essentially in more than recent memory, they hung us|Public assembly to watch death become us|Better believe it but if not, check the numbers|Gramps told my father they sold his papa for gold and copper|Even though he was the strongest cropper|Now am I wrong if I teach my son to properly hold a choppa|And how to bring down a helicopter?|What's the concept? The industrial prison complex|For niggas in the projects with they eyes shut|That still walk around blind to the conquest|That haven't really realized what's the time yet|No due process, the price is no object|When sentences match the crime, they do not yet|It's been a war on the heavily melanated|For your own security, you better be educated, listen|[Outro]|And if you don't see what's happenin', you just can't seeYou might also likeEmbed"
Black Thought,Magnificent,2020,"Magnificent Lyrics[Intro]|Uh, two fifteen (That's right)||[Verse 1]|I hurt myself to see if I could feel (I am magnificent)|Then I began to pray to see if God was real|I said, ""All Seeing, reveal to me that which is concealed""|Somethin' told me that I probably shouldn't be behind the wheel of that Bonneville|I was still feelin' kinda ill, not a dollar bill|Time to kill, tryna sign a deal|Ten years before State Prop was rock la famille|I was poppin' pills unaware that steel sharpens steel, I've grown|Droppin' my popular B-Boy poems (Magnif-Magnificent)|Took me to Amiri Baraka from LeRoi Jones|To Hajj Malik el-Shabazz from Detroit Red (Magnif-Magnificent)|And to the polar opposite of what your report said|Well, me and Sponart was playin' our part|Creatin' con art to curatin' fine art, now a nigga's a monarch|The torch head was force fed, look how the flames flicker|Now if it's what Thought said, you know the name quicker|[Verse 2]|Uh, ay, yo (I'm magnificent)|The big homie in The Smithsonian (I am magnificent)|I'm an ox, so the box niggas can't throw me in|The punishment I'ma hit 'em with is draconian|It's in me (Magnif-Magnificent), muscle memory is Pavlovian|The magnificent with a tinted skin tone|Ain't nobody fuckin' with me, keep 'em in the friend zone|Keep 'em closer than my enemy, which I depend on for that motivation|That's what keep a nigga en vogue|Fingers full of Flintstones|Louder than a motherfuckin' pimp clothes|Haters, I am the weapon, the Lord formed against those|I prefer the law of mathematics over Jim Crow's|My prose keep 'em devils jumpin' out the windows (Magnif-Magnificent)|The man tellin' you shams to go to hell if you a god damn pyramid, scam evangenical|The origin of my grace is unavailable|But you would know the name of the place is Illadel, if you a real one||[Verse 3]|Ayy, yo|(I, I, I, I, I'm magnificent)|Got the bop gun loaded up to kill one|Drop cruisin' like Top Gun through Brazil|When your net worth is millions, people too familiar|My network is real young, careful where you chill, son|I'm the magnificent|Stay playin' where them bad bitches is|Dilla, Slum Village, macknickelous|People know my style nasty as black licorice|Telephone stacks sickenin', that's nigga-rich (God damn)|Don't make me burn your wings off like the Icarus (I am magnificent)|The Lord take away the same thing he giveth us|Temptation, do not lead, please deliver us (I am magnificent)|When you a beast, you kinda cease to give a fuck|You stop listening, please tell me not this again|Begging, ""Bring back Black, the block missin' him""|To murder tracks right in front of mad witnesses|Forty-four magnificent, what the bidness is?|(I am the most magnificent)|(I, I, I, I, I'm the magnificent)You might also like1Embed"
