rapper,song,year,lyrics
Redman,That’s Where I B,2010,"That’s Where I B Lyrics[Intro: Redman + (DJ Kool)]|(YEAH BOY!) Gilla House in the buildin', nigga|(DJ Kool, eh-HEH) You already!|(Rrrah, rrrah) AOWWWW|(Ten seconds) They said I don't belong up in here and shit|You know what I'm talkin' 'bout?|(AYO! Five seconds)|(EH-HEH, EH-HEH, EH) We gon' do it like this, nigga||[Verse 1: Redman]|This that syrup niggas got lean on|You wan' be like Reggie? Dream on|You pissed off, baby? Don't get peed on|'Cause mayne, I run thangs like creamed corn|I'm like Kee-nan, Wayan, 170|Heavy on the black like Ebony|Money in the bank? Yeah boy, it better be|'70s baby, check out my melody|Places I be at, y'all don't be there|Too busy up in the club drinkin Pierre|Hoods love me, and the pilot in the Lear|Only way you get through the hood is through e-mail|Number one, boy, on the charts, I rank on it|I'ma keep it hood and Tyra can Bank on it|And where I be, you niggas gotta think on it|Spit hot shit like the mic got a mink on it|[Chorus: Redman + (DJ Kool)]|(Jersey, my nigga) That's where I be|(L.A., my nigga) That's where I be|(New York, my nigga) That's where I be|(Miami, my nigga) That's where I be|(Hands up) That's where I be all day|(Hands up) That's where I be all day|(Brick City, I got you)|(Hands up) That's where I be all day|That's where I be||[Post-Chorus: DJ Kool]|EH-HEH, EH HEH!! Aiyyo|Check this out ch'eah|I'm just here to let 'em know|We the kind of guys who get rowdy y'anmean?|Listen, wherever you be, we be aight?|Whatever you ready to do, we ready to do|Wherever you party at? We party at|Wherever you be, I be, let's go!!||[Verse 2: Redman]|Yo, when I'm in N.Y., I'm Uptown|On 1-4-5, fresh pair of Uptowns|I just scored me a mami, touchdown|Original Gunn Clappah, Bucktown|Oh! I love to kick it in Cali|My Compton girl tattooed me on her fatty|She said, ""I know you've got hoes in the Valley|Kris Kross me you gon' see the Mack Daddy""|I said ""Yo, I gotta go to Miami""|But my boy Zo Pound so I'd feel a little milli'|I bagged me a XXL, +Eye Candy+|A little bling bling got me +Fresh+ like +Mannie+|I ride through the A with a chick, dirty|Southside Philly know I get it on early|Any hood I'm in, I'm never in a hurry|I stand there, chest out, and I rep Jersey|You might also like[Chorus: Redman + (DJ Kool)]|(Boston, my nigga) That's where I be|(D.C>, my nigga) That's where I be|(ATL, my nigga) That's where I be|(Overseas, my nigga) That's where I be|(Hands up) That's where I be all day|(Hands up) That's where I be all day|(Hands up) That's where I be all day|That's where I be||[Outro: DJ Kool + (Redman)]|LADIES!! If you in the club right now|Posted up at the bar (Tell 'em)|Gettin' yo' FULL drink on|Ayo, that's where I be, UH-HUH! (Tell 'em)|Ayo fellas, now you in the club|Poppin big bottles|Makin' it rain ALL OVER THE PLACE (Tell 'em)|Ay nigga let me tell you somethin' right now|That's where I be!!|(Gilla House)Embed"
Redman,Rockin’ Wit Da Best,2010,"Rockin’ Wit Da Best Lyrics[Kool Moe Dee]|(Yeah) One two, one two|Party people in the place to be!||[Redman]|Yeah, ha ha|Let me clear my throat! {*2X*}|Gilla House niggas baby||[Kool Moe Dee]|We gon' get a lil' somethin straight here in the place to be|[Redman] + (Kool Moe Dee)|Yeah... yo|You now rockin with the best, I'm blessed|I deliver well, that's why I'm up in the S|UPS, through rain sleet or snow|I never break down, my skin made of Goretex|Heard Reggie went left, cause when I do right|Punk niggas out of spite only give me a few mics|Three best emcees, time for new light|Let the streets decide on who nice! (Let's rock the house)|You see to be an emcee is not money in the bank, or|Blowin niggas off like ""Homey we are late!""|A million dollar boss dictatin what I think, shit|His shooter's gettin real nervous in the paint|Five star when I rank, like Le Armitage|Girls lookin like Nicki Minaj, Reggie|Hip-Hop I rock steady, just check my clout|When Jersey in the building, I (rock the house!)||[Hook: Redman] + (Kool Moe Dee)|Yo, you now rockin with the best, one of the best|Best believe boy I look so FRESSSH~!|Just tellin you how I feel|(We gon' get a lil' somethin straight here in the place to be)||[Redman] + (Kool Moe Dee)|Heheh, hey, they asked me how I maintain|The rap game and the streets I can picture in the same frame|You ain't raw? You don't ball|So lose yourself, tryin to keep UP when I change lanes|My weed game green, clientele is swell|It's Cool like LL|DeBarge look alike brother, time will reveal|That I'm doin it, and doin it well! (Let's rock the house)|Even if you read braille you can feel my swag|I'm your seein eye dog with the pen and the pad|Blue collar, when I talk, you can touch|So FUCK how much money you can fit in the bag!|My gift is the gab, the street's the truth|They got a lil' lost when down South came through|I stayed in the booth and began to trip|Cause (can't nobody rock like me, hah, remember this!)|You might also like[Hook]||[Redman] + (Kool Moe Dee)|Yo, what you consider the best, what you invest|A half a mill' around your neck? Let me guess|Punchlines after punchline for a check|I did that, when GangStarr had to ""Get a Rep""|My city in debt, that's why I sound hungry|My flow dumb as fuck like Al Bun-dy|Ask Treach, I do it for my lonely|All y'all come and get it if you want me (let's rock the house)|Man, I'm a funny ass nigga|And haters gon' say ""He a funny ass nigga!""|But I'm a asset, good barbershop talk|The game without me is Wu-Tang without RZA|Pour out a little liquor how I murder it|Beef; my boys Fatburger it|Gilla - never heard of it? Shut your mouth|When Jersey in the building, I (rock the house!)||[Hook]Embed"
Redman,Rockafella (Remix),1994,"Rockafella (Remix) Lyrics[Intro]|Ayo-yo-yo-yo, you better pass it|Ayo, check this out|We coming to you live from that BOMB Chocolate City my man|Where the knotty-headed niggas and the Brick City brigade dwell|And if you don't know your fool better ask|Ayo, yo, you better pass that blunt|Ayo E, we comin' to you live with the Cosmic type stuff||[Verse 1]|Well, it's that brother coming six billion feet from beneath|And you should be peep-in' how I get smoked-out on the weekend|I swing it to my crew or down to my fam|Schoolin' mellows knock is like final exams|'Cause, it's that Funkadelic, hit you with the irrelevant|Elements, and it's coming through your blocks|Can't you smell it, trick?|Wanna copy-cat my whole format|So you get funk tracks, punch lines and skull hats|Hooouh! Got a little Redman in town|Who's that effin' clown soundin' wack with the frown?|I don't know man, but you better wonder what I would do|While loud on this staff like birds one and two|My crew runs thicker than syrup from the barrel|You get hurt up, word up, Jam-med like Pearl|Knock off from blood clot, puff on the rough block|R.I.P. my man, Rockafella, it don't stop|[Chorus]|On and on, and it don't quit|Redman rockin' on to the funky shit, come on|On and on, and it don't quit|Redman rockin' on to the funky shit|I said Jersey's in the house (Jersey's in the house)|I said Brooklyn's in the house (Brooklyn's in the house)|I said Uptown's in the house (Uptown's in the house)|I said the Bronx in the hidouse (The Bronx in the hidouse)||[Verse 2]|Newark, New Jersey, rock rock on, word is bond|I'm comin' in swarms, so turn your flashlights on|Due to difficulty, my style blows wattage across the planet|In 48 Hours like Nick Nolte|Droppin' the flavor, stay Sky high like Pager|I'm magical like Fantasia on paper|I Saw the Light like Kraftwerk, of course|When the T-L-A Rock shock the stuff, It's Yours! In your drawers Your record label got your staff gassed|Thinkin' you gonna sell two mil tapes real fast|But you flopped and your image choked like a TEC|Now, who freakin' style your ass gonna steal next?|Are there any more imitators in the house? There are no|Bust like NBA Jams, and you can have Chicago|Catch the combo, funky like a bag of Bravos|Way back, when I pumped 92 KTU in Harlem|Huuh! I just stay funky like that|Make you wanna *sniff* my style like a junkie on crack|Trick, you better back the freak up, for real now|When I break it down from Newark NJ to IllTown|You might also like[Chorus]|On and on, and it don't quit|Redman rockin' on to the funky shit, come on|On and on, and it don't quit|Redman rockin' on to the funky shit|I said Virginia's in the house (Virginia's in the house)|I said Cali's in the house (Cali's in the house)|I said Atlanta's in the house (Atlanta's in the house)|North Carolina's in the house (Carolina's in the house)||[Verse 3]|Yoo-hoo, watch the birdie!! While Red wreck your brains early|If rap was B-Ball, I'd have assists like James Worthy|Dribble the rock if you got the hots to get your knot rocked|Twice my device, Run-D.MC's from my Rock Box|Hey you, better Come Clean like Jeru|Before I take phase two and do another pay-per-view to your crew|I give a boom bip to Q-Tip|Standin' tall like Shaq, money, I'm back, this ain't Blue Chips|The new stuff, creamin' brothas like Breyer's|He's heating up — Nah, brotha, I'm on fire!|Dribble dribble, shootin' three pointers to the drum, trick|Try to take my style, FOUL, and one|DJ Twinz in the house for the nine-square|My man Shaft, you don't know, you better ask|[Outro]|Ha, that bomb Chocolate City coming to you live|For the ninety-fo' era|Ayo, you better pass that blunt, ayo, check this out|We gonna take it to you live|Where Newark New Jersey drops that chocolate funk for ya|Every day and all day, how we do it word is bond, word is day|Def Squad's in the house for the nine-fo', word is bond, word is day|They said Hawthorne Ave. got the good smoke, word is bond, word is day|Knotty-head niggas in the house for nine-fo', word is bond, word is day|Brick City brigade in the house for nine-fo', word is bond, word is day|Redman rocks on and on for the nine-fo', word is bond, word is day|Word is bond, word is bond, in the house, I'm in the house|Word is bond, word is day|You can suck my balls and lick my clip, not word bond, word to me, ehehehehehe|Word bond, word to me|Hehehehehe, word is bond, word to me|Check it out, check it out|We comin' to you live with the Cosmic SlopEmbed"
Redman,Lemme Get 2,2010,"Lemme Get 2 Lyrics[Intro]|Ladies and gentlemen|Saukrates!||[Hook: Saukrates]|Have you ever been so proud in your life|You living on your own cloud in the sky|Wanna take everybody with you|Forget one, let me get two|Have you ever been so proud in your life|You living on your own cloud in the sky|Wanna take everybody with you|Forget one, let me get two|[Verse 1]|I love traveling and seeing people|Showing the ignorant my color skin is equal|I like trying different Thai food and seafood|Making my episode of life another sequel|I like flying on Delta and Continental|First class, playing 'em elevator instrumentals|I'm in the window, got on my headphones|Listening to Big Pun and Wyclef Jean|It's like Exxon, I get gassed up|I shuffle 'round the board like Cassius|That's us when the plane land, hey man|It ain't hard cause I can do it like a caveman|Fix my Ray-Bans, I hit the hotel|Do my show, get my money, hit the hotel|Sitting at the hotel like ""Oh well!""|I call shorty that I met today at Modell's|Go girl, it's like we in The Matrix|I'm in a new city, with suitcases|I'm overseas with bills with new faces|And if you're not about that you need a facelift, yup||[Hook: Saukrates]|Have you ever been so proud in your life|You living on your own cloud in the sky|Wanna take everybody with you|Forget one, let me get two|Have you ever been so proud in your life|You living on your own cloud in the sky|Wanna take everybody with you|Forget one, let me get two|Let me get two, let me get two|Let me get two, let me get two|Let me get two, let me get two|Let me get two, let me get two|You might also like[Verse 2: Saukrates]|If it's a high life you seeking then you say it|Cause how the hell you gonna win the game if you ain't playing?|I'm in Monaco, swimming in the deep end with 3 dimes, this ain't dominos|Well maybe it was, I set 'em up to knock 'em down and go|The skeletons in the closet, I'm making a new deposit|She was never so erotic 'til we got to the exotic..tic|Now I'm thinking that this time bomb is about to explode|Got me wishing that it was different than money, contradiction is funny|I just told y'all to play the game if y'all wan' eat|The truth is it's what you make it, that's why I got my baby girl naked|Long before I bought them tickets to Turks and Caicos|We love each other, beyond under covers|That's why I'm feeling so high like them Wright brothers|Fly, I hope it never take material|For you to get your Apple Jacks cereal (Here we go)||[Hook: Saukrates]|Have you ever been so proud in your life|You living on your own cloud in the sky|Wanna take everybody with you|Forget one, let me get two|Have you ever been so proud in your life|You living on your own cloud in the sky|Wanna take everybody with you|Forget one, let me get two|Let me get two, let me get two|Let me get two, let me get two|Let me get two, let me get two|Let me get two, let me get two|[Outro]|I'm on vacation, bitch! And I'm flying high1Embed"
Redman,Whn the Lights Go Off,2010,"Whn the Lights Go Off Lyrics[Intro: Redman]|Uhh|I'm ready, I'm ready.. (yeah!)|I'm ready (what's up?)|I'm ready (what's good?)|I'm ready (you know I'm feelin real high)|I'm ready..|I'm ready (I'm ready)|I'm ready (I'm good)|I'm ready (let's go!)|[Poo Bear]|When the lights (lights) go off (go off)|You're feenin once you had a chance|That's why I (I) just (just) can't (can't) leave it alone|Ohh, ohh, ohh, ohh||[Redman]|Gilla House niggas! Yo|Hip-Hop has been my callin, ever since that I was crawlin|E. Sermon start recordin, 9-2 started ballin|Yeah, whoever woulda knew, a hot man like me survivin|Recession may have you down, a boy like me keep on ridin|I, I keep on ridin, New Jersey hold me down|No sense to blame Bin Laden, when the bomb right here in town|Y'all just didn't recognize, but I'm hopin now you know|Everybody tellin lies but y'all gonna feel||[Hook: Poo Bear] + (Redman)|When the lights, go off|You're feenin once you had a chance|That's why I (yeah) just (yeah) can't, leave it alone|Ohh, ohh, ohh, ohh||[Redman]|Let's get it! Hey, yo|Some rappers say they had it, I feel I'm gettin started|Got a little bit of change in my hand, Obama's now in office|So ""no"" is not an option, my heart is pumpin hunger|Your money's dial tone, got it? Wrong number!|I, I need my paper, gotta keep my lights on|I'm buildin somethin major, so I can count my acres (yes!)|Better recognize, hip-hop I love it mayne|For the music I will die and y'all gonna feel|You might also like[Hook]||[Redman]|Ha ha, yo|My boys said I done it, I told 'em I ain't finished|My skill's Bout It Bout It, but the money, +No Limit+|Gotta keep my nose in it, cause I plan to make a killin|Instead of sittin 'round, tryin to whip, makin millions|I, I love my job, I, I love my life|If, if God my witness, I feel I did it twice (yes!)|Better recognize, Reggie is goin forward|Baby when I'm lock and loaded, y'all gonna feel||[Hook] - 2X||[Redman]|Ay, ay, ay, I'm, I'm ready|I'm, I'm ready|I'm, I'm ready (I'm ready)|I'm, I'm ready|I'm, I'm ready, can put the whole world in my hands|Yes sir, let me at you|When the lights go out, and we got a plan|I got one ready, can put the whole world in my hands|If that plan fails, I take another route|I'm always ready, when the lights go out, out, out, out|Believe me I'm always ready|When the lights go ow-ow-ow-ow-ow-ow-out, out, out|Believe me I'm always ready, when the lights go out, out|[Hook]||[Outro: Redman]|Watch me, watch me, watch me (yes sir!)|Reggie Noble in the buildin|(I'm ready, I'm ready, I'm ready, I'm ready)|Poo Bear on the vocal chords, what's GOOD?|King David on the track, what's happenin my dude?|(I'm ready, I'm ready, I'm ready, I'm ready)|Yeah, yeah, signin off 2025|(I'm ready, I'm ready)|We love you, we love you|(I'm ready, I'm ready, I'm ready, I'm ready)|(I'm ready, I'm ready, I'm ready, I'm ready)Embed"
Redman,Cheerz,2010,"Cheerz Lyrics[Ready Roc]|I said I'm..|I'ma.. great white on the mic, servin fishscale|Livin life like I co-star with Denzel|Hip-hop been my life since kids meals|Lee jeans, label blocks and Big Wheels (uhh)|Ever since then I've been a FUCKIN problem|Feelin like Bruce Wayne, and this is Gotham|Now I got them haters watchin|Waitin for my next hit like a nigga boxin|(And the NEWWW~!) On this mic you can see I'm blessed|Some say I'm the One like KRS|Shoutout to Clue, Flex and Doo Wop|R.I.P. Big L, Pun, Biggie and 2Pac|Flow so sick somebody give me a flu shot (achoo)|I'm well done, overcooked, too hot|A booth, ProTools and a MP|That's all I need to show you that I'm a emcee (yessir!)|So you can chase the fame, cause simply|Difference is, you a Beamer, I'm a Bentley - dummy!|Now wonder where I'd be without Funk Doc|So this toast goes to Redman and hip-hop (yo)|[Hook: Ready Roc] + (Redman) + {Melanie}|Whattup Big Unc? (Whattup nephew?)|WHATTUP JERSEY? {Jersey, Jersey-ayyyyy}|(Check mic one) Check mic two|YEAH THEY HEARD ME..|How y'all feel? (Drinks on me!)|NOW WHO THIRSTY? {whoahhh-ohhhh}|(Cheers! This one's here for hip-hop)|HI-HI-HIP-HOP||[Interlude: Melanie Rutherford]|This is my life - this is my life baby|We gon' do it like this nigga||[Redman]|Yo, watch out now I talk like a old man|But still got that UHH like Jor-dan|Call in, anywhere I go it's CHEERS|Cause they yell my name like Nor-man|Walk in, look cool|Flow like the ink pen got Red Bull|Feel like I'm school, back to the basics|Handcuffin hip-hop, niggas start rapin (yessir)|And I faced it, it's a new ballgame|It's like when +Baby Boy+ met Ving Rhames|Now that's so appealin, the veteran|Still trappin, I'm back in the building|Yeah I laugh when I'm yappin' to children|But it's hard when ya boy lackin a million|I'm so brilliant, cause I work the Eastside|And do the same damn thing on the Westside (West coast!)|For hip-hop I'mma die - you fuck with it?|I'm O-Dog, I ain't lettin that shit ride!|Whoever outside with a eardrum|Old people, young people, here it come|You might also like[Hook]||[Interlude: Melanie] + (Redman)|This is my life (yo, watch out now)|Hip-Hop (yessir, yo neph' I got it nigga)||[Redman]|Yo, aiyyo neph' you can tell I love hip-hop|And me stoppin any time? I think not|Whip, the opposite of a hard top|Summertime, my rhyme's in your droptop|Yeah, the LP is ""Reggie""|I got the goods baby, I'm Don Ready|Ready, for any hip-hop freak|Even white chicks want black in 'em like Pernelli|Yeah, the rap game is star studded|It's like the NBA, you gotta love it||[Ready Roc]|Whattup Big Unc? Watch nephew|Sell more records than Wyclef crew (ill)|Haters watch me ball like the ref do|And still can't get it right like a left shoe (hahahaha)|I'm 'bout to bubble like a Lex Coupe|""What's my motherfuckin name?"" like I'm Big Snoop|Ready Roc hear the crowd scream|Now my name hold weight like a triple beam|Wu-Tang showed me how to get the C.R.E.A.M|I'm a microphone, I'm a microphone fiend|[Hook]||[Melanie Rutherford]|This is my life, this is my life|Hip-Hop, until I dieeeeee|Until I die, whoaaaaaa-ohhhhhh|Ooooo-hooo-hooooo|Cause this is my life, my life|Hip-Hop, until I diiiiieeee|Yeah yeah yeahEmbed"
Redman,Lift it Up,2010,"Lift it Up Lyrics[Redman]|Yo J. Rob|Gimme somethin that these niggas can ride to||Lift it up! (Ahhh) Lift it up|Lift it up! (This goes for all the riders) Lift it up|(out there that's liftin up) Lift it up! Lift it up|(Gilla House) Lift it up! (LAD-IES...)||Aiyyo I can't explain, why I do it big|I shut 'em DOWN DOWN and I don't care who it is|I'm from the hood nigga, uhh, I take it there (YUP~!)|Windex on my windpipes, make it clear|Your lady naked here, from that cologne on me|That can of five grand, daddy yeah roll on me|She called her girlfriend, I said you're so phony|You cats stackin me, record through the phone on me|Go 'head, record baby, I ain't never scared|I stay sinnin, I'm from Jersey where the +Devils+ is|Go 'head LIFT IT UP, you know what the hell is|Come get your groove back BITCH, like Stella did|Aowww!|[Hook]|Lift it up! Lift it up|Lift it up! (Six-fo') Lift it up (fat ass)|Lift it up! (Yamaha) Lift it up|Lift it up! Lift it up||[Redman]|You can smell that marijuana comin out of my veins|(Get your smoke on nigga!)|I'm just lookin for that hot chick to give me some brains|(Yeah, yeah, ay, ay)|I'm from the nine-zero, yeah I know how to ball|I whip a ride that's still on protocol (you lyin nigga!)|Psych I'm lyin nigga, I'm as broke as y'all|But I'm a HUSTLER and I don't sell dope at all|I just LIFT IT UP (lift it up) lift it up!|You got that kush rolled homey go on lift it up|Baby you got back, momma go on lift it up|You got that Yamaha, nigga go on lift it up|Aowww!||[Hook]||[Redman]|You can smell that marijuana comin out of my veins|I'm just lookin for that hot chick to give me some brains|(Yeah, yeah, ay, ay)|LET'S GO~! {*echoes*}You might also likeEmbed"
Redman,Fire,2007,"Fire Lyrics[Intro: Redman]|Welcome to the Red Gone Wild show-show, yeah|Yeah, yeah|For all the ghettos across America|Well all right-right-right-ri-right cha-cha-cha-cha|Red Gone Wild|Yo this is Two Tec and I'll slap the shit out of a motherfucker, Red Gone Wild|Gilla (Gilla House niggas)|Red, Gone, Wild||[Chorus: Redman & E3]|Yeah|I can feel your fire|When you niggas feel cold and your flows ain't got it no more nigga?!|I can feel your fire|Yeah nigga. You know what it is nigga, Gilla House nigga|[Verse: Redman]|Yo check me out yo yo yo|Red gone wild, more stunts than The Fall Guy|A buncha wild drunk niggas yellin' raw ha!!|While you tryna get your weight up, but we on fire|Gilla House don't die, leave da spot bone dry|I want it all, R and E-D-M-A|N, cock the semi|A little henny in me|It's like ya black hawk down, I blast like a skinny|Roll up to the jam and party like Little Penny|My watch ain't for showin' time, it's for show and tell|And I got it from sellin' dimes on AOL|I'm off the hook, lookin' young, you gray as hell|You off the hook cause punk you ain't pay your bills|Redman the truth nigga, put my name on it|Gilla House, die harder than John McClane on it|I'm smokin' sour diesel, gettin' head on my couch|From a chick that resemble Rosie Perez in the mouth|Simon Says swallow it ma, Knock don't spit it out|Y'all got fat, I got a plan for y'all slimmin' down|I ain't playin' no games nigga, I'mma take it there|Break it there, Visine your block, till I make it clear, nigga?!||[Chorus: Redman & E3]|I can feel your fire|When you niggas gettin' cold and your flows ain't got it no more you like...|I can feel your fire|Brick city on my back, Doc Grizzley on the track|Have ya hood sayin'|I can feel your fire|East coast, west coast, down south, world wide, everybody like...|I can feel your fire|Welcome me back like Carter, welcome back the father|Keep it gutta, no problems|Bitch!!!You might also like1Embed"
Redman,Funkorama(Double Green Remix),1996,"Funkorama(Double Green Remix) LyricsYeah, one room, Representing, Def Squad coast, yeah, ah, y'all know bout that? Check it||[Erick Sermon]|It goes, knick knack, patty-wack, give a dog a bone|You a customer, so kneel before me, the E|Matter of fact, like the group home, give me dap|To being the first one to bring the Zapp clap to rap|Look at that, i got the whole house jumpin'|Off the hook, like my little black book(Uhhuh)|The original flavor, Run-DMC era|Microphone terror, so who can do it betta?|I'm in the mixture, I recite funk scripture|Freeze you, like Kodak picture, cheesy|Expertise, doper than thesegrown trees|I'm on the money strap, so you can call me Donny|Fly hyper, Professional lyrical sniper|Who comes tighter, than the virgin, servin';|Last chance, so if you wanna go to rounds wit the Def Squad|Motherfucker, Let's Dance|[Hook]X2|[Redman] Funkorama!|[Erick] Yeah the place to be, for the underground|To groove to the funk sound so|Relax your mind, let your conscience be free|With E and R-E-D|[Redman] We get down like that||[Verse 2: Redman]|CAUTION! Your hearing aid is needed, stay weeded|I'm consecutively bleeding eardrums repeating|The bombzee taking the heat since I was a fetus|Rocking Adidas when I first sipped on Easy Jesus|Copastetic, how you like it, whole or shredded|Mics get breaded, saute, cause I'm a pro at wetting|I'm getting, smarter than Agent 86|You beating me?, one-on-one? Then that fight is crazy fixed|Open up that chest like Vicks, when I write them|Then leaves you marks brains, more questions than Asylum|You got a crew? You better tell them, or hide them|I stay more focused than wide lens when I'm inside them|Yo, E, Scream on these stinking MC's|Three times three, reality, virtuality, can't see|I plant seeds and MC's that can't|Fertilize their rhymes, I drop lines till they can't breathe|Shucky ducky quack quack, on that ass crack|Got blast on, I blast back, Funkorama|I got a trunk o' trauma, to smoke constant|Dramas caused by the bomb shit, love ya momma|You might also like[Hook]X2||(Redman saying beginning and end of hook until song fades)Embed"
