rapper,song,year,lyrics
Black Thought,Live Intro Performance | 2020 Roots Picnic Virtual Experience,2020,"Live Intro Performance | 2020 Roots Picnic Virtual Experience Lyrics[Intro]|Uh-huh! Two fifteen, twenty-one pound||[Verse]|I said, memory banks too strong to try and jog with|I'd probably fry your omelette on some com shit|Long fire-arms holder what I write a song with|Right or wrong, moving right along|It's a higher form of convo with the gods, I'm in dialogue with|I hear the voice of the announcer signing off, Rachmaninoff|Threw a Molotov on your doorstep|A bullet from a Glock tore through your cortex, Monarch of Melanin|They all relishing the way I'm Ralph McDaniels meets Ralph Ellison|The fine arts is elegant, dark as heaven-sent|Official intelligence presented to you by the stopper|Tell them cops it's too late to talk to me proper|Them South Philly boys is who offed Jimmy Hoffa|What hangs in the balance to the Talented Mr. Trotter|And the two-fifteen my savant crew|What can kill you in five words? That's not a haiku|What's the most powerful book?  That's not the Bible|They say; ""Do as I say do, but not as I do""|It's about time we held history liable|For survival of the most fit, let them quote this|Get the people more than only hope for the hopeless|Knowing the police headquarters is the culprit|Slugs spiral outta the four-fifth and don't miss|I give a fuck about confederate flags?|I got a heart more darker than America's past|My bars is part Chris Parker, part Malik Shabazz|And just shine like a treasure taken outta the trash|But dig it, it gets deep like a bass guitar|The fiends never say the taste is off|The CDC, done trace the cough back|To where your faith was lost at and press 69 to call back|When the Jakes provide bricks, what would you call that?|Some freemason type shit, what would you call crack?|Now we can swan dive into this or we can just fall back|I faced time with the victims, they was just all black|I'm like, what does it give to the man who's got everything?|Freedom is above and beyond duPont's Registry|You ain't racing with the baton, you're not getting me|Where you rotate in is not the proximity|Look, it's been about more than just the flesh|It's so ill, I can still never catch my breath|It's so real in the field, so protect your neck|Like you was in the Seventh Seal playing chess with death|I figure, I'll be a sage for the rest of my days|The way I surf to the stage on the crest of the wave|Like a black Pharoah that suckled on a breast of a slave|If you place me on a page don't mess up the name|It goes: T-A-R one 'I' like a monocle|The last astronomical master of the chronicle|True spelling of it is with a K and not a Q|I break it down to particles and molecules|Dark or melo, slick McArthur fellow, prophet of rage|An audio slave like Morello|I was raised in my formative stage|Right, in the ghetto where they made me not be afraid nor to settle|I'm a one and only son of young lieutenant Thomas X|Knowledge, wisdom, common sense, never mind the rest|Trying to find honour where there's absolutely honorless|The Spook Who Sat by the Door, devil behind the desk|I'm thankful that I'm wide awake for this|Diaspora's Afro pick like Hank Willis|Any activism is bad for bank business|America's always been safe for straight killers|Yo, the trail was tailor-made for me to fail|The kill or be killed all end with me in jail|It's funny how the new Mark Twain could be Chapelle|And we shut down the starving trend if we prevail|I won't be reduced to simply a trope|It proves everything that I wrote's a slippery slope|It's hard to cope and still push the envelope|When your mind is far beyond this kaleidoscope|Ayo, the way they cutthroat a brother, do we not bleed?|And from the shots, do we not run in top speed?|Whether black, blue, brown, bow-legged or knock-kneed?|Every weapon is not made by Martin and Lockheed|Are we detained if they say that we cannot leave?|Am I insane if I tell you I cannot breathe?|Messages written in languages they cannot read|Public Enemy's, Chuck D's and Hank Shocklee's|Stick with your preposterous beliefs|They pull up and park and let the block perish in peace|And this speech could be the last words of the deceased|That makes my next mixtapes a posthumous release|But listen, spilling a black man's blood so iconic|I go hard today because tomorrow's not promised|Do the knowledge, you could be crowned king Tutankhamun|God forbid, go back to packs of Top Ramen|The overlook effect's an astronaut problem|Let's count down in seconds till NASA start calling|As for Black Thought, I'm a master|Probably never be captured, Method with the last report|Sorrow is the debate, the statements and everything I create|The negative's not relative, they don't relate|That's cool, it is what it is, can I be great?|Waiting for the big payback like it's a rebate|To elevate to the V12 from the V8|A whip so fast that it's impossible to be late|And it's all love, but it's impossible if we hate|It deflates the wind from against our sails|Trying to keep in check like the prince of Wales|Toss any infidels against the rails|Heavy metal Mötley Crüe no Vincent Neil|I'm in channel but still go against the grain|If you talking about my life, it's probably a movie|Who'd play me and my wife? Taraji and Chewy|Back in the day, maybe a young Ossie and Ruby|My chops is like Canada Lee|So yours truly for the Oscar|I started smoking weed like a Rasta when we lost Cassandra|That was hard to ponder|But I refuse to break down or stay somber|While history repeats itself like a mantra|I got too much more to live for|The demon and the Lord out here in a turf war|It's the way that the whole world is worse for|Probably with the wildlife reclaiming the earth for|[Outro]|Yo, Philly stand up, two-fifteenYou might also likeEmbed"
Black Thought,Yellow,2020,"Yellow Lyrics[Verse 1: Black Thought (as Max ""Matthew"" Fisher)]|Yellow money, yellow women, yellow taxis|The smell of the city that's coming at me|Pepper head heffers in New York are never happy|Rule of threes, the main thing that attracts me is|Yellow sapphire, yellow diamonds, and gold|If loving her was the ""bing"", I guess I'm out on parole|Out of control, I was too sad to try to console|I took my hair out of my durag, went out on a stroll|To hail a taxi, a jitney, a cabbie, a gypsy, a hack|Someone to get me down 125th street|Out on the corner lookin' for a driver to lift me|To the height of a high yellow mama to kiss me|That old man mini's probably gonna to miss me|But that's ancient history I'm trying to get tipsy|Some middle mystery mix might come whistlin' dixie|And drunk from corn liquor or some bootleg whiskey|In Harlem black girls are too high saditty now|I need somebody brand new to New York City now|I need a mama who walk, talk, and look pretty now|And if I could get the milk for free, why would I buy the cow before my|[Hook]|Yellow, yellow, yellow, yellow, yellow, yellow, yellow|Yellow, yellow, yellow, yellow, yellow, yellow, yellow|Yellow money, yellow woman, yellow taxi||[Verse 2: Black Thought (as Max ""Matthew"" Fisher)]|Uh, Look|Whoever said black don't crack was wrong|I need me a saffran jawn to go platinum blonde|Matter fact, big blue eyed Anglo-Saxon swan|With the forked-tongue or horns like a Capricorn|I need an amazon viking who's physically striking|She could start off yellow then deliberately lighten her skin|Until it's brightened and visibly whitened|I mean, the polar opposite of Cicely Tyson|If you need a black lover you can go 'head, brother|I won't mess with anything less than cornbread color|Of the flesh, she might see a tan but only in summer|She's my number one and one is still the loneliest number|Without my hello, mellow, yellow amber waves of grain|I hope you're able to love me 'cause I've been raising Cain|And God don't like no ugly, so I'ma change the game|Should I even change my name? Nothing stays the same after||[Hook]|Yellow, yellow, yellow, yellow, yellow, yellow, yellow|Yellow, yellow, yellow, yellow, yellow, yellow, yellow|Yellow money, yellow woman, yellow taxi|You might also like[Verse 3: Black Thought (as Max ""Matthew"" Fisher)]|Ayo, the smell of the city that's coming at me|Yellow taxis taking me to my yellow honey|Exactly, look at me smellin' the yellow money|With my charm on my arm, I dare you to take her from me|I'ma make her love me, ayo bunny, listen to me (Ahem)|I beg borrow and steal to cop a meal|And dress with superior zest and proper zeal|I should say my middle name is ""Let's make a deal""|Because gettin' something for free in life is not for real|Last name Good, first name is Dr. Feel|If you're uptown, let me know how much time you got to kill|If you're in for a thrill and got a couple dollar bills|We will give your money back if your dreams are not fulfilled|Me and my ominous lads was on Lennox Ave|The threads we were wearin' cost an arm and a leg, don't laugh|Pulled up at the honky tonk in a cab|I said, ""Baby, don't worry, I'm payin' the tab""|When I dug in my pocket for the gusto|Dug in my pocket for the gusto|When I dug in my pocket for the gusto|I had big bills and nothing low, I had||[Hook]|Yellow, yellow, yellow, yellow, yellow, yellow, yellow|Yellow, yellow, yellow, yellow, yellow, yellow, yellow|Yellow money, yellow woman, yellow taxi|Uh, Yellow women, yellow taxi|[Bridge]|Check it out|Now around this point Bunny his best friend|His home girl, she walks up, right|She looks him up and down|Shakes her head and says||[Verse 4: Woman responding to Max Fisher]|Boy, you're actin' funnier than Groucho and Harpo Marx|But you're a shark who comes with lots of cargo|Raisin' hell up in Harlem, blowin' money like Chicago|Lookin' for you a Lillian Gish or Greta Garbo|To come between us when you're darker than Uncle Remus|Actin' like being green is the ultimate inconvenience|Like you're some kind of genius, you're hoping to find you|An octoroon, a quadroon, a mulatto, or mongrel|What does it take to remind you there's an ax held above you?|And Max, I hate to tell you but she'll probably never love you|But heaven knows you're wildest desires, I'm not denying so go on|Try some candies and pluck you a dandelion|But yellow teeth for tarter, yellow eyes is jaundice|That's a fine performance but you're not an Adonis|Even if you find yourself an Aphrodite or Athena|You'll never see Nefertiti or the true queen of Sheba|With your yellow moneyEmbed"
Black Thought,Hip Hop Nation Sirius XM Freestyle,,"Hip Hop Nation Sirius XM Freestyle Lyrics[Verse 1: Black Thought]|Uh, 215, yeah aight listen:|Up steps the one and only in the flesh|Senegalese, Sierra Leonian fresh to death|Big homie and them reps the best|Knew you knew me from somewhere|I get wrecked with Questlover|The brother get it on, bring a song|More brutal than Genghis Khan|Whose name ring alarms to fakes|You couldn't place but know I'm the truth|That's before you recognize it's the one from The Roots|Armed to the tooth, trying got take an eye for another eye|I'm from ""we hear gunfire for a lullaby""|Yo forget it, who the hell am I?|Yo I'm the reason these MC's lives became nullified|The stuff of legend, so tell me what's tougher brethren|Well I'm the blast form the past that started the present|Vision of the future: me and the super producer|And I'm ten times as smart as I'm used to being|I'm still seeing the voice through the speakers|Porsche two seaters, Jimmy Choo sneakers|Real rap remedy man, a true genius|I brought Yosemite Sam two heaters|Asking these bastards if it's any last word|Besides ""what"", ""when"", ""why"" and all them adverbs|You bout to be the next fugitive captured|Just keep thinking you can lie and live after|Slow your roll playboy, rabbit ears|Cause damn right it's on sight like Vladimir|And by the moment of time, you will be out of here|Scrap, get slapped for acting so cavalier|I'm from Philly and them cabbers don't travel there|Brothers let the heat rattle there|They don't battle there|Itching to leave you in the pool like Mike Phelps|Learning to fight might help, but that's light help|Cause the bullets make flak melt|Then just imagine what it'd do to you, even if you a black belt|Ayo my brother still concealing with a gat held|On a block where there used to be a lot of crack dealt|Lo and behold, this is information overload|I put the crowd in a trance like Paul Oakenfold|I used to be the lowest on the totem pole|Until I reconstructed my goals, left a broken mold|Setting sights on the open road|I hit them anywhere and everywhere the realness is bought and sold|Ayo they got me on the honor role|That mean, whenever speaking my name|Begin that with ""The Honorable""|T-A-R one I like a monocle|I bring the riot to a laugh, cause you comical|Look, get in that ass like your father do|Hit that catatonic chronic out in Bonnaroo|I'm psychological, jump like Geronimo|Probably get yourself knocked down like a domino|Whoa, if I don't work, then I won't eat|No, I don't Facebook, but I might Tweet|The industry is out of control like OC|So take this L on the chin like it's a goatee|I'm kinda like a cellar door, lowkey|I used to mix bottles of champagne with OE|I'm Aristotle, I can't fail, I'm OG|I came through to get free like no fee|Ayo they got me on the pedestal, trophy|Got them singing ""Damn 'Riq cheating like adultery!""|Sycamore, sitting on paper like upholstery|Noam Chomsky, I'm on an organized rhyme spree|Messing with this is borderline robbery|And that's what it is, i'm jimbrowski|Certain circles call me the Big Lebowski|It would behoove you to find out about me|[Outro]||Agh, ahhhh [claps] Whoa hohoho|You whack rappers better step your game up!|Wow, give it up for Black Thought, one of the greatest of all time!|Man, man, man, man! Man dude...|I don't know if any dude got anymore lyrics than this dude right here|The Roots are here, we celebrating the release of their new album ""...and then you shoot your cousin""You might also like2Embed"
Black Thought,American Heartbreak,2020,"American Heartbreak Lyrics[Verse 1: Black Thought]|Yeah, America the ugly|This country is deep to say the least|Ask from Louisville  Kentucky, to LA to the East|Where the race been on, but recently I been makin' peace|With the fact that Black bodies are worth more if they’re deceased|Or trapped in a nine-by-twelve, awaitin' our release|Not takin' it upon ourselves to break away and teach|The next new crop before they face the next few cops|’Cause a traffic stop at night alone could get you pop|Nina Simone said, ""What's the matter with you? Rock?|Is it my hip-hop? Hey, what's the matter with 2Pac?""|We will finish the journey from Mecca to pilgrimage|Build bridges over burial grounds, they filled with us|I grimaced upon a photo I found|A still image of a friend who said to lean on Him, like Bill Withers|I wish he was still with us|They issue moratoriums on the truth and label us 'revisionist historians'|Changin' the point of origin in all the events|Any prince with some kind of sense is all they're against|For generations, they ain't shown us that the American modus operandi|The holders, control us, and try to fold us|But, yo, watch your body|[Chorus: Ledisi & Black Thought]|Oh, America|Not gon’ bring me down today|Don’t wanna see another American heartbreak|Oh, you can't keep me down|Oh, America|Yeah, watch your body for me|I wasn’t built to breathe|I won't be another American heartbreak|My soul you won't take|You can't keep me down||[Verse 2: Black Thought]|The beast brand is strong|To each man, his own|For every Tameka Mallory in the cold hand o’ Jones|Get up like Jayla Rose so they don't stand alone|Leaders understand the code|Pawns do what they suppose|In part, this heart of stone|Is for you to make it home|If I perish when you grown|I want you to take the throne|But when drivin', you a target|Don't be talkin' on the phone|You a alien, you might as well be walkin' on the moon|When you walk into a room|Never shrink so you can fit in|Your beauty and your brilliance ain't built to keep it hidden|Your path, more like division of Richard Wright|Was written too long ago to give him too strong to be forbidden|So whether saint or sinner, here's the tenor like Kamasi|I'm from the kinda posse that's down with Ta-Nehisi|Clowns could try to box me, the hate can never stop me|I'm a product of American heartbreak but watch me|I'm still a problem, liftin' my wings|Despite the system that vilified the victim, I'm still alive and kickin'|I'ma striver, a survivor, a husband and a father from the bloodline o' kings|I move different than ya, watch ya body|You might also like[Chorus: Ledisi & Black Thought]|Oh, America|Not gon' bring me down today|Don't wanna see another American heartbreak|Oh, you can't keep me down|Oh, America|Yeah, watch your body for me|I wasn't built to breathe|I won't be another American heartbreak|My soul you won't take|You can't keep me down||[Outro: Ledisi]|Built to last strong|Nothin' gon' hold me down, no|Power, yeah, that Black power|That's how I keep holdin' on, yeah|I'm holdin' on (Holdin' on, yeah)|Holdin' on, yeah|I'm holdin', I'm holdin' strong|Holdin', holdin', I'm holdin' on|Can't nobody bring me down|I'm holdin' (Stronger)|'Cause I've got that power (I've got that Black power)|Yeah, yeah (Built to last)|I'm built to last, ooh|My, my, my, my, myEmbed"
Black Thought,Philadelphia Zoo,2011,"Philadelphia Zoo Lyrics[Verse: Black Thought]|I'm from the Jam Boys army, Riq Gees|And I never been took'en out|I grill emcees like I'm cooking out|I'm like a south philly crack house in the eighties|I'm robbing them blind, crippled and crazy|I keep the whole industry scared and taken|All types of medicine, move on up like a Jefferson|And get yours, I keep raw shit in orbit|My game like the preacher on the pulpit|The killer culprit is back, that make you shake|Your necks will break, it's P-A state|Cheese steaks and tasty cakes|I lace this style, I mastered in|Niggas thinking fast, I'm far more faster than|I'm on that thing, you couldn't even hang with nooses|Fuck around and get stomped toothless|We in your face, Jam Boys in the place, baby|Niggas learning the way the tables turning right now|True emcees out the from out the Illadelph-bow!|Ch-ch-ch-ch mad styles, and that's word|I take ya'll herbs to the death|You better keep quiet as kept|Quit huffing and puffing, I let you know a whole blood clot lot|The J-B's in the spot, a lot of emcees came to my show down|Now I'm about to put your fucking ass, low down|As you can go, so slow your roll|Without a doubt, I never been taken out by a nigga who couldn't figure|Yo, by a nigga who couldn't figure|Listen, any nigga who wanna get too close|We the utmost, Jam Boys' tracks will attack any rap host|Introducing... Yo, fuck that niggas' name|Jam Boys far too complex, stop playin'|And when it rain, it pours|We the money making boys|Porn, Slim, North and Raw|The talent that I got will will riz-ock the spot|I been in it for a minute, but if ya'll forgot|Then whoa, oh-ho ---let me slow up with that flow|Cause' if I move too quick, you might not know|How I'm homicidal when it comes to the hard shit|Two-fifteen roll on the scene, you a target|They get taken out quick, cause' I done had it my nigga|You can suck my dickYou might also likeEmbed"
Black Thought,One Shot,,"One Shot LyricsLiving in some times that's the craziest|They say these legislators are the laziest|Dedicated religious figures have gone atheist|Each and everything must change there's no escaping this||I'm on the block post apocalyptic smoke covers|Coincidentally presented by the Koch brothers|The magnitude of this is bigger than the both of us|The attitude is trying to manage not to choke from it||Go and get the bolt cutters. Open the flood gate|Any relationship I've ever been in was love/hate|The city I was living in really never was safe|For some a temporary resolution was duct tape|Now I'mma probably be on the black list|But I don't give a fuck so I'mma shrug like Atlas|And if my skepticism was a brand new practice|Would y'all be disappointed like you just got catfished?||It's cold-blooded. I'm whole-heartedly cold-hearted and swole from it|The same unseen hands still in control of it|I should be minding own like it's a gold nugget|But I'm on that same bullshit just on a lower budget||Waiting on chains that bend low|To let day after tomorrow I sit by the window|And the police state like your man Michael Winslow|My kinfolk told me there's a brand new Jim Crow||I've been going to bed at ten up at five|Hustle to the bus and ride|To the job||It's feeling hot as the Fourth of July|My lady just getting home. We living separate lives|She couldn't be one of those Stepford wives if she tried||They shot my cousin. He died. It wasn't justified|I guess I see him if I make it to the other side|The corner deli owner tell me hurry up and buy|If everybody is somebody tell me who am I?|You might also likeThe same figure who came from Anguilla|Ain't nothing different|I think I'm addicted to pain killers|I'm unpermitted to enter the village|Of Shangri La|I'm depicted as being the killa this dangerous, huh?||Half dozen in one hand, Six in the other|Yo, this is more than a suntan|; it's living color||Black as oblivion|Black as obsidian|Black as the sky at midnight alto-meridian|I am black as the porch who|With Diddy, 2Pac, and Biggie in|Black as the influence on the culture we're living in||I survived the childless circuit|Vaudevillian in|Managed inspire the Beatles and Bob Dylan and them|But did I miss the mark because I'm just as dark|As John Hendrick Clark's inner thoughts|At the time of the Harlem Renaissance||After which|Rights activists|Deviated the flight path|The black ratchedness|Putting us back smack dab|Where night catches us|We just go along for the ride|Passengers|Gluttons for punishment. Masochists|Still doing whatever master asks of us|Will this generation go down as the last of us?|Will being young men while black was hazardous?||Into the proverbial masked avenger all these pretenders|Suffer from symptoms of affluenza|I'm just thinking out loud about|Extinction and genders and plans|My grandmother definitely remembers||Listen her suits were tailor made|Sundays Mahila played|Simple familiar ways like the way she|Knelt and prayed|Well and Lord and master forgive us our trust|Pastors had us well afraid||I never listened. But I still obeyed|I got to see how the gangsters played at such an early age|When my father was there to set them to us early grave|Their mom started chasing that base like Willie Mays|My childhood was all of 40 nights and 40 days|Trouble was my ball and chain|Shorties would call me names||Humble beginnings black daughters what that all became|My journey from a dirty hallway to the hall of fame|Music my therapeutic way to deal with all this pain||I was headed for the drain|Soaking before the rain water came|And chaos that's when the order came|I started what I'm supposed to in life|Trying to move out of the dark and closer to the light||They say when you get a chance to do it over|. Do it right|Because tomorrow was a promise every time we say ""Good night""||Listen|Dope Shot|Mug Shot|Gun Shot|Jump Shot||Take your pick. But you only got only one shot|Advice from a school teacher to a young tot|Applying a sticker to a Spiderman lunch box||When even role models tell us we're born to be felons|And we ain't getting into Harvard or Carnegie Mellon|And of these other people's blessings we've grown to be jealous|It's not fair that's all they can tell us||That's why I hustle hella hard|I don't celebrate a holiday|That could be the day a brother could have struck the lottery|I refuse to ever to lose or throw my shot away||Or chalk it up to just another one that got away|So I'm unapologetic|I'm on my calisthenics|If I had giving it all I got I can not regret it|||My final destination's different from where I was headed|Because I'm going to shoot for the stars to get it||One shotEmbed"
Black Thought,Noir,2019,"Noir Lyrics[Verse 1]|A young inmate|Who knew his fate|Was truly great|Had to escape from the chains|That brought him to the States|To save face|He made more than a few mistakes|While back-tracing his roots|Like Henry Louis Gates|Respectfully, the trajectory|He remained in it|He tried to walk on water|Instead of wade in it|He went from cradle to grave|He's been a king of the slaves|The menagerie of America|He was made in it|Instead of waiting for Superman|His people had a plan|They were sticking it to the man|Whose energy was spent like solid gold|Uberman|'cause everything he did came back|Like a boomerang|A ruler without a throne|The ruins are not of Rome|Intruder without a home|A heart made out of stone|A blade made out of bone|The skin of a copper tone|A loner but not alone|The child that's got his own|N-O-I-R|[Record Scratching]||N-O|N-O|N-O-I-R||[Verse 2]|The wave took some time to catch on|The spade was grey|He wasn't afraid to press on|Neither was his child|Because he embraced the weapon|That aimed at the same prize|His eyes were kept on|Surviving on soup kitchens, bread lines|And newspaper clippings|When he was in the headlines|For being degradated|Segregated|And red-lined|For blue-collar crimes|That could've got him fed time|Where funds is critical|And sons is killable|That unfulfillable|40 acres, untillable|To make it [jenable?]|Would've taken a miracle|I pray for the earth|The day the meat will inherit you|I'm singing as [?Joyce]|But couldn't lift every voice|Society in life and death|Is making a heavy choice|Lifting a heavy weight|With so much hella hate|That every day I await|Is a reason to celebrate|N-O-I-R|You might also like[Record Scratching]||N-O|N-O|N-O-I-REmbed"
