rapper,song,year,lyrics
Redman,I C Dead People,2003,"I C Dead People Lyrics[Verse 1: Redman]|Word is bond, Redman makes the kids run|I'm seeing dead people creepin' on my income|Piercing the ear drums, how the fuck he do it?|Got little miniature Redmans, crawlin' into it, cause my|Back against the wall get to actin' like a fool|That's what happens to students, when you keep 'em after school|I stay a wild child, beef, bring it like ""Raow! Raow!""|My guns go boom, boom, and your guns go pow pow!|Still, I feel a chill, bumps in my body|The spirits of other MC's records in the party|Cause, me being, the man that I am|I'm awfully hunted by them guns with wide lens on the scope|Sucka, you miss, I'm a get my laugh on|You fuck around and woke up, with the stash gone|How I spaz on niggas is ugly|You got the game fucked up on makin' the money|See I don't say I'm thugged out, but I know my choice|Back up plans, got back up; if I blow my voice|That's why I'm Brick City, can't wait to put my niggas on|To see us perform, we sellin' out at Ticket Tron|What I'm doing is wrong, but It lasts long|Yo, toast the niggas that passed on|Get it while the gettin good, whole life with a grip|Cause when it's gone, that's it, that's it, that's it!|[Hook 2X]|I'm seeing dead people creepin on my income|You win some, you lose some, but you never run||[Verse 2: Redman]|(Yo what's on, come on)|Redman it's the war head; BOOM!|Nigga I don't die, I was born dead|Top of the mornin' to ya, I wake up like a born loser|The world is my Bermuda; Triangle and I'm lost in it|I'm hearin' voices saying ""Red, the wanna put holes in ya authentic""|I walk among winners and I put out work, nigga|And I don't stop, until I squirt|Haters hate on, you can tell the rest of the class|I can see the evil in you, through a masculine task|Smoke the greenest grass I live by the hand of god|That me, ya boys, or ya guns won't leave a scar|You niggas too hard and not ready to scrap|Knowin' damn well, ya moms raised you better than that|Redman the weirdo, I'm my own dirty clique|With 35 KO's nigga I'll make it 36!||[Hook 2X]||[Verse 3: Redman]|Thou shall not fuck with raw, Funk Docta|Takin' ya breath when I drop ya|I feel for you cause cats, try to test me|You a waiteress set of an MC, check please|Been waited way too long, now it's time to put Gilla on the map|Gilla on ya back, same Zombies, from Phila on attack|Niggas want it back, Triggas on the map|Won't stop me, I'm not a quitter that's a rap|If I was just broke you wouldn't notice me|Ha, Ha, but look at the bright side my man|Nobody really planned to fail, you really failed the plan|Gotta keep the bomb like an Israeli hand|My music's killa, your's girlie; Scram!|I can hang out in the same place as my fans|Let 'em touch me, feel how far that I swam|Look in my eyes, ya noddin to sleep|It ain't a watch, as Eminem, providin the beat|That's why..|You might also like[Hook 4X]Embed"
Redman,Lick a Shot,2001,"Lick a Shot LyricsSmokin! (Okay!)|{*monkey sounds: oooh oooh ahh ahh ahh*}|Here we go.. smokin! (Okay!)|{*more muted monkey sounds*}||[Redman]|Yo, yo.. jungle habitat, peep the wildlife in the open|Off the hook, nigga dial twice if it's broken|Doc, wall to wall with a mic and I'm loc'n, shit|You might find termites in the chokin(?), yes|D.O., my wood grain say, ""Fuck P.O."" (Okay!)|And I'll prove it when I redline a buck-three-oh|Hoes wit it, but never gave a fuck befo'|I'm frontin a hundred on top, and ones below|Bitches - fuck you star hoes, my hoes run out|Department stores with alarms and bar codes on|Think you catchin me and my bitch? You dead wrong|I'm over here prepared, blowin a air horn|{*BLAAM!*} You niggas talk widdit|I do it blind blindfolded without walkin with sticks|As dark as it gets, you slept in the Bricks|Now you lose - like e'ry year, you betin the Knicks|We walk, dogs with more balls than pool rooms (Okay!)|Attitude wolf, I react to full moons (aoooooo)|I, shoot up the place so y'all can see|You stuck up like them white boys on Harley's be|[Hook: Redman]|Are you ready to get, high with Doc (Okay!)|If you high nigga then lick a shot (That's right!)|All my niggas out in Brooklyn keep your heaters cookin|Keep the mamis lookin (Yeah yeah!)|Are you ready to get, high with Doc (Okay!)|If you high nigga then lick a shot (That's right!)|All my niggas out in Jersey keep smokin the hershey|Keepin your money thirsty (Yeah yeah!)||[Redman]|Yo, yo dawg, I'm an MC, I don't think how you rap stars'll think|I rush you, like you made the last call for drinks|My pipes burst and I ain't installed the sink|A radiator, I keep it in the car to mink|Chk-chk, yo trail the Bricks where I wrestle grizzly bears (Okay!)|And stick a track for it's snare and kick|When it's committed, damned if you see 'em again|Cold-hearted, leaves fall off the tree on my Timbs|Help me; I keep the flow cold like your wrists|The words practically geronimo off the disk|When Flex bomb it look, everybody runnin|You bitches goin wild, even Kitey wanna tongue 'em|I'm like the Gooch, lookin for Arnold Drummond|Walkin with a trenchcoat to part the pumpin|Like MJ, I wanna be startin somethin|Whoever ain't widdit, gotta move widdit|One-fo'-fo' hydro smoke to choke on (Okay!)|Branson holdin handguns to toke on|Uptown with Big L watchin over|He tell me there's NARC's parked on the shoulder|(Look over there) I don't care, cause I'm drunk as hell|Shit I do eighty on a speed bump to bail|Doc Deebo, keep both cannons on reload|Weed keep my fingertips yellow like Cheetos|You might also like[Hook]|Are you ready to get, high with Doc (Okay!)|If you high nigga then lick a shot (That's right!)|To my niggas in Atlanta that, carry the hammer|Wrap 'em with bandanas (Yeah yeah!)|Are you ready to get, high with Doc (Okay!)|If you high nigga then lick a shot (That's right!)|To my niggas in the Chi, that smoke on the lai|Proceed to gun-fire (Yeah yeah!)||[Redman]|Yo, to my bitches, my niggas jump up|It's Elmer Fudd with the shotty pump, who want duck?|Ride in my hooptie, back, slumped up|Five niggas with me, strap, pumped up|Dump Forrest Gump, hand on the pump|Janitor, gettin drunk off a janitor drum|Way I spit, on my tongue, I branded the gun|Tarzan, I rap loud, animals come..|.. I'm on top of a giraffe neck|Throwin spears, I'm Def Squad in both ears|Y'all niggas ready for streets? Here it is|Circle status, with no pyramids||[Hook]|Are you ready to get, high with Doc (Okay!)|If you high nigga then lick a shot (That's right!)|To my niggas in the West that walk without a vest|That just brrrrrap (Yeah yeah!)|Are you ready to get, high with Doc (Okay!)|If you high nigga then lick a shot (That's right!)|To my bitches in the Bricks that get they money quick|That get they pussy licked (Yeah yeah!)|Are you ready to get, high with Doc (Okay!)|If you high nigga then lick a shot! {*BLAM*}Embed"
Redman,Put It Down,2007,"Put It Down Lyrics[Intro: Method Man, Timbaland & Redman]|I got it, c'mon nigga|Yeah|Oh Oh|Yeah, yo||[Verse 1: Redman & Timbaland]|Yeah get, nigga, Redman got fire nigga|Shots'll ring your hood when I'm high nigga|Shots of Cuervo are fucking up my liver|Shots from the cameras on my niggas|Girlfriend drunk, so I'll jump around with her|I step inside, you're quiet like a mime nigga|My watch do more things than James Bond nigga|I'm gonna do it now, I ain't done trying nigga|Put it down, put it down, put it down, girl|You better grind cause you ain't spending mine girl|When Timbaland plan and I'll do the ground work|Whether you in Timbs, Air Force, or Converse|Let me see the high niggas on the left side|And hope muthafuckas smokin on the right side|You sayin ""Fuck Gillahouse"" nigga likewise|This is how I walk up on your ho - ""Hey!""|Put it down|[Hook]|Put it down, put it down, put it down|(Niggas, you gots to get down, niggas you gots to get down)|Put it down, put it down, put it down|(Bitches, you gots to get down, show you how we put it down)|(Get nigga)|Put it down, put it down, put it down|(Niggas, you gots to get down, niggas you gots to get down)|Put it down, put it down, put it down|(Bitches you gots to get down, show you how we put it down)||[Verse 2: Redman & Timbaland]|Who am I nigga? That dude who arrive nigga|With a blueprint to all your supply nigga|Fifteen percent tint on the 'fire nigga|Sometimes I don't know what's inside nigga|Let me show you how Bricks get it live nigga|The Time Warner's of the block, showtime nigga|I hit a chick, kick her out, I ain't battling her|A goldigger I can see the green mile in her|Put it down, put it down put it down fool|The flashy ones get robbed in the bathroom|""Yo get up, yo it's jewelry - it's costume"" (Hahaha)|Rollin like drunk cowboys at high noon|Let me see the high niggas on the east side|And hope niggas get high on the west side|A punk nigga outta line, he get checked like|I roll up on his ho and say ""Hey!""|Put it down|You might also like[Hook]|Put it down, put it down, put it down|(Niggas, you gots to get down, niggas you gots to get down)|Put it down, put it down, put it down|(Bitches, you gots to get down, show you how we put it down)|(Get nigga)|Put it down, put it down, put it down|(Niggas, you gots to get down, niggas you gots to get down)|Put it down, put it down, put it down|(Bitches you gots to get down, show you how we put it down)||[Verse 3: Redman & Timbaland]|Look in my eyes nigga, you see a great ball of fire nigga|My trail is blazing, that's right, I'm high nigga|A hard hip hop hitman for hire nigga|My rims are so big, I fucked my alignment up|Grown as hell, I don't throw signs nigga|I continue to Flipmode's like Rha Digga|Barbershop talk, come get you a line nigga|It's permanent press steam on the iron nigga|Put it down, put it down, put it down girl|Wherever you pop shit you get found there|Bitch you hot, little tacky with the horse hair|Gillahouse, it's your year and it's on baby|Where them high muthafuckas on the left side|I know there's drunk muthafuckas on the right side|You sayin ""fuck Redman"" nigga likewise|This is how I walk up to your ho - ""Hey!""|Put it down|[Hook]|Put it down, put it down, put it down|(Niggas, you gots to get down, niggas you gots to get down)|Put it down, put it down, put it down|(Bitches, you gots to get down, show you how we put it down)|(Get nigga)|Put it down, put it down, put it down|(Niggas, you gots to get down, niggas you gots to get down)|Put it down, put it down, put it down|(Bitches you gots to get down, show you how we put it down)||[Outro]|Gillahouse|Gotti Clique|Yo Brick City, you know what it is|Holla atcha fuckin boy|Bring em backEmbed"
Redman,News Break,1992,"News Break Lyrics[Interlude]|In Los Angeles— In Los Angeles— In Los Angeles— In Los Angeles—|In Los—  In Los—  In Los Angeles— In Los Angeles—|In Los Angeles— In Los— In Los Angeles— In Los Angeles—|In Los— In Los— In Los Angeles— In Los Angeles—|In Los— In Los An—|In Los Angeles, law enforcement officers and troops are trying to make it a calm weekend in that troubled city|As you know there has been, uh|Now the death toll there is up to thirty-five|And there've been perhaps fifteen-hundred injured out there|We're gonna begin our coverage with Jim Hanchett|Standing by in Los Angeles, Jim?|Reggie, Reggie|What the hell you doing here?|Reggie, help me, man|No!You might also likeEmbed"
Redman,Freestyle Freestyle,2007,"Freestyle Freestyle Lyrics[Intro]|Redman in the house, ya don't stop|Gilla House in the house, ya don't stop|Def Squad in the house, ya don't stop|Wu Tang in the house, ya don't stop|Hip-Hop in the house, ya don't stop||[Post Chorus]|Redman gotta light that green|People always say, ""What the hell does that mean?""|[Verse 1]|Wussup homeboy I'm a muhfuckin' rider|Custom made Airs and my shoes never tied up|Hardcore shit, do it eazier than wider|While you sittin' home gettin' baby mama drama|Jersey, Uptown - go pick my weed up|Broke? I ain't turning your C to a D cup|Bitch I'm a G! I never give my keys up|Not even half if you didn't sign a pre-nupt|Watch how we thump|I'm 'bout my bid-ness|You about to go downtown like the shiznit|Witness! Yeah boy|I get ya dumb like white people lookin' for weird noise|Hood down, got B. Smalls on my white tee|And my chain look like an italian icee|Redman nigga|Grind like brakes cause I'm after that cake like Steadman nigga!||[Hook]|Freestyle, Freestyle, Freestyle|Freestyle, Freestyle, Freestyle|And everywhere I go I kick a freestyle|And every time I move these women freestyle|Freestyle, Freestyle, Freestyle|Freestyle, Freestyle, Freestyle|Redman gotta light that green|People always say, ""What the hell does that mean?""|You might also like[Verse 2]|Okay yo, I got Bricks in the building|Young kids out here, flip ya like Wilson|Pilgrim! There it is|The block is Tina Marie, yeah I'm on my square biz|Turn up the kid like volume ten|And you could brown-nose me 'til the album in|You was hot when your style was in|Now ya lookin' at Gilla, ""I wish I was down with them""|No time to turn back, I keep my eyes focused|Slow like I'm on the I-95 smoking|Like Ocean's Twelve|When I'm postin' smell|My zip lock when the red line open|Fat girls like, ""Yo that's my hero.""|Enough of them to pull a Five-Five-Zero|Incog-negro, after the cream|I'm in your hood like (WatchTime?) magazine|I mean, for bullshit my nose keen|And only takes one hit to get in those jeans|It's not your ass, girl it's your brain|Now when I hit it I keep the chicken lo mein|Back on the train like ""Who the hell are you?""|I'm Doc, I bring heat like number 32|Brick city niggas, yeah yeah a rider|La-La-La don't steal my damn lighter|See I'm on point, never catch me slippin'|Storch on the track, watch how Reggie rip it|Sniff it, you'll know it's on again|Walked in this muhfucka like I own da bitch|I'm not in Cancun|I'm out in Grant tomb|On one wheel throwing it up like, ""Man move!""|Back on my grizzly, yeah take that|You want the crack|I prepared it ASAP!|[Hook]|Freestyle, Freestyle, Freestyle|Freestyle, Freestyle, Freestyle|And everywhere I go I kick a freestyle|And every time I move these women freestyle|Freestyle, Freestyle, Freestyle|Freestyle, Freestyle, Freestyle|Redman gotta light that green|People always say, ""What the hell does that mean?""||[Verse 3]|Wussup homegirl we a muhfuckin riders|Met her outside of the Copacabana|Far from a sucka, pull out the 'lama|And tell on myself like, ""Yo well your honor...""|See, I blast on sight when I move|That battery pack on my back stay full|I ain't no joke, I keep y'all steppin'|Doc got next nigga drop y'all weapon|Screen on my mic got hash tar resins|Engineer fucked up, laughing all reckless|I'm like, ""Shutup! Gilla house got this.""|Arms grew longer for my short pockets|Stop it? I wish I can|I'm trying to be building green like MGM Grand|Get it? Redman, who the fuck are you?|Got weed? Let me bust a U nigga!||[Hook]|Freestyle, Freestyle, Freestyle|Freestyle, Freestyle, Freestyle|And everywhere I go I kick a freestyle|And every time I move these women freestyle|Freestyle, Freestyle, Freestyle|Freestyle, Freestyle, Freestyle|Redman gotta light that green|People always say, ""What the hell does that mean?""||[Outro]|Gilla, Gilla, Gilla, Gilla|Yo Fabian, what's up nigga?|WKYA|We-we-we-we be kicking your ass radio|Bitches...bitches?Embed"
Redman,I Love Hip Hop,2018,"I Love Hip Hop Lyrics[Intro: Redman]|Yo, yo, yo, yo!|Yo. Yo, yo, yo, yo!|When I say Red, Y'all say Man|Red (Man) Red (Man)|When I say Red, Y'all say Man|Red (Man) Red (Man)||[Hook: Redman]|Sawed off shotgun, hand on the pump|Sippin' on a 40, smokin' on a blunt|Bust my gun, Redman didn't jump|La, la, la, la, la, la, la, laaaaa|I said sawed off shotgun, hand on the pump|Sippin' on a 40, smokin' on a blunt|Bust my gun, Redman didn't jump|La, la, la, la, la, la, la, laaaaa|[Verse: Redman]|Peace to B-Real, I got the Marijuana plant on the G-grill|I hit bong like (Sniff), then I refill|Brush my shoulder, flex on 'em like Meek Mill|Yeah, Reggie home, I got a plan for 'em|The eyewitness news checkin' on the brainstorm|The champion, when I talk that jazz|Utah, tell Karl Malone I got a ring for 'im|I'm supreme, street smart marine|Hook off like Kareem tryina stop my ling cuisine|The hood ain't ready, my publishers said Reggie wrote it|My track record like Jesse Owens, fast|I'm going hard, no easy pass|I'm getting all this money with my greedy ass|Toe-tag 'em, zip up the body bags|My closet got kicks like Karate class|Let's Go!||[Hook: Redman]|Sawed off shotgun, hand on the pump|Sippin' on a 40, smokin' on a blunt|Bust my gun, Redman didn't jump|La, la, la, la, la, la, la, laaaaa|I said sawed off shotgun, hand on the pump|Sippin' on a 40, smokin' on a blunt|Bust my gun, Redman didn't jump|La, la, la, la, la, la, la, laaaaa|You might also like[Outro: Redman]|Yo, yo, yo, yo!|Gilaaaaaaaaa|Yo. Yo, yo, yo, yo!|Yeaaaaaaaaah|Yo. Yo, yo, yo, yo!|Yo, yo, yo, yo!|Hahahahaahahaha|Reggie Noble Yo. Yo, yo, yo, yo!|You back baby!1Embed"
Redman,Go Hard,2015,"Go Hard Lyrics[Intro]|Whoa whoa whoa (yeah)|Whoa whoa whoa (yeah) (I'm high as a muhfucka man)|Whoa whoa whoa (yeah) (straight up we gon do it like this nigga)|Whoa whoa whoa (yeah) (Ow!)||[Verse 1]|Ay yo, I hop out the car|Women gather 'round like ""Oh my God, he's in my iPod""|Peace to the god, sayonara bitches|There's no second time around like Shalamar|Hit the New York bar, high on the broccoli|Then hit Queens for a queen like King Jaffe|Sixteens I go off like Biz Markie|Sixteen rounds, I buck like Milwaukee|Come on ride, it sounds like homicide|All you marks will know it's the other guys|Gettin' fly while rap is in danger|Six guns, one man, thirty six chambers|Brick city on board like a campaign|And we ain't drinkin' 'less Don is the champagne|Got flows more looser than your spare change|Look dummy, we ain't never in the same lane|[Hook]|You gotta either go hard or go home|You know a nigga like me keeping that chrome|And when you hear the women hittin' my phone|You know a nigga like me'll go hard|I go hard, I go hard, I go hard, I go hard|I go hard, I go hard, I go hard, I go hard||[Verse 2]|Hey, the same chick I tell you you cock blockin'|That's the same chick you take to go shoppin'|Young niggas run on the vet, I bhop em|Leave 'em talkin' through the box like Troutman|That's why a nigga act so hood|I roll up looking at you like ""what""|I can't lie but I like to floss|R8, feet on the gas pedal like *skrrrt*|New Airs on, pimp is in motion|Hot chicks love it how I kick it and coach 'em|They'll do whatever, I'm richer than both 'em|Vegas, I may get eleven on a ocean|Whoa, you can't do it then allow me|I show y'all a real cannon, body|I yell ""Action"" no Slater's clappin'|It only sound like Savion shoes was tappin'|You might also like[Hook]|You gotta either go hard or go home|You know a nigga like me keeping that chrome|And when you hear the women hittin' my phone|You know a nigga like me'll go hard|I go hard, I go hard, I go hard, I go hard|I go hard, I go hard, I go hard, I go hard||[Verse 3]|Yo, how you gonna find another nigga like me?|Even my inner-like me doesn't like me|I'm so cocky haters wanna mock me|But they styles sloppy like aisles in a swap meet|Your barbershops couldn't fade it|Finally the weakest links get eliminated|All you young boys that yellin' out ""We made it""|How you gonna create what I elevated||[Hook]|You gotta either go hard or go home|You know a nigga like me keeping that chrome|And when you hear the women hittin' my phone (what's up girl?)|You know a nigga like me'll go hard (Let's go)|I go hard, I go hard, I go hard, I go hard (Gilla House nigga)|I go hard, I go hard, I go hard, I go hard|[Outro]|I'm going haaard|Ba-dum tss!|And that's the showEmbed"
Redman,Zugga,2020,"Zugga Lyrics[Intro]|Are you havin' a good time?|Uh, yeah, ho, oh, yeah, uh|So incredible|Yeah, uh, check me out||[Verse 1]|Jersey, baby, where I eat (Huh)|Fresh out the gym, 350’s on the feet (Yeah)|Rubicon Jeep kitted out|How I keep relevant Tommy Hill can't figure out|(Are you havin' a good time?)|Club is wylin’, I just stepped in (Huh)|This chick was lookin' like Thelma Evans|I pushed up in her direction|I said, ""I'm Doc, not Department of Correction""|I don't give a fuck, your boy relaxed (Ho)|I gotta watch your back, iTune app|Look bruh, I'm movin', I get that bag (Huh)|You're runnin' in place, gettin’ hip-hop abs (Haha)|(Are you havin’ a good time?)|Middleweight champ, Def Squad camp|Slick with the words? You're (W)right like Vance|The man chicks want to sign they implants (Huh)|Raise my gun like I got strict parents (Let’s go!)|So hood, what about you?|Money on the books, got no IQ|'90s at NYU - bitches|Fu Schnickens practicin' gun-fu|(Are you havin' a good time?)|I was out there when BIG got shot (Ho)|And ever since then, I move like SWAT|An OG like B. Hop, still in the ring|I’m angry, I'm Idi Amin|About that green like what! Yeah|(Are you havin' a good time?)|[Chorus]|Zih Zih Zih Zih Zih, Zih Zih Zih (Ho)|Zih Zih Zih Zih Zih Zih|(Are you havin' a good time?)|Zih Zih Zih, Zih Zih|(So incredible)|Zih Zih Zih, Zih Zih Zih Zih Zih Zih|(Are you havin' a good time?)|Zih Zih Zih, Zih Zih|Zih Zih Zih (Ho), Zih Zih Zih Zih Zih Zih|(Are you havin' a good time?)|Zih Zih Zih, Zih Zih (Let's go, nigga!)|Zih Zih Zih, Zih Zih Zih Zih Zih Zih|Check me out||[Verse 2]|No VVS's on the wrist|So I could raise my fist up like Kaepernick (Uh)|Get the place a little hectic|Loc Dog mama say, ""Red, yeah, he that shit!""|(Are you havin' a good time?)|What y'all want? Huh, we want the bud (Ho)|Photoshop how I get uglier|Back in the game with no plug|Time to school y'all, that's why I walk in with a sub (Get 'em!)|I don't give a fuck, I'm MPV|Flint even know how this MC Breed|Look bruh, I'm movin', no time to lank (Huh)|Top 10, that's what the Shabba Ranks|(Are you havin' a good time?)|Around the barbershop, niggas talk (Ho)|'Til I get out my car and let it park|I stunt, nigga, with little money I got|Fugee Mode, bitch, you ready or not?|Stop! Let's go! Homie, you are no frill|I'm a big deal like when Raina got killed|Every little thing I do soul for real|Behind the wheel like DJ Tameil (Skrt skrt)|Youngin', I ain't with that (Ho)|I'm about money, still get a WIC check|(Are you havin' a good time?)|Retarded flow, my dad had incest (Uh)|I see niggas, I don't make a diss track at all|Yeah (Are you havin' a good time?)|You might also like[Chorus]|Zih Zih Zih Zih Zih, Zih Zih Zih (Ho)|Zih Zih Zih Zih Zih Zih|(Ladies and gentlemen, are you havin' a good time?)|Zih Zih Zih, Zih Zih (Uh)|Zih Zih Zih (Ho), Zih Zih Zih Zih Zih Zih|(Are you havin' a good time?)|Zih Zih Zih, Zih Zih|Zih Zih Zih (Ho), Zih Zih Zih Zih Zih Zih|(Are you havin' a good time?)|Zih Zih Zih, Zih Zih (Let's go, nigga!)|Zih Zih Zih, Zih Zih Zih Zih Zih Zih|(Are you havin' a good time?)|Zih Zih Zih Zih Zih, Zih Zih Zih|(Ho - so incredible)|Zih Zih Zih Zih Zih Zih|(Are you havin' a good time?)|Zih Zih Zih, Zih Zih (Uh)|Zih Zih Zih (Ho), Zih Zih Zih Zih Zih Zih|(Are you havin' a good time?)|Zih Zih Zih, Zih Zih|Zih Zih Zih (Ho), Zih Zih Zih Zih Zih Zih|(Are you havin' a good time?)|Zih Zih Zih, Zih Zih|Zih Zih Zih, Zih Zih Zih Zih Zih Zih|(Are you havin' a good time?)|Zih Zih Zih Zih Zih, Zih Zih Zih|(Ho - so incredible)|Zih Zih Zih Zih Zih Zih|(Are you havin' a good time?)|Zih Zih Zih, Zih Zih (Uh)|Zih Zih Zih (Ho), Zih Zih Zih Zih Zih Zih|(Are you havin' a good time?)|Zih Zih Zih, Zih Zih|Zih Zih Zih (Ho), Zih Zih Zih Zih Zih Zih|(Are you havin' a good time?)|Zih Zih Zih, Zih Zih|Zih Zih Zih, Zih Zih Zih Zih Zih Zih|(Are you havin' a good time?)|Zih Zih Zih Zih ZihEmbed"
