rapper,song,year,lyrics
N.O.R.E.,Get Down (Ooou Ooou),2015,"Get Down (Ooou Ooou) LyricsHaha, haha, oh boy, N-O-R, N-O-R, oh|I got another one, 'nother one, 'nother one, oh|With Timbaland this time, time, haha|With Timbaland this time||[Timbaland]|Ooh, oooh, get down come on, ooh, oooh, get down come on|Ooh, oooh, get down come on, ooh, oooh, get down come on||Uh, you see just how I roll nigga, roll nigga|Bulldoze, roll o's nigga, o's nigga|Timbaland with that beat so, beat so|Homey with that cheap dro, Miami and that beach so|Drink up more heat though but only for a beat though|Catch me at ? ? with brands up at Ecko|To all these niggas frontin' actin' like they wantin' somethin'|Niggas tryin'a rock me to sleep like ? ? does it|Na-na, and I ain't gotta call for it|Na-na, hell nah ain't gonna fall for it|Always with good roll on tour gotta stall for it|I ain't them other dudes with braids and a pink fro|Niggas only creep through the hood just when they tip toe|Waitin' till your mans come home, gather your boom box|Niggas never been in them real clubs like ? ?|So is you men or mice or, I'm in the candy paint|Old school iller ?, drinkin' that Jaegermeister|[Timbaland]|Ooh, oooh, get down come on, ooh, oooh, get down come on|Ooh, oooh, get down come on, ooh, oooh, get down come on||[Female]|Ooh, oooh, ooh boy come on, ooh, oooh, ooh boy come on|Ooh, oooh, ooh boy come on, ooh, oooh, ooh boy come on||Now, go head homey you can call me your henchman|Cause all them dudes dumber than Jessica Simpson, stupid|Courtney Love, stupid, you ain't a thug stupid|Deep down you just really need a hug stupid|Ha, ha, while I'm travelling Vegas|Luxory hotel, pyramid spaces, room service|Room service, and I don't like fake dudes|Hate fake gangstas and hate fake boobs|Tear that make-up on, a little mascara|A little Britney, a little Aguilera|Black girl ass livin' the Riviera|Nah I ain't Justin, won't cry you a river|Lie you a river, won't try you a river|But stone you a river, what, clone you a river|Bone you a river, what, or throne you a river|I'm a alcoholic, shorty could you loan me your liver, hey||[Timbaland]|Ooh, oooh, get down come on, ooh, oooh, get down come on|Ooh, oooh, get down come on, ooh, oooh, get down come on|You might also like[Female]|Ooh, oooh, ooh boy come on, ooh, oooh, ooh boy come on|Ooh, oooh, ooh boy come on, ooh, oooh, ooh boy come on||Yeah, uh, figure deal us, them niggas real us|For years niggas bought our slang, niggas steal us|Ha ha, nah mean, nah mean|See me with the nah mean, give a nigga nah mean|So can you really hear all that|Norey-orey's got a hit, gotta figure deal that|Bang on bedroom backboards|Treat her ass like a layer, so now I gotta slap boards|Slap boards, for a hard nail cores|The same as G4's, nigga got the energy|Even on that late night, Norey got energy|Even on that wake up fuck I got some energy|Even on that quickie mami, papi got some energy|Sly nigga, tear the walls off crotch|I snap your girlfriend's, girlfriend's, girlfriend's watch||[Timbaland]|Ooh, oooh, get down come on, ooh, oooh, get down come on|Ooh, oooh, get down come on, ooh, oooh, get down come on||[Female]|Ooh, oooh, ooh boy come on, ooh, oooh, ooh boy come on|Ooh, oooh, ooh boy come on, ooh, oooh, ooh boy come onEmbed"
N.O.R.E.,Stay Flawless,,"Stay Flawless Lyrics[N.O.R.E.]|Yeah yeah|N-O-R||[DMX]|Motherfucking right!||[N.O.R.E.]|Where you at?||[DMX]|I'm right here dog!|[N.O.R.E.]|Where you at? Where you at?||[DMX]|I'm right here dog!||[N.O.R.E.]|Where you at? Where you at?||[DMX]|I'm right here dog!||[N.O.R.E.]|Where you at? Where you at?||[DMX]|I'm right here dog! C'mon!||[Hook: Yummy Bingham]|I gotta be a gangsta like that's what's up|Make you harder, like a semi-truck|Stay flawless like a million bucks|Stay flawless, flawless, my ladies saying|Wooooaaahhh Wooooaaahhhh||[N.O.R.E.]|Yo, yo, yo|Court cases, why the hell I'm still dumbing out?|This is years later, I should've learned lessons|Got bifocals, start seeing better|Flows like a automatic machine gun in rainy weather|I'm a whole new man, a new artist|The Rock broke up, I threw my chain in the garbage|I was disappointed, it was my fault, I thought stupid|Fast forward, all alone still think stupid|We could Ford or truck it or just Coupe it|Rims on some Eazy-E, shit straight ruthless|Tuck this Medusa with a bottom jaw toothless|Bubba cush philly smoke, sour D slinging smoke|Kick you in the face like I know judo|Get up in that ass homes, that's no Bruno|Six steps forward, back three spaces|Entourage thicker than  visitations|Feels good but it's dangerous like head with braces|From the tunnel to palladium, y'all shouldn't play with him|Got enough dudes to fill up Shea Stadium|Or Citi Field, I swear I really will|Shots fire and you ain't no apprentice|Smack your mouth numb and I ain't no dentist|You might also like[Hook]||[DMX]|Yeah, yeah|Uh, uh, uh|Whaaat!|Niggas stay out my way like they owe me something|But if what I'm saying is wrong, nigga show me something|Cause I been knew from the time I ran up in you|How's it going down with you clowns, shall I continue?|Put it on that ass like ain't no tomorrow|And the nightmares'll get you if you live passed the horror|Last nigga that dared to step was just scared to death|Cause he knew it was the grace of God that spared his breath|Turn live niggas into corpses with the forces|Handing out losses and of-course it's|Dizzark Mizzan MizzX on the flizz-ex|Who's nizzext trying they luck with the big X|Jump off the back of the truck and you'll get stuck|With knives, bitch niggas can't fuck with mine|C-N-N on the grind with dog, nigga what|Bloodhound baby, fucking shit up||[Hook]||[Ja Rule]|I hear whispers that murderer's dead, and Rule got witty|It's now I'm barely living with that, I beg to differ|Two door whipper, no roof quiff-er|Bleed 'im propa, bleed that nigga|Yeah I'm definately Hefner|Three bitch in her, I want no lesser|Let's run it back like one time like Hester|Niggas gon make me KRS ya|De de de da di de de de da di day|I spit it like earlier, recently|Me and the Dog done reconciled, what now?|These niggas go in to hiding like dicks that ain't circumsized|Better recognize, my nigga N-O is still on the run|Nigga just eating a little better now|And I consider you the best|There's no pause, running that shit, get off my dick!|I'm back!|Niggas!|Ha ha!|[Hook]Embed"
N.O.R.E.,Want Me Dead,2016,"Want Me Dead Lyrics[Intro: T-Pain]|Hey|Let's keep it going|Hey|Ladies and gentlemen|Boom!|Fizzle|Noreago|Let's make a move baby|Boom, boom|[Hook: T-Pain]|Hey, hey|They want me dead|For what I said|I'm not backing down|I'm bout to act a clown|Hey, hey, hey|They gonna be mad at me|Tell them come at me|I don't give a fuck|They want me gone|I'm coming home|Got some bitches and some niggas|(they put me on)|Hey, hey|I know they're gonna be hating|Use it as motivation|I don't give a fuck||[Verse 1: N.O.R.E.]|See most of these dudes they really want you dead|They smile at your face but really want you dead|They hangout with you they but really want you dead|They want you fail but you succeed instead!|They ask you how you doing, they don't care the answer|When they need a favour it's like a cure to cancer|Success is a real niggas medicine|That's why the world only respect rich Veterans|And I'v never been excited by Fashion Week|I've laugh at that trash, most of Fashion Week|And all I want to do is make my bro proud|Sneak through the airport with [?] loud|You might also like[Hook: T-Pain]|Hey, hey|They want me dead|For what I said|I'm not backing down|I'm bout to act a clown|Hey, hey, hey|They gonna be mad at me|Tell them come at me|I don't give a fuck|They want me gone|I'm coming home|Got some bitches and some niggas|(they put me on)|Hey, hey|I know they're gonna be hating|Use it as motivation|I don't give a fuck||[Verse 2: N.O.R.E.]|They gon' wish hate on you|And that's for no reason|Hope that you fail|And that's for no reason|They pray you in jail|And that's for no reason|Stay stronger than slime, homie|And keep breathing|Queens, New York, left, rack, body them|I'm used to running the blocks with no cardio|You want to be the best so they rank you|And me and Nas back good, so left thank you|Me and Lamar will be back good eventually|Queens niggas, realest of the century|They don't want you at Caviar and Tiffany|They want you broke in the hood|And full of misery|[Hook: T-Pain]|Hey, hey|They want me dead|For what I said|I'm not backing down|I'm bout to act a clown|Hey, hey, hey|They gonna be mad at me|Tell them come at me|I don't give a fuck|They want me gone|I'm coming home|Got some bitches and some niggas|(they put me on)|Hey, hey|I know they're gonna be hating|Use it as motivation|I don't give a fuck||[Verse 3: N.O.R.E.]|You see the homies over there|They just wanna bury you|They giving you drugs because they wanna bury you|They feeding you fast food|They wanna bury you|Stay strong my nigga|God will carry you|Gotta recognize the devil when he wearing white|He could probably buy souls but he ain't giving life|They wanted me dead|I still kept it nice|Gave out pies|I only kept a slice||[Hook: T-Pain]|Hey, hey|They want me dead|For what I said|I'm not backing down|I'm bout to act a clown|Hey, hey, hey|They gonna be mad at me|Tell them come at me|I don't give a fuck|They want me gone|I'm coming home|Got some bitches and some niggas|(they put me on)|Hey, hey|I know they're gonna be hating|Use it as motivation|I don't give a fuck|Hey, hey|They want me dead|For what I said|I'm not backing down|I'm bout to act a clown|Hey, hey, hey|They gonna be mad at me|Tell them come at me|I don't give a fuck|They want me gone|I'm coming home|Got some bitches and some niggas|(they put me on)|Hey, hey|I know they're gonna be hating|Use it as motivation|I don't give a fuck2Embed"
N.O.R.E.,Going Legit,1999,"Going Legit Lyrics(Noreaga)|Now tell em to step up into the life of a gangster|Cause there is a difference between me and the other rappers|Other rappers talk about what their friends did|And what their friends saw|IM talking about what I did, and what I saw, smell me?|So it go a little some like this, check it out|Aha, yo, yo, yo..||Verse 1: Noreaga|Yo if I had my choice I woulda been rhyme|I woulda been told niggas that I coulda shine|A Yo Boricua, Pueto Rica, 100 miles IM running|IM just a nigga for life, straight from, Iraq, just living my life|No tattle tell, he did it, she did it|Why u snitch on grown men, and snitch on kids|Yo my ice go, platinum grenade for show|Tell what? Go tell your little stink ass ho|So what I got Dou, she ain't going get nothing Dou|I rock the Shirlock home brand, made with Timberlands|Cars ain't nothing now, straight fronting now|I crash one get another one fuck it now|Spanish (ten cuidao te dejo plotao)(degracio, degracio)|What, (que que que que) what...||Chorus (repeat 2x)||Who woulda thought this n-o-r making these hits|Who woulda thought this, my niggas making it rich|Who woulda thought this; always in and out some shit|Who woulda thought this, my niggas making legit||Verse 2: Noreaga||A Yo the movie called thugged out|End thug out, by thug out, for thugged out|You live a day in my life and just buggout|I used to live in 5e by the drug house|It was a reign and we all got paid|Cause when the crack house closed|Yo you open your stage, yellow|Bags and green tops, I got mean rocks|Selling crack buying out all the weed spots|I had doe but I still was mad|Back then, national, Willie was my cab|I was hated in the hood Yo by all the mothers|I used to, deliver food Yo my six brothers|Robbing Chinese food man, me and my crew and|Raster boys saying u,s a rude men, I grew up foul|But now ill improved that, did it for my daughter|And my little man...|You might also likeChorus (repeat 2x)||A Yo I came up, what what, making it happen|For rapping in the corner the posy we going platinum|Niggas doubting me duo, cause I was Latin|A nigga Rican speaking for all my Puerto Ricans|Dominicano, Peruvian, and Chicano|We in the same boat, a Yo we all sell the same coke|Getting bag in the pins with the same coke|I love my niggas and my niggas love me|You get lock, and get bailed like 1-2-3|Bartolina at the side Yo is your attorney|Clap niggas clap, clap (clap) Yo case dismissed|Tell the judge kiss your ass, dumb ass bitch|Animal bud, animal thug, animal blood, Yo|Show my niggas like animal love..||Chorus (repeat 2x)||Who woulda thought that shit uh?|Spanish (maricone tan frontiando como si hicieron algo|En su vida, nunca hicieron mierda, por mi mai que lo odio|Te lo juro pai, hijo e gran puta, sopla pipi chupa panti|Que se vallan par carajo, jala lo parta la madre de lo tomate|Sinverguensa.. He he he he|Que? Que? Que? Que?Embed"
N.O.R.E.,Jesus Take The Wheel,2013,"Jesus Take The Wheel Lyrics[Hook x2: N.O.R.E.]|Jesus, take the wheel|I'm too drunk to drive|Jesus, take the wheel|Jesus, take the wheel|I'm too drunk to drive|Jesus, take the wheel|Pray||[Verse 1: N.O.R.E.]|I feel like malcolm with the gun while he staring out the window|Extra cartridges but I ain't talking no Nintendo|Roll a ooh ah blunt, some say extendo|Niggas had love, I found out it was pretend, though|I entered the game with a classic, The War Report|It might burn down your fabric, the holy ghost|Legends, let me speak on your behalf|These new niggas annoying like Elliot's laugh|Put that on your rap radar, I beat to the dot, hit niggas with the AR|I be in france where them niggas slaying cane at|Same place where they claim they jump game at|Cabron puta, puneta, sell hard white, I call it Static Selektah|See, I'm the reason you got head on the highway|Frank Sinatra my Gs it's true, did it my way|Only dude I asked to get on this song and the nigga ain't do it|Was the kid Lil Sean, fuck it, I get Detroit love anyway|Cool with Trick Trick, Detroit love any day|And see my passport is stamped, I go through customs with a Kanye rant|(Kanye's Airport Rant)|And out of town blame a Ebro or Geespin|Well, out-of-towners rocks on the box more than we then|I sit back and open up the Riesling|Still get you hit walking out the precinct|I told Steven Hill that it's real, next year at the Cypher mind get killed|[Hook: N.O.R.E.]||[Verse 2: Reks]|Speed off on the smirnoff, license revoked|Nights with the Henny hold the ice, no coke|No joke, give it straight, no chaser|Planet of the apes where they go and can't come for the papers|Gorillas, pushers, dealers, killers|White boys calling themselves niggas, shit is|All type of fucked up, funeral's bucked up|Who the most stuck up till they get stuck up|Blungee off the bungee cord, balls off the Ouija board|Broads overseas, on board, call the guard|Got a dog with the bark, hell high, rough riding it|Come from an environment where gang war prominent|Most dominant me and my conglomerate|Toast to the winners, the survivors gotta honor it|Soldiers salute, all my legends pursue|Murdering the 100 proof, body in the booth|She a model, let her swatter, let her gobble what I shoot|Pop a molly in the hallway of the hass mess, too|Kendrick control bars got em in their hearse|Got em digging in their purse, try to memorize the verse|To retaliate, nowadays rappers all feather weight|Ain't no heavy weight, marshmallow pillow case|Soft with their metaphors, you ain't never met a force|Similar to N.O. and R.E. boss|You might also like[Outro: N.O.R.E.]|Yeah|And I ain't got no disrespect for the homie Kendrick|Long as kurrupt mind his business, no interest|Some of these responses, they oughta stop|Cause even when they kick down the buildings it was photoshopped||[Hook: N.O.R.E.]Embed"
N.O.R.E.,No Reason,2018,"No Reason Lyrics[Intro]|Uh|Gotta understand|Life different though|Lot different yo|Uh, uh, SP Killer||[Chorus: N.O.R.E., Sevyn Streeter & both]|I see these dudes they spaz for no reason|They go on Instagram and they wil' for no reason|You gonna threaten your fam for no reason (no reason)|You ask them why they do it, they tell you for no reason|I see these dudes spaz out for no reason|Go on Instagram and they wil' for no reason|You gonna threaten your fam for no reason (no reason)|You ask them why they do it, they tell you for no reason|[Verse 1: N.O.R.E., Sevyn Streeter & both]|We all brainwashed from the era of the social (media)|The only place a quiet person usually is vocal (yeah, yeah)|There he go, there he go, there's another rant again|Next week he's calm, there's a challenge for my man again|You see fame is a drug, they all want it (want it)|Fame is a drug, they all flaunt it|Shouldn't do it for the gram, should do it for the fam|Shouldn't do it for the likes, you should do it for your life (no reason)|But I'm a old guy, they don't wanna hear much of me (they don't wanna hear much of me)|I wish they all would listen and look up to me (look up)|But instead you on Twitter getting bitter|Shorty said she wit' dun and now you wanna hit her (no reason)|You should do unto those what you want done to you|Now she answering DMs and sonning you (like that)|Screenshot the whole conversation|Now you wanna go to war over conversation|If blood ain't shed, you never had beef (had beef)|You would understand that if you was half street (wo ah ah oo)||[Chorus: N.O.R.E., Sevyn Streeter & both]|I see these dudes they spaz for no reason|They go on Instagram and they wil' for no reason|You gonna threaten your fam for no reason (no reason)|You ask them why they do it, they tell you for no reason|I see these dudes spaz out for no reason|Go on Instagram and they wil' for no reason|You gonna threaten your fam for no reason (no reason)|You ask them why they do it, they tell you for no reason|You might also like[Verse 2: N.O.R.E., Sevyn Streeter & both]|Try and go one day of your life, without using your phone|You prolly feel awkward|Try to live one day without using the gram|You realise the mark of the beast was in your hand (yeah)|Two hands holding your phone it's like you praying to it|You don't even realise that you a damn slave to it|We used to go outside to see what's happening|Nowadays they on Facebook to see what's happening (no reason)|No newspapers, just blogs|People posting pictures with money but no jobs (yeah)|Most people wanna act like they doing it|Instead of really putting in the work and really doing it (put the work in)|Gotta get it together before you ruin it|Keep screwing it, keep pursuing it (yeah)|Nowadays people see a person fall out|And won't give 'em a hand they'll pull they phone out|It's sad cause Idiocracy (Idiocracy), it's seeming like a prophecy (woah oah oah ahh)||[Chorus: N.O.R.E., Sevyn Streeter & both]|I see these dudes they spaz for no reason|They go on Instagram and they wil' for no reason|You gonna threaten your fam for no reason (no reason)|You ask them why they do it, they tell you for no reason|I see these dudes spaz out for no reason|Go on Instagram and they wil' for no reason|You gonna threaten your fam for no reason (no reason)|You ask them why they do it, they tell you for no reason|[Outro: Sevyn Streeter]|Another day, it's all I got|I got my people right beside me, it's all I got|[?], it's all I got|To make me let go of them, it's all I got|Give me a reason, it's all I got|Give me a reason||[Spoken Word]|Fuck your money (Hmhm)|Fuck your jewellery|Fuck your cars|Fuck all your bitches that you got (hmhm)|Them shit's don't make you cool no more|That's obsolete now|I'm establishing that in Hip-Hop|All that shit ain't fresh no more, fuck all that (boom)|That doesn't determined whether you're a man or not|You can have all those silly things and still be a chumpEmbed"
N.O.R.E.,My Alias,,"My Alias Lyrics[Verse 1: Noreaga]|Carhartt dungarees; it's estimated that my mind elevated|Organized crime related|Bam Bam Bigelow, I'm not a gigolo|More like a general, chef like Emeril (look it up)|Panama Canal shipment, distributed to Dominican Republic|Republicans'll love it|Democrat, Arafat, Madoff|And we don't take a day off|We lay off and spray off|Meditate, Indian-style, knees bent|Throw grenades at the precinct, and I'm talking recent|Doing donuts on the highway in a Tahoe|Cash flow, I go|Jefe, muchacho|Hermano, Italiano, horizontal, Verrazano, old wino|Speak wisdom when we kicking it|I sit back and listen, it|Effect me magnificent, I'm different|[Hook: Noreaga]|See, I prefer that you call me by my alias|Nickname change at times, various|Girls curious, bi-coastal|Like a toaster, we toast you|Swift when we approach you||[Verse 2: Noreaga]|Niggas warned me, they informed me|Jakes swarm me, they straight storm me, they all on me|CNN tradition when them bodies go missing|Anybody get it -- Muslim, Jew, or Christian|Your honor, I was taught to move the onions|It's just what I learned from OG's as a young'un|It don't mean that I'm a bad person|My Tec-9 got hiccups, it do mad burping||[Capone]|Shootouts, niggas is mad heartless|Them automatics and targets|Be the topic of discussion for the bloggers|And the robbers and the slingers|Muslim and Catholic, the non-religious|They recite every rhyme like holy scriptures|Consiglieres you might fear|White Airs looking like coke in heaven|You wanted it, we right here|We beat charges like Roethlisberger, paid attorneys|No witnesses, DA want to burn me|You might also like[Hook]||[Verse 3: Capone]|From the home of broken dreams and coke babies, it's so crazy|They blow eighties, a body and a shell drop|Ricochet bullet hit shorty neck in the nail shop|The morgue is ice cold, but the corners is real hot|Non-stop observation, hustling's my occupation|Give me a few ki's, I'll show you how to lock the nation|Queens House criminal, OG kush the minimal|Shorty grabbed my soldiers, salute the general|We send them shots back and forth like a rocking chair|Overthrow your block and lock it just like Rasta hair|Peer -- it's mad cake on the plate now|The streets know we ill; any minute could be a shakedown|Tap your pants pocket, take your wallet and your girl bangles|Little goons, I wing em like Bojangles|I walk with angels and a halo, my jewels glisten|CNN reporting the war, listen||[Hook]Embed"
N.O.R.E.,Thug Poetry,1998,"Thug Poetry Lyrics[Noreaga]|Yo, yo|I only, ride for those that'll ride for me|I only, shoot for those that'll shoot for me|I used to be in D.C., with my poetry|Niggas said I'm on some other shit, crazily|I used to sell cracks, from the front streets to back|Then I got locked up, wicked Jake popped up|And the Jake he seen my, style before|But I'm, stayin lyrical behind my door|I'm in the yard God where niggas try to test me hard|But my vocal's too powerful law, it's too potent|I kick one verse, the whole cypher stood frozen|Now them niggas wanna parlay with me, general|I'm smooth like them niggas that, don't blow trial|I come on home to a new leaf, no beef|Jose Luis yo I'm ill like an Indian chief|And my dress code, ill like, indiglo|Chorus: repeat 2X||Aiyyo we thugged out what, and we let y'all know|We keep it thugged out, catch us at, every show|Let's get the jump off jumped off, here's the bang out|Yo at every fuckin club, yo we got octane out||[Brown]|I need, nuttin but cash, I'm out in the stash|Extra acres, carribean seeds with no crabs|Fuck hunger, I'm gettin no younger, cop this half|Brick til my pocket just thick, sit back and laugh|With the out of towners, keepin money around us|Four pounders, flippin wiggies, to the sirens around us|Cars and jewels, inside moves, three day cruise|Booted from Beijing, ?brought? our ventures to ?use?|The entrepeneur, droppin cock in your whore|Keep pussy open like a nigga sniffin coke in the hall|I do it all for y'all, basketball, or rims|Fiberglass that hold guns when I play old friends|Learn how to act around a playa who spike tracks|Doublin the pressure if your Empire Strikes Back|We savages.. break you up like marriages|Stick you in public and hide the thrills in baby carriages||Chorus|You might also like[Maze]|The way I grace shit so swift, play it tenacious|But smooth like a fugitive who move with a facelift|I stay lit, passin Branson, finesse no less|Reppin at random, forever at my best when I'm trancin|Niggas make me wanna focus with emotion|If you notice, the vultures I bring they sting so swift|Your quotes is from Maze, my bang'll tip with any rapper|These days, spittin venom when my wordplay sprays|And claimin half this cash regardless, dome my target|From the heart spittin my flow while slow niggas process|Blow the spot rock aggressive, mac eleven shots in|Twenty seconds, flood money stashed kept in fed mint|What is that monkey tail you trust with your math|To lush your cash, rush in your path, bust you then dash|That's why I'm never fast with the street shit|Driftin in this deepness, with each step|Breath taken make you niggas speechless|Distinctive, mad different's how I kick it|Some niggas recognize I'm individualized when I spit it||Chorus||[Noreaga]|What what what what what!|Thugged out nigga|Poet performin some other shit|(I'm type priceless)|On stage holdin my dick|In front of all y'all bullshit ass niggas|(We're ill niggas y'know)|Probably jerk off or piss on the front row|Throw that water on y'all, ya heard? (Word)|We don't give a fuck (aight)|We gonna keep it on some thug shit|From now to whenever nigga|If it's on let us know it's on|Try to sleep they'll sucka punch you|Fuck thatEmbed"
