rapper,song,year,lyrics
Black Thought,Thought is Like (Freestyle),,"Thought is Like (Freestyle) Lyrics*Thought is like...*||[Verse 1: Black Thought]|Kato 808 in my rhymes, the Green Hornet|At times I lean on it, ya'll just fiend on it|I'm cold fronting throughout the metro|Piloting, baby, the globe is my area|Yeah the most feared villain in America|Toss the trigger I use to hit the sheriff up|Now I'm convincing these dudes to get their lyrics up|Ya'll niggas bull' too much, ya'll niggas said enough|Sickin' competitors, heavily stressing this with ya|My medicine? Ya'll finna go see the therapist|I gotta settle it black, metal to metal|With these brothers on that bullshit pot, calling the kettle crisp|What could be better bitch? I'm rocking the flag with the green, black and red|And you're on the confederate, boy, you work for Merill Lynch|Ya'll ain't fucking with a brother hell bent on success, I'm living evidence|See it's really all about sensation and the fascination|We got to chase it: dreams|I'm trying to be the champ, you're in to racing|Cause fuck wasting time on the consolation prize|Something undetectable to ya'll naked eyes|Still its probably more real than ya'll recognize|I specialize in raw, carnivorous rhyming|Better silence it ya'll, you couldn't size it|The fourth horseman, give rise over the blade|Its going to cut you to a different size|In the days of guerrilla warfare|Making a change, like carfare|I want these chumps taken off here|Sip my morning coffee, kiss my baby girl|Tell my lady friend I'm gone until I save the world|Jump in my hotrod wheel, looking super thorough|Rocking an all black cape like the Duke of Earl|The essence of a movement on some smooth shit|Langston Hughes mixed in with some Stanley Kubrick|Sick, still yet I'm savvy, penning a nasty masterpiece|That convey my sentiment exactly|Black: I'm that nice son from Michaelango or Michael Eric Dyson|Slicing like a viking, dog, I'm white lightning|I'm caught with a bone, with a slight tick in my mind|It's tight frightening|The flow is part Mozart and part Malcom|Clearly you ain't fearing, you already know the outcome|Another victory, we're making history|I'm stronger than the walls in the penitentiaryYou might also like2Embed"
Black Thought,Ghetto Boys and Girls (Fuel Interlude),2020,"Ghetto Boys and Girls (Fuel Interlude) Lyrics[Intro: C. S. Armstrong & Black Thought]|I, I came from the bottom up|I know a lot of boys, you stop 'em on that street (Yeah)|Goddamnit! (Ay, ay)|They askin' where you from|My family never had enough|Every time you quittin' (Ayo)|I never had enough|I be like, ""I'm from nowhere""|Listen, everything I leave to this world|Still movin' onward, you say you from nowhere now (Uh)|Is for these ghetto boys and girls (Ayo, ayo)|Right now I'm with the young boys|[Verse: Black Thought & C. S. Armstrong]|Ayo, and they convince us to adopt lies 'til the stock rise|While the vultures try and push the culture counter-clockwise|Got us lickin' shots at one another for Popeyes|Niggas rock-climb, try and come out on the top side (Listen)|I mean the top of the food chain, fuck a top five|My fears is fuelin' my mood swings like the Mach Five|What's the reason I just got high? I forgot why|Another day, another Glock fired like we're not tired|Hollow men in the wasteland like T. S. Eliot|Spear stickin' out of the flesh of a fresh elephant|News comin' out in the press and they just relish it|When your hope's shattered in stress, you say, ""To hell with it""|This is for my young boars in them gun wars|Out here on their going dumb jawn on the front lawn|Tryna break the long arm of the law, that hunt for 'em|Bettin' lives on the luck of that draw, we want more, nigga||[Outro: C. S. Armstrong & Black Thought]|Everything I leave to this world|Still movin' on aboard, nigga|We not human, we at war, nigga (Ow!)|Is for these ghetto boys and girls|Listen, listen, listen, listenYou might also likeEmbed"
Black Thought,Tony Touch Freestyle,2010,"Tony Touch Freestyle Lyrics[Verse 1: Black Thought]|To the best of my knowledge I guess that I'm fresh|When I manifest|Hold up dog|Yo Tone it's the Jawn|It's the professional|I make your girl get extra low|I'm from south with a border like Mexico|Jaws talking bout they love me like x and o|Cause their man pop early like Plaxico|Not conceptual, unexceptional, hundred dollar bills filled of cocaine residue|Got you off your deed I'm ten steps ahead of you|Fresher than a 1985 fresh festival, live|One time for my hoods and my barrios|Bloods, Crips, Latin Kings, Trinitarios|In the hood staying dipped like Oreos|Even with a Moms on their shit like Marios|From the Illadelph valley side of things|And embalmed in my words in the Valley of the Kings|When I finish y'all, I ring alarms like Tenor Saw|And rage war with a Renascence, ya'll better get it far|Rest in Peace, J. Dilla|The Legendary Roots Crew from the city of Philla|Yup, mines the math|Though I rocks the mic and never got to past|But I got your ass|Listen, uh|Well, I'm a legend in my own time|Look at y'all, just a legend in your own mind|I let the drum talk to me cause it don't lie|A lot of rappers try to kill it but they don't die|Keep them coming back and feel it like a throatpie|La vida loca, from something toke to this|Grand Imperial, hall of fame material|Black, general 215, name rank and cereal|My thing highly flammable|I bang like a hammer do|Swine flu, bird flu, and every type of animal|I'm immune to Tamiflu|I'll be God Damn if you|Insane and bananas too|My bling is intangible|Well it's the Jet Li|I'm working on your requiem|Step in a party everybody scream, ""That's him!""|I push a fast BM|Black gray Gatsby and|My gats be in the|Belfry that the bats be in|A box is what you never gonna catch me in|If this the last day and times nigga|Cash in|Yep|Looks like a job for a conquerer|Top mr third Mr swerve mr popular|You kinda finished|Can't see it with binoculars|Rather have a fish bone lodged in your esophogus|You ever heard of the world?|I'm on top of this|Still the most properest|Y'all know what the gospel is|Bless the child|I ain't wind up a x-file|After {???} self imposed exile|I reimerged cut from a different textile|They say i'm just wild|Waiting on my next trial|I've always been the nigga with the most fresh style|In '98 I rocked what you copped just now|I had dreams like Akira Kurosawa|And realized my meteoric rise to power|They say I drive 220 miles per hour|Sixteen bars: 220 thousand dollars|[???]About it|Reliant hypnotic|The game full of too many funny clowns and cowards|Look|Son of a'slam aleikum|I'm an abomination|A marijuana patient|With Grammy nominations|If everything and everybody in their proper places|Black Thought is out his mind he on that outer space shit|Spotted on the red carpet steppin' out a space ship|With a glass of shiraz and two around the way chicks|Nowadays don't nobody say shit|You don't want to see me get up on my modern day shit|Try to tell you Thought's dangerous|Can't nobody hang with this Great|Translated into 80 different languages|Websters and Cambridges|Every day the chamber switch|Grown-ass man|I don't know who the fuck you playing with|I Leave with heads in my|Take-away-from-dinner bag|Wicked grin like Mahmoud Ahmedinijad|Never been a nice nigga cuz they finish last|I'm a menace|That's what i'ma be remembered as|Fresh|[Talking and Q Tip verse]||[Verse 2: Black Thought]|Don’t even worry ‘bout it|My legendary stylin’|Between Harry Belafonte and Harry Allen|I’m from a city where it’s violent and it’s overcrowded|I put it on the map, y’all ain’t even know about it|I brought the poet out it|The soul flowin’ out it|Make it hard to figure how y’all managed to go without it|A mic with a cord, I never do a show without it|When dealin’ with fraud I lift ‘em up and throw it out|I know the way to go the route|Show you what a soldier ‘bout|Big boy arms I’m holdin’ out|Clips foldin’ out|Used to be a little snotnose but I’m older now|You can try what you want, I’ll tell you what I don’t allow|Fuck all the running round|You on a hunting ground|You spit a hundred bars|I spit a hundred rounds|You run a hundred yards|Trynna get outta bounds|That’s when I tackle y’all and show you how the thunder sounds|Bang ya, as we approach the danger|Rhymes that invoke your anger|And I ain’t know the music was supposed to change us|But when I start spitting it is so contagious|It smokes the pages|I literally spoke to sages|They said it’s no hope to save us|Because we the bad guys, you supposed to blame us|Cause nowadays everybody close to famous|But stop modellin’|The wild scholars in the wind like an halogen|Y’all motherfuckers can forget about challengin’|I blind rappers like a magnified Halogen|You trynna tussle with the truth, how about it then|I am lightyears beyond not behind the line|I will separate store from truly divine|Give me a crystal head vodka with a twist of lime|And watch rappers get smoked like a nick of time|I will put you in a body bag, pick a time|I will bring it to your doorstep, kick a rhyme|Niggas sick but they ain’t near sick as I am|Rappers is slick but they ain’t near slick as I am|I don’t give a fly|Niggas stop signifying|Stop cowering, be a man and die dignified|I’m that insecticide, pesticide, genocide|You in the morgue absolutely identified|But nope I won’t do it in the name of love|Until I’ve given it my all and it just ain’t enough|See even winters gettin’ realer than they say it was|Straighten up, who afraid of what?|Play your good and ball|Yeah|You work hard til you’re better off|24/7, 365 never off|Look at me I’m nocturnal I don’t sleep|Eyes, heavy bags and crows feet, we won’t be|Stopped, I don’t work then I won’t sleep|Time keep flowing like a river that don’t cease|In the mind of a super nigga there’s no peace|Can’t stop running like I’m ducking the police|Yeah|Cruely how they try to do me like cochise|Flow so obese, I’m springing a slow leak|I keep a crowd satisfied like bringing them cold heat|Yo, you’re the pits/Pitts like Angela Jolie|Stop, stop|You know the camera’s is goin’ see|Wolves lookin’ at me like them cannons ain’t on me|Please, you ain’t dealin’ with no amateurs homie|Philly ain’t known for cheesesteak sandwiches only|Yeah|Climbed to the top, man I was lonely|Everybody didn’t need mugging like Nick Nolte|But no, I won’t stop, won’t drop, won’t retire|I’m my own supplier selling goods to the buyer|The torch to the eye of the storm, on fire|Jawns trynna give me birthday sex, like Jeremiah|Hittin’ me up on Facebook|I replied, denied|Tell me I’m in the top 5|They ain’t never lie|Picture me in that Peking to Paris with a ride|It cost 2 to 5|Them doors suicide|Yeah|Testing Thought that will be your suicide|No matter which corner of the globe you reside|Listen|215, dumb shit aside|When it come to the job getting done, what am I?|I’m the god of the microphone praise the lord|Anybody disagree with me come raise your sword|I’m agent orange, poisonous amazing pawns|And the band keeps raging on|Well listen|And yo, I don’t stop|No, I don’t quit|No, I don’t stop|No, I don’t quit|No, I don’t stop|No, I don’t quitYou might also likeEmbed"
Black Thought,Sway In The Morning Freestyle,,"Sway In The Morning Freestyle Lyrics[Black Thought]|Up steps the one and only in the flesh|Cynically Sierra Leonian fresh to death|Big homie and them reps the best|Knew you know me from somewhere|I get wrecked with Questlover|The brother get it on, bring a song|More brutal than Genghis Khan|Whose name ring alarms to fakes|You couldn't place but know I'm the truth|That's before you recognize it's the one from the Roots|Armed to the tooth, trying to take a eye for another eye|I'm from ""We hear gunfire for a lullaby""|Yo, forget it, who the hell am I?|Yo, I'm the reason these MCs' lies became nullified|The stuff of legend, so tell me what's tougher, brethren|When I'm the blast from the past that started the present|Vision of the future, me and the super producer|And I'm ten times smart as I'm used to be|And I'm still seeing the voice through the speakers|Porsche two seaters, Jimmy Choo speakers|Real rap remedy man, a true genius|I brought Yosemite Sam two heaters|Asking these bastards if it's any last words|Besides ""what, when, why?"" and all them adverbs|You bout to be the next fugitive captured|Just keep thinking you can lie and live after|Slow your roll, playboy -- rabbit ears|Cuz damn right it's on sight like Vladimir|And by the moment in time you will be outta there|Strapped, getting slapped for acting so cavalier|I come from Philly and them cowards don't travel there|Brothers let the heat rattle there, they don't battle there|Itching to leave you in a pool like Mike Phelps|Learning to fight might help, but that's light help|Because if bullets make flack melt|Then imagine just what it'd do to you, even if you a black belt|Ayo my brother still concealing with a Gat held|On a block where it used to be a lot of crack dealt|Lo and behold, this is information overload|I put the crowd in a trance like Paul Oakenfold|I used to be the lowest on the totem pole|Until I reconstructed my goals, left a broken mold|Setting sights on a open road|I hit up anywhere and everywhere|That realness is bought and sold|Ayo they got me on an honor roll|That means whenever speaking my name|Begin that with ""The Honorable""|T-A-R one ""I"" like a monocle|I bring the riot through and laugh cuz you're comical|Look, get in that ass like your father do|Hit that catatonic chronic out in Bonnaroo|I'm psychological, jump like ""Geronimo!""|Probably get yourself knocked down like a domino|Whoa, if I don't work then I won't eat|No, I don't Facebook but I might Tweet|The industry is out of control like OC|So take this L on the chin like it's a goatee|I'm kinda like a cellar door, I'm lowkey|I used to mix bottles of Champale with OE|I'm Aristotle, I can't fail, I'm OG|I came through to get free like no fee|Hey yo they got me on a pedestal, trophy|Got em singing damn Riq, cheating like adultery|Sycamore, sitting on paper like upholstery|Noam Chomsky, I'm on an organized rhyme spree|Messing with this is a borderline robbery|And that's what it is, I'm Jimbrowski|Certain circles call me The Big Lebowski|It would behoove you to find out about meYou might also like3Embed"
Black Thought,Rest in Power,2018,"Rest in Power Lyrics[Intro: Dispatcher + George Zimmerman]|Sanford Police Department|There's a real suspicious guy, he's up to no good||[Chorus: Black Thought]|Rest in power, rest in paradise|If I could change matters, I would spare a life|'Cause lives matter, there's clearly nothing as dear as life|You have become a symbol in the spirit life|Rest in power, rest in paradise|If I could change matters, I would spare a life|'Cause lives matter, there's clearly nothing as dear as life|You have become a symbol in the spirit life|[Interlude 1]|They say that, uh, time heals all wounds. It does not||[Verse 1: Black Thought]|In America, one tradition that lasts|Is black blood woven into the fibers o' the flag|Not addressing the problems of the past|To nowhere fast, but following the path|So called ""leaders"" on hire for the Klan|Still rapin' and settin' fire to the land|Well that's the climate, how can I become a man|If survival is a triumph and we got the underhand? Listen:|One killer, one child, one weapon|The shooter was unthreatened, seventy-one seconds|So many unanswered questions, I see reflections of myself|I feel like in fatherhood we are connected|Too long before the shooter was arrested|So wrong, worldwide, we've been affected|To them it's real, sins of the father remembered still|For every Trayvon Martin, there was an Emmett Till||[Interlude 2]|You killed my son||[Verse 2: Black Thought]|How many more kids will we wait for them to kill?|My tears collectin' like raindrops on the windowsill|If the wounds heal, the memories never fade|I wonder if you're in heaven's eleventh grade|Six thousand two hundred and thirty days|Too young of an early age, such evil and worldly ways|The thing in which we believe, the way in which we behave|The way in which we've evolved, the monster that we became, listen:|You might also like[Chorus: Black Thought]|Rest in power, rest in paradise|To all the babies too young to have had to pay the price|'Cause lives matter, there's clearly nothing as dear as life|You have become a symbol in the spirit life|Rest in power, rest in paradise|Know as long as you still got somebody here to fight|Your lives matter, there's clearly nothing as dear as life|You have become a symbol in the spirit lifeEmbed"
