rapper,song,year,lyrics
N.O.R.E.,Banned From TV,1998,"Banned From TV Lyrics[Intro]|Trying to watch this movie|Yo, Jungle|Shut the fuck up|'98, it's ours||[Verse 1: Nature]|Ayo, ayo|Regardless of rain or snow, sleet or hail|I kick street tales, choking niggas like I'm Sprewell|Golden State, holding your fate in the palm of my hand|Blow you away like it's part of the plan|I gotta call it like I see it, talk it like I be it|Walking my walk, thugged out orthopedic|'Cause I'm soon to be up, give me room, watch me heat up|Niggas try to stick me like Abner Louima|Follow the leader, make me go extra hard|Yo, N.O.R.E., should I hold back or show the repertoire?|Quit at sixteen or throw in extra bars just for the non-believers?|I show 'em why it's so hard to reach us|I get pussy with my father's features, puff heavily|See me at six-one, weigh a buck seventy|Catch me in spots y'all niggas never be|Packed in like Green Bay|Harlem week to Queens day|Performing acapella, no DJ|'98 live, no replays|Make it seem easy|So tell a friend to tell a friend that it's them again|Nature, Noreaga, wild gremlins|[Verse 2: Big Pun]|Yo, yo, yo|Champagne on the rocks, sporting a Fort Knox Lazarus|Shark salad with carrots, pork chops and applesauce|Twin connection, disrespect and watch your body cave in|Pump the shotty guage in, hit the shorty while he potty training|I ain't playing, I'm truly the worst|He'll be the first to get his whole body fully reversed|Uzi your hearse, leave you double-dead|I'm a bubble-head|I never listened to nothing my mother said|Ayo, I hold niggas ransom for money like Johnny Handsome|Been soning niggas so long, I think I got a grandson|My passion is money, a stash and a honey|That won't ask no questions but'll blast anybody|That's my kind of girl, kind of world I want to live in|Not a cell or a prison or in Hell's Armageddon|Just a little ghetto where my niggas control the middle|And know the riddles of life where others know only a little||[Verse 3: Cam'ron]|Yo, been in rich places, sick places|See, my story six thousand, six hundred sixty-six pages|Wages, I rolled six aces|And at the same dice game, I caught six cases|All over big faces|Now it's tipped laces, ready to dig faces|But the Bing, it ain't a bit spacious|Niggas loading up they rib cages, cats like to rip places|Bloody lip tasters, Cam is a big racist|But I stay important, big places|But the world know your girl though, I fuck her off a furlough|Should be up, hook me up, all your sales could be luck|Only question for these ducks is, ""Baby girl could we fuck?""|You the type that need a wife|Thought L-O-X told y'all the key to life, asshole|Yo, I don't play around, I lay it down|Fuck around, I'll spray a round|Flip a biscuit, nigga, risk it|My ass, you can kick or kiss it|You might also like[Verse 4: Jadakiss, Styles P, & Both]|Ain't no niggas in the world you know thorough than this|Bust off and sit the hot barrel dead on your lips|Like two thirds of a brick, Paniero and 'Kiss|The crystal white fluffy parts that'll come back quick|See, the plan is to stash all, cash y'all's|The weed so strong, they gotta put it in glass jars|Niggas try to smoke me out then moke me out|'Cause the rims on my new joint be poking out|I'm about to have no feelings, shit is deep|Do they dance with the Devil when they sleep?|I wake up gripping the air, wishing to hear|Shit that they kick in your ear when your soul drift in the air|My gift is half-rotten, when I spit, it's a tear|That shit'll drop down my eye, I'm too tired to cry|And I ain't never seen a nigga that's too live to die|They say you get what you ask for, so get it 'cause you asked for it|A nigga ain't a thief, then he better have the cash for it|And we gon' be around 'til your body rot|And if the Feds brung us in, we'd get the same time Gotti got|Nigga||[Verse 5: Noreaga]|Ayo, there's two ways into the hood, one plain|The other smoking chronic like straight to the brain|Yo, let's get loose, Hennessy straight with tomato juice|Queens stallions, buy guns from the Italians|Now y'all niggas recognize medallions|I play the best hood, OT with Tim Westwood|Used to be on Section 8, now my section is good|Thugged out niggas, we eat as much as we could|And I don't give a fuck, what? Yo, I say my shit|And I don't give a fuck, what? You can save your shit|Y'all niggas like extra skin on my dick (Uh-huh)|Listen to Bob Marley, y'all funny niggas like Steve Harvey|You fronting live with a weak army|I play the nice guy too and even smoke with you|But the realness, I ain't got no love for you|That's why I'll never do a song with you|Not even if your baby moms fucked the crew|And promised to give us head and swallow too|I still say no, no is no, no can though|Y'all niggas drinking Haterade, drinking my flow, yo|[Outro: Noreaga]|Thugged Out|Real motherfucking shit right here|Thug shit right here, motherfucker|Motherfucking thug shit right here (Thug shit, what?)|Fuck is the deal? (What?)|What the fuck is the deal?|What the fuck is the deal?|What? What? What?3Embed"
N.O.R.E.,Oye Mi Canto,2004,"Oye Mi Canto Lyrics[Letra de ""Oye Mi Canto"" ft. Gemstar, Big Mato, Daddy Yankee & Nina Sky]||[Intro: Nina Sky, N.O.R.E. & Daddy Yankee]|If you proud to be Latino right now, stand the fuck up!|Grab a cup, grab a cup, let's go|SPK (SPK)|Alive (Alive, we comin' up!)|Nina Sky (Who's this? Who's this?)|N.O.R.E|Da-ddy Yan-kee|Gem Star (Gem Star)|Big Mato (Big Mato)|C'mon, c'mon|[Coro: Nina Sky & N.O.R.E.]|Woah, woah-oh, woah-oh, woah-oh|Boricua (Ha!), morena (Ha!), dominicano (Ha!), colombiano (Ha!)|Boricua (Ha!), morena (Ha!), cubano (Ha!), mexicano (Ha!)|Oye mi canto||[Post-Coro: N.O.R.E., Gem Star]|You see? This is what they want|They want reggaetón|What!? What!?|They want reggaetón|Esto es lo que quieren|Toma reggaetón|¿¡Qué!? ¿¡Qué!?|Toma reggaetón||[Verso 1: N.O.R.E. & Gem Star]|You see, I'm N.O.R.E. keep my story|My story I always kick it (¿¡Qué!?)|When I bone shorty I slap culo and listen (¿¡Qué!?)|Soy el Gem Estrella cuando canto lo que dicen (What!?)|Una nalgada en el culo ella grita (What!?)|You see a bori, gotta rep for his own|That mean Fajardo, San Juan, Bayamón|Soy del campo Santiago, tabaco y ron|Allá en Puerto Rico con Bacardi Limón (Okay, agh!)|And this is all that, and you can tell spanky on it|The remix to the remix with Yankee on it|Esto e' un mofongo, un chimi con N.O.R.E. on it|Un reggaetón con Gem Star and Big Mato on it|You might also like[Coro: Nina Sky, N.O.R.E. & Daddy Yankee]|Woah, woah-oh, woah-oh, woah-oh|Boricua (Ha!), morena (Ha!), dominicano (Ha!), colombiano (Ha!)|Boricua (Ha!), morena (Ha!), cubano (Ha!), mexicano (Ha!; Who's this?)|Da-ddy Yan-kee|Oye mi canto||[Verso 2: Daddy Yankee & N.O.R.E.]|Suena el cangrinaje para que sientan el encaje|Rodeo en la pista, muévase potra salvaje (Yeah-ey)|Siggity Daddy Yankee, give it to them (Yeah-ey)|Este es el flow que reina en la calle|To' mis latinos en los bloque ahora stand up|Oye mi canto con el N.O.R.E. ahora en dembow|Mueve ese bum-bum-bum, mami, no pierdas tiempo|Who's this? Da-ddy! (Yeah, yeah, yeah, yeah)||[Verso 3: N.O.R.E., Daddy Yankee]|And this is the first time it's ever been done (First time)|Because there's never been|A rapper doing a reggaetón album and he a veteran|Padrino (Yeah), while I lay in the casino|No matter your race because today you latino (Yeah-ey)|To' mis latinos en los bloque ahora stand up|Oye mi canto con el N.O.R.E. ahora en dembow|Mueve ese bum-bum-bum, mami no pierdas tiempo|Who's this? Da-ddy!|[Coro: Nina Sky & N.O.R.E.]|Woah, woah-oh, woah-oh, woah-oh (Nina Sky, Nina Sky, Nina Sky!)|Boricua (Ha!), morena (Ha!), dominicano (Ha!), colombiano (Ha!)|Boricua (Ha!), morena (Ha!), cubano (Ha!), mexicano (Ha!)|Oye mi canto||[Verso 4: Big Mato & N.O.R.E.]|Vengan a ver|Ven a ver lo que tengo yo, para ti|Ya siento que sin ti no puedo vivir|Mami (Mami), mami (Mami)|Hey, hey, hey, hey|Oye mi canto|Mira, a to' el mundo, linda, yo le canto|Mira, saludo que a mi hermano le mando|Mando (Mando)|Hey, hey, hey, hey||[Coro: Nina Sky & N.O.R.E.]|Woah, woah-oh, woah-oh, woah-oh (Nina Sky, Nina Sky, Nina Sky!)|Boricua (Ha!), morena (Ha!), dominicano (Ha!), colombiano (Ha!)|Boricua (Ha!), morena (Ha!), cubano (Ha!), mexicano (Ha!)|Oye mi canto||[Outro: N.O.R.E.]|SPK Da Beast|Gem Star & Mato|Nina Sky, wassup, girls?|Rest in peace, Big Pun|Vala, I know you would've loved this|Rest in peace to my father|Mambo, this is for y'all, yeah|Shout out to all the DJ's playin' that reggaeton early|DJ Camilo|DJ Enough|Cipha Sounds|Chris Bucks|Tony Touch|Jerry Chub|DJ Khaled|Felli Fel|La Mega|Latino Mix|Let's Go|C'mon, c'mon|C'mon, c'mon3Embed"
N.O.R.E.,Superthug,1998,"Superthug Lyrics[Produced by The Neptunes]||[Intro]|I'm, I'm actually waitin' on the boss now|He said we have some kind of special assignment or something|He's supposed to be callin' me, like any minute now, any minute|Hold on, hold on, lemme get the phone|Hello? Jackson here|Ya, what? you found Manuel Noriega?|In the Philippines?|He has a mansion?|Ok, we're on it, we're on it right now... bye|[Chorus: N.O.R.E., (Tammy Lucas), and *Pharrell*]|What, what, what, what, what, what, wh-what (what, what, what)|What, what, what, what, what, what, wh-what (what, what, what)|What, what, what, what, what, what, wh-what (what, what, what)|What, what, what, what, what, what, wh-what (what, what, what)|*Superstar*|[What, what, what, what, what, what, wh-what (what, what, what)|What, what, what, what, what, what, wh-what (what, what, what)|What, what, what, what, what, what, wh-what (what, what, what)|What, what, what, what, what, what, wh-what (what, what, what)]|*Superstar*||[Verse 1]|We light a candle|Run laps around the English Channel|Neptunes, I got a cocker spaniel|We on the run now, you know it ain't no fun now|And where I go, yo niggas can't even come now|You hate the law, nigga break it, I don't care|But when you get caught, remember that I don't care|N.O.R.E., loved throughout the atmosphere|That mean now we on the run, yo if that ain't clear|Weak niggas wanna snitch yo but that ain't fair|Yo we down in Vegas, money, skies too courageous|I know I'm on the run but still rip stages|They call me animal thug, when I'm in cages|I used to boost razors, roll dice with no aces|Now I live secluded in the oasis|Gotta take spaces, no time for car races|Check my Skytel, I got five pages|You might also like[Chorus: N.O.R.E., (Tammy Lucas), and Pharrell]|What, what, what, what, what, what, wh-what (what, what, what)|What, what, what, what, what, what, wh-what (what, what, what)|What, what, what, what, what, what, wh-what (what, what, what)|What, what, what, what, what, what, wh-what (what, what, what)|Superstar|[What, what, what, what, what, what, wh-what (what, what, what)|What, what, what, what, what, what, wh-what (what, what, what)|What, what, what, what, what, what, wh-what (what, what, what)|What, what, what, what, what, what, wh-what (what, what, what)]|Superstar||[Verse 2]|Yo hit Louisiana, then Atlanta, Indiana|Forget a city slicker, got country grammar|Ay yo we goin' places where my SoundScan ain't tough|To where I say I ain't Nore, yo it ain't that rough|I leave the jake in my face, asking all this stuff|I gotta keep my mouth shut and don't say what, what|But yo it's hard to, knuckleheads got the heart too|Yo from New Orleans, L.A., V.A. to Queens|The I-95, now we hit the Philippines|But now it's different, we gotta stay sober|Yo, communicate, StarTAC, Motorola|Keep it on the hush hush, don't talk too much|Thugged Out Entertainment, you know we touch|All our whips got navigation|While your whips is just garbation|Is you knowing what you facing?|[Chorus: N.O.R.E., (Tammy Lucas), and Pharrell]|What, what, what, what, what, what, wh-what (what, what, what)|What, what, what, what, what, what, wh-what (what, what, what)|What, what, what, what, what, what, wh-what (what, what, what)|What, what, what, what, what, what, wh-what|Superstar|What, what, what, what, what, what, wh-what (what, what, what)|What, what, what, what, what, what, wh-what (what, what, what)|What, what, what, what, what, what, wh-what (what, what, what)|What, what, what, what, what, what, wh-what|Superstar|[Bridge: Pharrell]|This is the life, yo, of a superstar|Fly ass mansions and a million cars|Gotta get the cash yo|And it's live or die|The Neptunes and Noreaga|The limit is the sky||[Verse 3]|Yo, lemme do it again, do it to win|Last album was a eight, this one is a ten|And when Capone come home, we gon' triple the sin|Yo I love my family, treat my folks like kin|Rock a ’embrero, like I'm Mexican|Shouting out my pops, cause yo next to him|He told me every thug nigga is a gentlemen|So I took heed, take my time still won't speed|You know a nigga got kids, so my family need|A little more than they used to get|Real not the duplicate|Taking no falls, making y'all just recouping it|Doing it up, tell me whatcha wanna do wit' it|Capone's plan, passport to foreign land|Overseas in Japan, politicking with Chan|Yo, N-E-P-T-U-N-E-S|The way they lace a beat like one of the best, what?||[Chorus: N.O.R.E., (Tammy Lucas), and Pharrell]|What, what, what, what, what, what, wh-what (what, what, what)|What, what, what, what, what, what, wh-what (what, what, what)|What, what, what, what, what, what, wh-what (what, what, what)|What, what, what, what, what, what, wh-what|Superstar|What, what, what, what, what, what, wh-what (what, what, what)|What, what, what, what, what, what, wh-what (what, what, what)|What, what, what, what, what, what, wh-what (what, what, what)|What, what, what, what, what, what, wh-what|Superstar|[Bridge: Pharrell]|This is the life, yo, of a superstar|Fly ass mansions and a million cars|Gotta get the cash yo|And it's live or die|The Neptunes and Noreaga|The limit is the sky||[Outro]|Yo, N.O.R.E., Nore, stand for now we on the run eating|Yo, N.O.R.E., Nore, stand for now we on the run eating|Yo, N.O.R.E., Nore, stand for now we on the run eating9Embed"
N.O.R.E.,Nothin’,2002,"Nothin’ Lyrics[Intro: Pharell]|Oh! (Millitainment)|Oh! (Millitainment)|Oh! (Millitainment)|Come on (Millitainment)|Oh! (Millitainment)|This one is the hot one! (Millitainment)|Aiyyo! (Millitainment)||[Hook: Pharell]|Homeboy, I came to party (ohh!)|Yo' girl was lookin at me (ohh!)|She's a haggler naw I'm not taggin her (ohh!)|But you don't want them boys to come over and start askin ya (ohh!)|What you wanna do, nigga? (Nothin')|What you tryin' to do, nigga? (Nothin')|What you wanna do, nigga? (Nothin')|What you tryin' to do|[Verse 1: Noreaga]|Yo, yo, yo..|Yo N-O-R papi, say what? That nigga's the man|With his manager Chris and the label that Jams|Still flossin, showin your rocks|Ain't you dudes heard ""Grimey"" man we stoled your watch|It goes Indian style, knees bent in dashiki|Strapped with the baby tec baby tec B.T|True she at the bar lookin good in the brown dress|Ordered six shots and them things ain't around yet|Persona all thugged out loud and clear|Sayin fuck the straight Henny, just grab me a beer|You see I'm reppin now, and my mami's I got a weapon now|Shoot at them clowns at they feet, they high steppin now|Left that wack label cause I don't like pricks|I'm like a hammer that you hold on your hand, I make hits|At the white boy club while I'm buyin the bar|They like, ""Hey now, you're an all star,"" it go||[Hook: Pharell]|Homeboy, I came to party (ohh!)|Yo' girl was lookin at me (ohh!)|She's a haggler naw I'm not taggin her (ohh!)|But you don't want them boys to come over and start askin ya (ohh!)|What you wanna do, nigga? (Nothin')|What you tryin' to do, nigga? (Nothin')|What you wanna do, nigga? (Nothin')|What you tryin' to do (Nothin')|You might also like[Verse 2: Noreaga]|I spit mack millimeter rhymes, kill a liter in line|My nigga Peter got a heater of mines|Niggas still lyin, in they wack ass bars|Only time they seen jail, when they watchin ""Oz""|I'm in the club pissy drunk like, ""Ahhhdadidaaaaa!!!!!!""|And mami took it proper like, ""Dadadidaaaaa!!!!!!""|Adios kill your soul, then we body your ghost|They call me gordo, I sip the champagne that's importo|Playin ""Capicu"" (Man you ain't nappy too!!!)|I like when chocha be nappy too|I treat life like a fast car, lower my speed|I try and chill, and sell more records than Creed|Been a hustler (What? What?) Way before ""Melvin Flynt""|A criminal, don't leave no prints|These dudes gave me a brick and they ain't seen me since|Caught up wit 'em, had them dudes straight hoppin the fence, it go||[Hook: Pharell]|Homeboy, I came to party (ohh!)|Yo' girl was lookin at me (ohh!)|She's a haggler naw I'm not taggin her (ohh!)|But you don't want them boys to come over and start askin ya (ohh!)|What you wanna do, nigga? (Nothin')|What you tryin' to do, nigga? (Nothin')|What you wanna do, nigga? (Nothin')|What you tryin' to do (Nothin')|[Bridge]|La la la la la la la la la (ohh!)|La la la la la la la la la (ohh!)|La la la la la la la la la (ohh!)|La la la la la la la la la (ohh!)|La la la la la la la la la (ohh!)|La la la la la la la la la (ohh!)|La la la la la la la la la (ohh!)|La la la la la la la la la (ohh!)||[Verse 3: Noreaga]|Yo, yo, yo..|Yo oops, I done done it again, I got another one|I keep it hid in my pocket I got another one|""Fast and Furious,"" dunn dunn dunn tudunn|Still be in, Miami and jet skiing|In the ocean where the sharks be at, just O.D.'n|Adebesi, want a brick you pay double easy|I got them things that'll move easy|And I told the lawyer, I sold blow to old Goya|I'm half spanish, you see I cook coke for Goya|I'm half spanish, all day arroz con polla|Recognize, when I'm runnin the game, before me|Chickens wasn't even messin with brain, because me|Now you started gettin head on the westside highway|So recognize my nigga you did it my way|Ice rockin, brick choppin and gun shoppin|I did it all beat cases without Cochran||[Hook: Pharell]|Homeboy, I came to party (ohh!)|Yo' girl was lookin at me (ohh!)|She's a haggler naw I'm not taggin her (ohh!)|But you don't want them boys to come over and start askin ya (ohh!)|What you wanna do, nigga? (Nothin')|What you tryin' to do, nigga? (Nothin')|What you wanna do, nigga? (Nothin')|What you tryin' to do (Nothin')||[Bridge]|La la la la la la la la la (ohh!)|La la la la la la la la la (ohh!)|La la la la la la la la la (ohh!)|La la la la la la la la la (ohh!)|La la la la la la la la la (ohh!)|La la la la la la la la la (ohh!)|La la la la la la la la la (ohh!)|La la la la la la la la la (ohh!)2Embed"
N.O.R.E.,Tadow,2013,"Tadow Lyrics[Hook: French Montana]|My choppa go tadow|It'll turn you inside out|Her ass like tadow|My money like tadow|Bling, tadow (Money)|Bling, tadow (Money)|Ratchet, tat, tat, tat, tat, tat, tadow|My choppa go tadow|It'll turn you inside out|Her ass like tadow|My money like tadow|Bling, tadow (Money)|Bling, tadow (Money)|Ratchet, tat, tat, tat, tat, tat, tadow|[Verse 1: P.A.P.I.]|Yeah, money on my mind, molly in my cup|Mix with that wine, sowy in my blunt|That's just zodiac fine, I don't give a fuck|If you rep them dollar signs, go and put em' up|Fuck that I don't buck back|See I buck first, move the fuck back|I bag that, I'll pump that, I'll real estate, I'll trump that|Y'all be where them chumps at|Y'all be where them punks at|I'll be where them Choppas, Uzi's, AK's, and pumps at|Name a town or city, I went through there|A car or model, I went through there|A face or shape, I been wit her|If not wit her, bitch similar|G's on deck, I really live this shit|Back from Lefrak, rack, rack city bitch||[Hook]||[Verse 2: 2 Chainz]|Last name ""Money""|First name ""I love this""|So ""love this money"" is my mothafuckin' government|Test me uh uh|Shoot you right there|Leave you right there|Leave the scene, tall nigga with long hair|Her ass like tada|Give me that whole enchilada|Pop that pussy for my wallet|Sex is a weapon, ch ch pa pa|And I'm ridin' around I'm gettin' it|You already know my steelo|I'm big like sellin' killos|And you small, small like peehole|And them choppa on my backseat|Hand reach no plan B|I'm the type of nigga bring a pistol to the Grammys|Test me uh uh|Shoot you right there|Leave you right there|Leave the scene, tall nigga with long hair|You might also like[Hook]||[Verse 3: Pusha T]|If you ain't talkin' dollas|I ain't tryin' to holler|Push been on this rap shit|Fuckin' with them guallas|Fuckin' with them eses|Fillin' up them chargers|Gas ain't in them gas tanks|Them shits fill with powder|Caskets for you cowards|Bang out, let it rang out|Call my choppa method man|No way it bring that pain out|Raaahhh, you heard that|Ain't no way to swerve that|Bullets flip, you on yo ass|That choppa push that curb back|Yuugh, fuckin round with those wrong one|Yuugh, spazzin' out like I'm on one|Dark skin nigga wit a long gun|Right there, that's nightmare|Like elm street, this hell week|I'm candy man with that white chyeah|[Hook]14Embed"
N.O.R.E.,Sometimes,1999,"Sometimes Lyrics[Noreaga and Maze]|Yeah, break half the Dutch off|Yeah this for them niggas, can't be here|Pour out half of that shit|Pour out half of that shit, 'fore you pass it to me nigga!|Just missin them summer jams|Summer jams at the Apollo, the Greek Fest-es|Brooklyn Queens things and shit|You know Harlem Weeks and shit like that|Niggas I miss that can't be here with us thuggin it out|Thinkin about them good ol days and times|Word up, this is for them, spit that shit|[Noreaga]|Aiyyo I grew up like the regular thugs, I think I told you that|My only means of gettin money was just sellin crack|Outside a nigga did a bid, nigga all of that|So now I kick back, and get paid for raw rap|My nigga 'Pone ain't home, not yet|Yo it really don't matter just be zoned on the same set|Me and Trag kick it, on the here and there|Don't really hang too tough, but the love is there|My pops died on July 3rd|Ninety-Eight so now a nigga need mad herb|Cause my, pops is here aiyyo he loved his son|Matter of fact my pops was the one to show me a gun|And said, ""Papi, you gotta protect your moms|Even if that means that you gotta strap up arms""|He used to make me hit the punching bag, my dad|He was a boxin God, and he was real he was glad|Yo the boxin the Golden Glove, he just a thug|And I love him yo, so I'mma spread that love||[Chorus: Noreaga]|Sometimes I wanna cry and pray, sometimes|Sometimes I wanna chill and lay, sometimes|Sometimes I get drunk, all god damn day|Sometimes I wanna go, back around the way|Sometimes I wanna ride to smoke, sometimes|Sometimes I got money and I still feel broke|Sometimes I wanna cry and pray, sometimes|Sometimes I wanna chill and lay, sometimes|Sometimes I get drunk, all god damn day|Sometimes I wanna go, back around the way|Sometimes I wanna ride to smoke, sometimes|Sometimes I got money and I still feel broke|You might also like[Maze]|I cock and pop three in the air for my niggas not here|Locked in with me, your legacy lives on with me continuously|Tremendously I blow weed deep in my memory|You still breathe, your face show through your seeds|And who would know one day you'd go so quick, we all felt hopeless|Through blunt smoke my pen spittin and I show this|A sworn oath you would know this, I go the lengths|With my rap strengths, when I think about my past friends|K-Rock and Diesel, Primo from the same block as me|Since we was shorties, they're paintin project glory|I get touched, it all absorb me like a weed head rush|Keepin' it thorough for my past heroes|I must for my people, street and physical, I still see you|Featured in my heart, sometimes it might wrinkle|Much drinkin' when I'm thinkin', it's like I feel a hush|Over the skies touched by dead guys speakin'||[Chorus: Noreaga]|Sometimes I wanna cry and pray, sometimes|Sometimes I wanna chill and lay, sometimes|Sometimes I get drunk, all god damn day|Sometimes I wanna go, back around the way|Sometimes I wanna ride to smoke, sometimes|Sometimes I got money and I still feel broke|[Noreaga]|Yo from Biggie Smalls to Killa B to, Bob Marley|And, 2Pac, yo Twin and my pops|They hard 'tard and smiley, T-Bone too, yo plus|My nigga Rahiem, from Guy Brewer|You know I pour out beer for Fernando too|And I still smoke my boogies in the rest of the crew|Yo ain't nothin changed still play ball the same|I used to cheat a little bit, just to win at my game|But y'all niggas ain't here, can't believe this shit|Thought you'd always be here, thought we'd always be click|But y'all niggas not here no more, it ain't fair no more|Sometimes I get stressed and kick the door|But I maintain still holdin in the pain|Why my pops had to go, why he couldn't sustain?|Motherfuckin Mambo, yo I loved my dad|I know he probably didn't realize, what he had||[Chorus: Noreaga]|Sometimes I wanna cry and pray, sometimes|Sometimes I wanna chill and lay, sometimes|Sometimes I get drunk, all god damn day|Sometimes I wanna go, back around the way|Sometimes I wanna ride to smoke, sometimes|Sometimes I got money and I still feel broke|Sometimes I wanna cry and pray, sometimes|Sometimes I wanna chill and lay, sometimes|Sometimes I get drunk, all god damn day|Sometimes I wanna go, back around the way|Sometimes I wanna ride to smoke, sometimes|Sometimes I got money and I still feel broke||Sometimes nigga, sometimes|Feelin broke|Got a little cream|You know I ain't gonna front|My niggas gettin' glossy eyed in the studio and shit|Word, about the people we talkin' about|Hittin each other in the heart|That's how we do it, for all those who ain't here|You know we still pour beer|And it's all dedicated for y'all|The shit is all dedicated for y'allEmbed"
