rapper,song,year,lyrics
Redman,Noorotic,1994,"Noorotic Lyrics[Production by Rockwilder & Reggie Noble]||[Intro]|Y'all motherfuckers buckle y'all motherfuckin seatbelts|If you need to get high, there's a mask and shit in the overhead compartment|I can't tell y'all what the weather's like cuz my radio's fucked up|And if we should experience any type of motor difficulty|Don't panic, take one more hit off the oxygen mask|Calmly put your hands between your legs|And kiss your black ass goodbye!!|[Verse 1]|I'm swift like a motherfuckin gift for Christmas|When I send my vapors off like Halls menthalyptus|My verbs and nouns shatter walls of underground|Let me be blunt: I like crackin brews with bitches|The ninety-four era I cause terror, whatEVER|Rainin on you punks with the funk, so get your umbrellas|My guns cruise, tennis shoes, what's happenin|I got clapped on, now I'm the one doin the clappin|I'm Flexi Wit Da Tec like Artifacts make Memorex|Blow tape decks when I'm more strapped than latex|Felt like menopause, I make niggas act like beatches|Yo yo that nigga Red be frontin -- with they ass full of stitches|Woo! I just don't give a FUCK|I bite your whole nipple off, sick like sickle-cell anemia|Travel around my curse universe|I'm droppin 98.7 degrees down to Red Alert|Droppin the slang, I'll bust your brains with the real shit|Come hit my blunt so I can make y'all feel it|Abuse niggas verbally so call DYFS|I'm a warrior, to the heart, but I didn't kill Cyrus|Noorotic, my style format rocks the project|I get as ill as chief of police on narcotic|Give me a time and I'll free your mind and lick your|Funky emotions, to blow your veins up with funk overdosage|Now who's that nigga that got your crew bellin?|Not with guns with funk when I rock tracks like Van Halen|You might also like[Hook (2x)]|Fuck you, Redman!|(Motherf-, fuck you!)||[Verse 2]|I'm in the world, with Jacob's Ladder|I'm seein a lot of happy copycat rappers actin like they got asthma|They attackin me, they slowin they rhymes down actually|They got factories with little dolls named after me|But it's no question my funk segment leave the whole atmosphere|Pregnant, I take advantage of niggas like I was molesterin|Newark New Jersey's what I represent|Iiiiiiiyiiiihhhhh|My brain be zoned and I phoned home to ET's home|And to hook me up with stash spots to put my chrome in|Whattup to Prince Street, Avon Ave I roll a spliff with|Fat to be passed through Bedrock and Diamond District|So what the fuck I got clapped on for my truck|Then I laughed cause fuck the cash I just wanted my tape bag|Fantastic fabulous my shit is fat shit|The bomb like Elway throw bombs on John Madden|Fuck that, let's get to the point, my shit's the joint, I roast|Motherfuckers from the East coast to the West coast|To your breakfast toast (fuck it!)|I got funk for days by the buckets|PPP packs a bunch of wild motherfuckers|Hold hold hold, wait wait wait wait|Let me school this bitch|Yo bitch my shit is tight, can any MC do this...|""Whose pussy?"" *woman moans*|""Whose pussy?"" *woman moans* *woman moans*...|""Whose pussy?""|And come back on the mic?||I think not, my paper make pen leave nuff ink spots|On blocks where your punk ass still bustin off slingshots|Talkin shit about me when I'm drivin by slowly|Sayin I'm this and that when half y'all punks don't even know me|Now just for that I let your girl suck my dick from the back|And let your moms give me cornrows on my crack|Because I'm nasty like that1Embed"
Redman,We Run N.Y.,1994,"We Run N.Y. Lyrics[Production by Reggie Noble]||[Intro: Dr. Trevis, Hurricane G, Redman]|Hahahahahahaaaaa|[KRS-One] Watch out!|Geyeeah! As we take a journey to the darkside|[KRS-One] Watch out!|From Hell and beyond, the knotty-headed nigga era has triumphed|[KRS-One] Watch out!|A new era! If you don't know, your bitch ass better|[KRS-One] Watch out!|Ask somebody! Shoot em up!|[Glo] The Hurricane G is live and in color|[KRS-One] Watch out!|[Glo] We run you motherfuckers!|[Red] The Funk Doctor Spot coming live and in color|[KRS-One] Watch out!|[Red] We run you motherfuckers!|[R+G] Puffin mad spliffs, so fuck a bitch|And a nigga, cause niggas, and bitches ain't shit!|Hahahahahahaaaa! Dr. Trevis|[KRS-One] Watch out!|Is in the motherfuckin house|With a couple of sick patients for your bitch ass|[KRS-One] Watch out!|Yeahhh!||[Verse 1: Hurricane G, Redman]|The Hurricane G is the ultimate funk, pop the trunk|(Hoo-hah!! Wild like Shaolin monks)|Representin', comin' out of Brooklyn, Flatbush|You wuss, you can't push push in the bush||Well uh, let's take a journey to hell and beyond|Where the bomb grows on palms, and bags labeled Cheech and Chong|The Jimi Hendrix of rap, I got an afro and|Bandana, then I rock jams like Santana|I move MC's like niggas move keys uptown|Red and Hurricane G, SO HOW YOU LIKE US NOW?!!?!|You might also likeChorus: repeat 4X||[KRS-One] Watch out! We run New York|Yeah||[Verse 2: Hurricane G]|(Hurricane G hit em one time)|From the Brook, taught how to trick by the real gangsta crooks|So I hook back what you took!|I take my funk and my religion serious|Sanctify y'all and leave y'all house niggas delirious|(hahahahaa) cause I'm furious!|How dare you motherFUCKERS, forget about the ultimate|Funk, BITTTTTCH nigga!|I got your wicked witch with a switch|Motherfucker, fuck you and your crew!|So what nigga, is it you wanna do?|In ninety-fo' I kick the wicked for the bitches|For the real trick deez who can dig it|Cause after pop thought all that, Hurricane stay fat|Word to my big dick boriquas in the back|The queen of the East coast, funk gangsta pack buddha|On the rhyme since eighty-nine|It's all in your mind, but what's yours is mines|Your dough and your hoes Bump N Grind to my rhymes|Now! It ain't a nigga who could hang|Or pop yang, about a motherfuckin th-a-a-a-ang|And uh, fuck any bitch who can't hang|I'm representin bitches universal!|It go, one for the biz, on the bizness|Which y'all blesses with God's blessings, do you see?|Hurricane and Redman original steel|Latin Queens in the house!!|So nigga swing it over here on these big fat tits!!|(Titties, hahahahahaa)|[Verse 3: Redman]|The Funk Doctor Spot, blast up on your block|I'm walkin through the sewer with manure on my socks|Your style, I freaked it when I was a child|So you talkin that baby talk like, Who's Talkin Now?|Verbally I crush, brains erupt|Blow your focus, like you sniffin angel dust|Run of the mill I'm not, watch me kill a cock-sucker|And cause ruckus, like them L.O.D. motherfuckers|Every verse every word I preach|Represents the East, long as the human eyes can see|Gimme that funk funk funk funk funk funk funk funk beat!|I light a blunt for niggas up in Sing-Sing|I do it to death, style is funk that's fresh|Remove your vest, you just won the wet t-shirt contest|And I'm hotter, than the Globetrotters in the Bahamas|I got a pair of pajamas made out of ganjah and almonds|Eager, as a nigga wantin my shit to dub|Cause my shit be BANGIN like the Crips and Bloods|Troop, I flew the coop like Big Bird in Timb boots|I Skywalk the planet like my code name was Luke|From the darkside, I'm from the darkside Pah|I'm Above the Law like Steven Seagal|Motherfucker!!||[Outro: Dr. Trevis]|[KRS-One] Watch out!|Hahahaha, we take you to the darkside|Come travel|[KRS-One] Watch out!|On our metaphoric futuristic type shit|As we blow your brains like spliffs|[KRS-One] Watch out!|Dr. Trevis is outta here|For the nine-fo' you stank... bitch|[KRS-One] Watch out!|Yeahh|[KRS-One] Watch out!Embed"
Redman,Blow Your Mind (Remix),1992,"Blow Your Mind (Remix) Lyrics[Intro]|Ahem, hit me|Yeah|It's goin down|What's goin down?|Yo, yo, yo, Reggie Noble, drop that beat in, ha|Yeah, uh-huh, uh-huh|Give it to me, give it to me||[Verse 1]|Ahh, look out, it's the Funkadelic funk for chumps|Who don't be knowin' my name, I tear the frame out ya punks|I make ya slide, make ya slip, make ya wanna backflip|I get biz with the skit, I DJ like Quik|The top-notch of the block 'cause I carry a Glock|Holy hot rocks, I'm hot, so give up the props|My style is hummin' comin' at ya, duck or get backed up|Dispatcher (Red, get freaky to the rapture)|So come on, light the buddha, check your honey while I scoop her|The Superfly Jimmy Fly Snuka rips the roof off|Then hook off on your crew, to the check of one-two|It's you (Ahh), funky fresh in the flesh, troop|Come on and get down and boogie-oogie with the roughneck|Hit women like Madonna all the way down to Smurfette|But first get your tables, I roast your whole record label, kid|Yo, Red (Whassup, G?), bridge|[Chorus]|Ooh, you blow my mind|On and on and on and on|Ooh, you blow my mind (Look out)|On and on and on and on (Ahh)||[Verse 2]|Can I tear the roof off this mother? It's the funkdafied brother|Then I laugh, because I burn ya like Backdraft|So call the fire engine 'cause I'm flamin' up your buildin'|One life to live, so the funk is in all my children|'Cause I can get wicked like the witches from Eastwick|And freak the type of funk to make all y'all teeth grit|And crumble, my style is more flyer than the Brundle|Fly from The Fly part one, The Fly part two|Psycho-beta-P-Funk, got styles hard as tree trunks|For real punk, you got a blunt, light it 'cause I need one|And get down with the irrelevant funk to make ya jump|With the fly human being, watch me freak it in Korean|저리가 비켜라, 물러 가라|누구냐? 날아, 나, 나는 Redman|나보다 잘난 놈 하나도 없다|이 세상 제일인 나는 Redman, my man|I rip shop in hip-hop, I get props, my lip rocks|The rap stuff's more spooky than movies from Hitchcock|Sit back, relax, let me rip to the funk track|And press rewind if I haven't blown your mind, ah|You might also like[Chorus]|Ooh, you blow my mind|All around the world for the funk (On and on and on and on)|All around the world for the funk (On and on and on and on)||[Verse 3]|Let me get busy with the funky-fly stuff, 'cause I'll cut your freakin'|Eyes out, fuck Bruce Willis, because I die rough|It's the Funkadelic Redman and I hit ya with the|Funkadelic level, the P-Funk, the devil|The spectacular, Blacula, bust holes like Dracula|Loaded, of course, more legend than Acura|I'm swift, I like big spliffs so I tisk-tisk a tasket|Plus keep the Glock in my basket|I'll cough up a lung 'cause I freak it with the tongue|'Cause I can wax on, wax off like Daniel-san.|Do the yay-yay, the boogie, say up jump the boogie|To the boogie to the boogie, thanks to E 'cause he hooked me|So fuck what ya heard, word to herb, 'cause I mac-frama-lama|Plus I kick the grammar straight from New Jerz|It's the renegade rap Redman, really who rip rhymes|In rough mode, yo, hold your breath while I explode, haEmbed"
Redman,Jam 4 U,1992,"Jam 4 U Lyrics[Intro]|*Inhale*, *cough*|Yo, this is for motherfuckers that talk that sellout shit|Watch my hands||[Chorus]|I just want to jam for you|I just want to jam for you (Ev— Everybody get up)|I just want to jam for you|I just want to jam for you (Get on up— Get on up)|[Verse 1]|Get down, get down (On down)|Like James Brown, plus I get down|But for now I get on up|Rhythm and funk makes you hump like Technotronic, I'll make the Jam Pump|Strong to the finish when I freak the fly gimmick like|""Da-na-na-na-da-da"" without eating my damn spinach|'Cause when I'm on a roll, that's when Redman start to chill|Round off backflip cartwheel|Ahh, you're nasty! I know|When my afro grow, that mean more rhymes to flow|But I continue on the menu, and send you|On a jam that earthquakes the whole damn venue|It's like this, it's like that, I won't slack|I pack more steel than the cops pack blackjacks|Word is bond, the quiet storm broke your arm|When I sound off from here all the way to Hong Kong|Drop pound for pound to throw down and strut|Yo, E, what's that funk mode? Get on up||[Chorus]|I just want to jam for you|I just want to jam for you (Ev— Everybody get up)|I just want to jam for you|I just want to jam for you (Get on up— Get on up)|You might also like[Verse 2]|Check this out here, let the rough cut-cut your ear|Hit Squad's the crew, I'm twenty-two and Beck's the beer|Float like Muhammad, roll-on like Secret|Me rip the crowd in half on the sneak tip|'Til they crumble, too humble for you to stumble|I sting like a ba-bee while the others bum-bumble|Don-dan-dan, do-do-don-ding|Extremely wild like the hair on Don King|'Cause I kick the mode to make your brain explode|It's the huh, the funk, now I'm known around the globe|So buckle up, hush up, while I freak the funk to get down|With the sound, grab my bozack then I freeze now (Freeze now)|On your mark, get ready, get set, let's go|With the flow to jet like Delta, or Jesse O-|Wens with the Benz, I clean my front lens|With a system, that knocks harder than Rin-Tin-Tin|Without question, I'm flexy when I'm sexin'|Wicked when I kick it like A Tribe Called Quest and|The rude Redman rip backbones and hips to bits|Then split ya from your wrist to your armpits|But true indeed, since pops dropped the seed|I knew I'd be the funkiest brother that ever bleeds|Rough and rugged, more nuggets in the bucket|That's dumb, dumb dollars, and yes, Redman love it|Pound for pound, I throw down to make ya strut|Yo, E, what's that funk mode? Get on up|[Chorus]|I just want to jam for you|I just want to jam for you (Ev— Everybody get up)|I just want to jam for you|I just want to jam for you1Embed"
Redman,I’m a Bad,1992,"I’m a Bad Lyrics[Verse 1]|I get mad wicked, (Fuck around) and catch a bad one by the funker|I puff the mad spliffs and roll blunts with Archie Bunker|'Cause my brain is twisted, so I cock the biscuit|'Cause shit's thick, some say I'm a bastard of a swift bitch|Negro, funkin' it with the style in your ear, bro|To make you fear me like Cape without Robert DeNiro|You big pussy, so funky that you have to douche me|You can't hear me, then my record label didn't push me|I know I'm sayin' funk too many times in my rhymes|But if I wasn't that, I wouldn't freak it in the line|But it don't seems to matter 'cause my shit get fatter and fatter|I'll do the funk in your face and it slaps ya|How does it feel with the face full of funk?|With the bass in your trunk? Weed laced with the blunt|I puff, I never got snuffed|Bust while I dust your monkey ass off|Thin ice is crushed on the hush-hush|So if you want a taste of the funk from the gutter|Ask the brothers (Why?), 'cause I'm bad (Word to mother)|[Chorus]|I'm a bad (Yo, word to the mother)|I'm a bad (Yo, word to the mother)|I'm a bad (Yo, word to the mother)|I'm a bad (Bad, bad, and a wicked in bed)|I'm a bad (Yo, word to the mother)|I'm a bad (Yo, word to the mother)|I'm a bad (Yo, word to the mother)|I'm a bad (Bad, bad, and a wicked in bed)||[Interlude]|Yo, yo, check this out|This is for y'all hokey-pokey, punk, pussy motherfuckers|Just to show y'all I do what the fuck I wanna do|I want y'all to check this on the real|And yo, check this out|Shake it, come on, shake it, come on, shake it, come on, shake it|What's up now? What's up now? What's up now? What's up now?|What's up now?|Yo, Red, come on, get back to the track, man (I wanna get out of here)|Yo, kid, chill, check it out (Alright, alright)||[Verse 2]|Flexy, I'm sexy when I'm standin' in my draws|If you can't check me when I'm rappin', put the tape on pause|And listen to the incredible shit that I kick, my man|Give me five on the backhand, then stick|Your finger in a hole and chop the stick quick|'Cause my lip get to the point to still rock the fly shit|Since you're holding your breath, I hold my jewels|I swing hardcore, so I walk, holdin' my tools|The original P-Funk, takes no junk from a chump or punk, G|I been this way every since nine months|So get down while I rip the raps from my lip 'cause|My shit's more deep than any tape from Enigma|The gettin' nice, thinkin' killer brother who pop trash|Basic instinct, I'm a shooter, so they got blasted|Much ass I kick, groove to the master mix|My song still pumps when it's not even mastered, bitch|My shit's very chronic, so rewind it|'Cause it's like (Eh-eh-eh-eh) beyond bionic|'Cause I'm a wild and crazy guy, no lie|Last brother to battle me, I started pissin' in his eye|I'm bad, word to mother, to the motherfuckin' Hubbard|Eatin' her curds and whey, puffin spliffs 'cause she doesn't|And if you still don't under-fuckin'-stand where I'm comin' from|Listen to my 9, understand where it's hummin' from|You might also like[Chorus]|I'm a bad (Yo, word to the mother)|I'm a bad (Yo, word to the mother)|I'm a bad (Yo, word to the mother)|I'm a bad (Bad, bad, and a wicked in bed)|I'm a bad (Yo, word to the mother)|I'm a bad (Yo, word to the mother)|I'm a bad (Yo, word to the mother)|I'm a bad (Bad, bad, and a wicked in bed)1Embed"
Redman,Journey Throo Da Darkside,1994,"Journey Throo Da Darkside Lyrics[Intro]|Woo-woo-wowowowooo!|Lord hi-gher|Could somebody turn on da lights|Somebody turn on da lights|The darkside (Yessss...)||[Verse 1: Redman]|Guess who's back when I bring funk like Zapp|All aboard motherfuckers, while your brains get jacked|I'm souped like two scoops of funk juice, word to mother|The way I kick, you swore that Jim Kelly was in this motherfucker|The darkside brings apartheid|I act wild like them niggas from Chi-Town on the Southside|Sweeter than this, whoopin niggas down like Jack Nich|When I backflip my tactic graphics|Ooooooh! Redman jams it in|Due to difficulties I won't be done by ten|Friend I got bust shots out the twelve Benz|And then we get the bam-ba-zee from one-ten|Or is it further up? Plus my style murder ducks|So what the fuck, you got the mic turned up fo'?|When I Chief Rock underground MC's drop like sheet rock|Here's a ride to the underground|[Hook]|To the beat y'all...|Ah, to the beat y'all, I do the freak y'all|I keep the buddha to last me through the week y'all|Ah, to the beat y'all...|Ah, to the beat y'all, I do the freak y'all|I keep the buddha to last me through the week y'all||[Verse 2: Redman]|Come take a trip on my cosmic boogie movie flicks|Far beyond space so niggas say your grace|It's a True Lie that I bring drama like Schwarzeneggar|When a baby, I had other babies in labor catchin vapors|With two gats I move like too fast like Paxton|Ask Toni Braxton who got seven days of action|Black stars or moons eclipse the volume|Bang zoom I'm sendin honies on the moon with ten bags of boom|Ridiculously I will rip an MC|To degrees I leave spots like chicken pox, check the synopsis|I grow confusing just like Rubik's cube boxes|Float like the butter, fly so what if I|Blow your lenses, tear the fuckin hinges|Did I mention that my lyrical format gets more ahh's than a dentist|When I'm in this, the knotty-headed era causes terror|Y'all gimmick motherfuckers better get y'all shit together|One for the money and two for my peeps|Nynex can't even reach my technique or rap sheets|For the Squad I lick two shots word to God|Then take y'all dreams and imaginations|To the darksideYou might also likeEmbed"
Redman,Bars,2015,"Bars Lyrics[Intro]|(All you emcees must get dissed|Cause only real niggas gonna bump my shit)|I don't give a fuck nigga, you already know what it is|(All you emcees must get dissed|Cause only real...)|Check it out, yo||[Verse 1]|Like OJ let me take a stab at it|Inhale like asthmatics|The chiropractor Redman, I'm back at it|My sawed off by the bed, it's a craft-matic|The size of a Subway sandwich, ask Jared|Big foot givin' input|Every rhyme like Lisa Ray homie, fuck with it it's a good look|I'm a lieutenant, the new school respect Red Menace|My society raised a winner|I set any bitch straight to restore order|Lift my pimp hand up like ""Why I oughta""|I don't tolerate the nonsense|I tell my bitch be easy like you straight outta Compton|South by Southwest out in Austin|Tore the place down, Twitter went ""Wow""|Def Jam raised their eyebrow, we independent now|You should've took care of the cash cow|Moooove out my way bitch, Captain Courageous|Fuck you and your iPod if I ain't in your playlist|Bravehearted, I'm Nas in '94|You could say I'm your favorite rapper's favorite|I'm like Penny on the floor wasted|Pump your brakes, divorce me if you can't relate|I get brain when I text, I'm typin' LOL|Chick on her knees like SMH|Get it? Too slow, listen faster cause my time's a factor|You freestylin' and I ain't asked ya|Weak link niggas, Red'll think bigger|This flow hit your chick, she cry me a river|And you Simba lyin' like you carrying around the iron|Like I'm a supervisor and I'm firin'|[Hook]|(All you emcees must get dissed|Cause only real niggas gonna bump my shit)|Bars, okay nigga|Bars, I got 'em homie|Bars, all day nigga|Bars, you can count on me|I'm like a cat for my life, I got nine on me|You think this song done, I got another round on me|Bars, okay nigga|Bars, I got 'em homie|Bars, all day nigga|Bars, wait a minute|(All you emcees must get dissed|Cause only real niggas gonna bump my shit)|Check it out, yo||[Verse 2]|Yo, I'm a 90s nigga so of course I think my era the best|Untouchable, fucker, we Eliot Ness|Mitchell & Ness, it's all Jersey|Hoes send my wild DMs—I feel I'm related to X|I don't be up in the trap tryna write raps|Just to say I'm in the trap and made it off rap|As the world turns, I let my L burn|And watch you little fish swim up in my whale urine|Even gay bitches love me like the L-word|And bitch niggas get a clip from a spell bird|I mean the Mossberg|The same thing, my weed got a case of gangrene when it's angry|I act like Scarface up in your project hallway|Make sure you're all covered  by AllState|Me and them beats in your ear like Andre|And what I think of y'all motherfuckers, strange|Fuck y'all, I'm addicted like a menthal|I was born from the days of ""yes, yes y'all""|My boy carrying a tech, rep call|So take your bitch ass home, Watch your cholesterol|I don't talk a lot, I just rap a lot|On this verse, I got tips from a astronaut|Check the forensics, we in this|I'll end this with Red is the best in the motherfuckin' businessYou might also like2Embed"
Redman,Rollin’,1996,"Rollin’ LyricsNineteen ninety mother fuckin six|Pack that shit up|Get the motherfuckin Squad packed|We got to pull these shoes out like carpet, word is bond|Test the crew with the guns and let's get this shit on||[Verse 1]|Whyyyyy must I be like that?|Whyyyyy must I pack the gat?|All my loud, niggas be rollin with the ruckus|Ready to get deep bust rounds upon some suckaz|Heard P.P.P. and L.O.D. is a bunch of crazy motherfuckers|Journey to the land is on|The winner of the spittin bomb marathon|The fuck you up lyrathon, whatever you choose|Prepare to lose that title|Turn a vital situations suicidal, my idols, is my Uncles|Who started smokin weed outta bibles|Gave me a puff when I bust my first rifle|Men-estration cycles, I give bitches|Bring your craziest nigga, I'll give stitches|Whateva, go crew for crew, blow for blow|Bang your headpiece and sniff the snow off your ho|I keep it rollin...|I kick a hole in the speaker, pull the plug, then I jet||[Verse 2]|How ugly do you have to be to be a hardcore MC?|Niggas be fooled by my plaques and my light skin complexture|My whole texture is bombin, destroyin da schools of the wack|From the Land of the Lost, you get tossed|Listen to my veloc(ity), my crew's comin off|Yeah, more sneaky than casino switches|Diggin ditches for all Moskino bitches|Clockin decimal figures, I'm gettin out diggers|Now my choice of truck is a Land|Cause a Landcruise much bigger|It pack two to three more niggas|Damn I hate a golddigger|Yeah, gimme that microphone|I make opponents shit bricks like Tyson's home|I keep the jacked cellular phone blown in three zones|Love seafood and keep my nine millimis chrome|So it can shine up your dome|When I proceed to give you what you need and clear spots like Sea Breeze|Wreckin your ass armageddon style|Twenty four seven while|My crew chin check your profile|(Rollin...)|You might also likeI kick a hole in the speaker, pull the plug, then I jet||[Verse 3]|I'm the master of disaster, super rhyme maker|Grimy by nature, database maker|Play em out like Sega, Saturn|Blow your blocks in patterns for about nine acres|Testes, crew wearin bulletproof and double S's|Karl Kani down, camoflouge can't hide the sounds|Of a fo' pound (boo-yaa)|Givin you Six Flags, bustin merry go rounds|But my crew stay ill with that unreal appeal|I be the raw water, my cheek bones outta have gills|Below like the opera|Smooth on the trigger for all you block cockers|I be the key to criminology|Blast and rotate enemies at three buck sixty|Pick me, as your Senator|Take the love from your battlefield son, fuck Pat Benatar|Run, head for the hills|Back in the day, these niggas rolled up on me with|The trunk filled with Bomber Brooklyns, sheeps and quartervilles|Aiyyo take that shit, aiyyo Money snap the grill|Body caught chills as he ate this nine mil|Mine kills two but my nine was sign sealed|And ready to deliver, but Money had me too close|To reach for toast, soon as that nigga blink I broke ghost|Dash back to South Orange Ave with dollar bill to smoke dope|I keep em rollin...||[Outro]|This is DJ SAY WHAT on this motherfucker|Sayin the dick is long, but my time is short|Before I go, just remember|If your box ain't on FDS radio, you're fuckin up2Embed"
