rapper,song,year,lyrics
Black Thought,Black Thought Freestyles on Flex | Freestyle #087,2017,"Black Thought Freestyles on Flex | Freestyle #087 Lyrics[Verse]|Uh, I'm sorry for your loss|It's a body dead in the car and it's prob'ly one of yours|The writing all across the window and the walls|Whether it was true or false, we shouldn't have got involved|Remember, we walked past the teacher, take the chalk and laugh|We wrote punishments: ""I will not talk in class.""|Now it's pistols punishin' people for talkin' fast|And all these innocent bystanders is haulin' ass|I hate to say I told y'all, but I told y'all|Things fall apart when the center too weak to hold y'all|I'm just collectin' what you owed to my old jawn|You 'bout to get swooped down on and stoled on|Fools swear they wise, wise men know they foolish|Well, we was headed for the web, even before computers|I never thought you'd give me a reason to do this|Cain and Abel, Jesus and Judas|Caesar and Brutus, I see intruders, avert your eyes|I told you keep out of the hood: circumcise|How could you sleep? I thought you always was the first to rise|Ayo, you heard the line, ""Everybody plays the fool""?|Well, I'll be that exception to the rule|The principal that hand-deliver lessons to the school|I was makin' major moves, my dollar déjà vu|My mission when my ambition was brandishin' a tool|To be a icon, wearin' slippers made of python|Get mine quicker 'cause I'm slick as a pipeline|Transportin' the oil, tribulation and toil|Hit the operation, but I'm back in the soil|Got my crown tilted, my gown quilted, silk with cashmere|Burnin' Rome down in a minute, built it last year|Newsflash, I dodged the bullet that killed the cashier|My homie told me to come with him to the masjid|Them brothers said, ""Don't go from written bars filled with rage|To primetime television and your gilded cage|Then forget there's people in the world still enslaved.""|I barbwired my wrist and let it fill the page|Gun fire and flares, sirens glare|I'm in a iron chair where people who care don't get the lion's share|When I don't give a fuck then I ain't fair|I'm on a higher tier with people gettin' money like the financier|Catch the herald, I'm fresh chopped and beveled|Rap on a doctorate level, so F. Scott Fitzgerald|Maybe I'm the new Rakim, maybe I'm fat Pharaohe|Undergarments of armor be my intimate apparel|Pre-Kardashian Kanye, my rhymeplay immaculate|Same cadence as D.O.C. pre-accident|Maybe my acumen's on par with Kool G. Rap and them|Give me the proper respect, mothafucka, we back again|For a couple things we lost in a fire|The drive, the desire to perform on a higher|Plateau, I'm at that show lost in a mire|Wonderin' how we got so far from inspired|Look, when photos were sepia-toned|And record players were somethin' you would keep in your home|Yo, the traveler, the meaning of Tariq he was known|For the exemplary performance uniquely his own|I made the twenty-one pound for some a newfound religion|Where money's put down, it's only one sound that make|OGs and young lions equally proud to listen|The secret amalgamism, a algorithm|Comin' from where only kings and crowns permitted the darkness|Where archaeologists found my image in parchment|Rolled into a scroll, holdin' a message for you|It said, ""The only thing for sure is taxes, death and trouble.""|The anomaly sworn solemnly, high snobbidy|Freakonomics and war policy, dichotomy|That's Heaven and Hades, Tigris and Euphrates|His highness, the apple of the Iris to you ladies|As babies we went from Similac and Enfamil|To the Internet and Fentanyl|When all consent was still against the will|I got that detox for y'all|The microphone doctor, black Deepak Chopra|I'm a griot that make you wanna peacock your arm|Every heavy dignitary payin' me top regards|Boy, I'm three optics far from your binoculars|So that smart money finna get the heat out the car|Yo, I'm K.Dot Lamar meets 2Pac Shakur|Got profiled by a few cops, too hot to charge|Listen, somebody said a price tag was on a rapper's head|So we gon' see a nice bag when a rapper dead|The mask black, the flag green, black and red|They'll probably wave a white flag after plasma shed|No doubt, yo the game went they own route|I can't explain what these lame kids is talkin' 'bout|Or how they fit they whole foot into they own mouth|I put a couple bodies in a brown bag, then I'm en route|I'm sneaker shoppin' with my son, a size 8|Prior to they release 'cause why wait?|Look, in my estate I got electrified gates|For these blasé guys hatin' at a high rate|'Cause I dodged fate, then got great, the fly's straight|If we ain't family or friends then we don't vibrate|And I'm that gun in y'all face, none of y'all safe|If I catch you at the right time in the wrong place|Slippin', sippin' on somethin' with a strong taste|Like Whiskey or bootleg Bourbon with a corn base|My Levante resemble a vehicular threat|The mic I spray resemblin' the sickle of death|It ain't strenuous to come from a continuous breath|I set fire to the venue, I'ma spin you and step|Rinse, repeat, you checkin' for the sound of the beast|I'm the hound, I'ma creep, I get down, I'ma eat|I'ma keep somethin' to lay a naysayer to sleep|Playin' with heat, nobody and nothin' fuckin' with 'Riq|Yo, these weaklings is claimin' they cuttin' up in the street|Nigga peace, you ain't workin' with nothin' but the police|Listen, you ain't finna be nothin' but the deceased|Listen, you in interment with a permanent crease|I strike fear in the hearts of rap figures|Who mind bare the stigmas of time, no black privilege|From boom bap niggas to trap niggas|You in the trap with us, when the lines is as vivid|As the walls on the graph, autographed by the Lord of Wrath|I reside between the seconds on the chronograph|How much more CB4 can we afford?|It's like a Shariah Law on ""My Cherie Amour""|How much hypocrisy can people possibly endure?|But ain't nobody workin' on a cure, my young bull|Y'all just regular, I'm an apex predator|Brim stay fresh, feathered up, etcetera|Nevertheless, I got a message and left|One dead messenger, yep|My pen is Henry Kissinger, Buzz Bissinger|Look, my caporegime is to no redeem|And my oldest son Ahmir Saleem out of New Orleans|Took a golf cart to the Baccarat from the Waldorf|What was on the wall? That depend on what you call art|I'ma say 300k ain't even in the ballpark|I charge more just for awkward small talk|So yes, who's fuckin' with it if it's not the best?|I get the lobby painted fresh upon my request|It's Kafka-esque, his holiness, stop the press|That Cobalt blue, reminiscent of Makkaresh|Lord, we got Padma Lakshmi for you|Let her massage your back with black seed oil|The foundation is firm, the flags need soil|Me? I need royalty because I bleed royal|Go through the veins to the brain, fabulous and strange|My journalistic range is a catalyst for change|It got anybody that listen pissin' flame|And 'cause the Hall of Fame got so many missin' names|I'll acknowledge the original People's not Oliver|Y'all go get the next challenger for Excalibur|I'm more policed for my core beliefs|They tried to capture me|And brand me on the cheek with a fleur-de-lis|The side of my heart'll be more discreet|I'm international, my passport page is like War and Peace|I've always played my part from the start|Back in Philly where the triggers is mandatory to spark|With a slightest inflammatory remark|I have you and the livin' a category apart|Listen, a grain of salt'll tip the scales, it never fails|Walk on egg shells, sleep on a bed of nails|Criminal records like record sales|Makin' heads or tails, we like Henrietta Lacks up in the cells|My mother was a working class, very lovin' woman|Who struggled, every dinner coulda been the last supper|I come home, chasin' good-for-nothin' half-cousins|And then walk in the crib to the smell of crack cookin'|She was introduced to that substance abuse|On some of the strongest drugs that the government produced|Look, I even got excused by the principal|My story is out of the dub dub interview|I've seen some ice-cold summers, hot winters too|I never thought I'd win Grammy Awards with The Roots|I never thought I would be gettin' long in the tooth|My OGs told me, ""Boy you better go and live your truth!""|I am a walking affirmation, that imagination|And focus and patience gets you closer to your aspiration|And just 'cause they give you shit don't mean you have to take it|My words capture greatness, sworn affidavits|Yours truly, the celestial bein'|You stay seein' pullin' up in the fresh European|High-steppin' out of it dressed to a T and|Not another got more soul, 'less you Korean|I’ve been havin' visions of Nat Turner holdin' his master’s head|Like Yorick and Horatio in Hamlet|Smackin' it like a tennis racket, underhanded|Send a message through the Gram: ''The Eagle has landed.''|Dressed in a military jacket made of canvas|I am no guerilla, I just make 'em go bananas|Outstandin', red, black and green bandanas|Cocked hammers, hairs on my chin is outstanding|Can't manage the weight of war, they're just out ballin'|Look, I'll fall up from the sky to see my callin'|I'm not crawlin', I'm a free man like Morgan|Seein' manhood in the hood is a damn good bargain|If a black man don't tap dance|And every girl that got a fat booty don't lapdance|Well, I guess it's somethin' wrong, huh?|Niggas completely uninformed|I don't burn bridges, yo I keep the haters' runnin' for em'|I ain't one of y'all peers, I'm the sum of all fears|Somebody stronger than me? Who that? I'm all ears|Like Obama, I wish he had another four years|Y'all some jolly good Hollywood Squares|I'm like, ahem, approach the altar with your offering|I spoil rappers rotten like my only offspring|Being his excellency gets to be exhausting|You in the residency of the one they call King|Dada, Ali Baba, the talented Mr. Trotter|Inside of my right palm, the mark of the stigmata|Big Poppa, wig chopper, emperor Jaffe Joffer, muhfucka|I'm stronger than the coffee out in Kaffa|All y'all niggas vagina-hot, remind me of Icona Pop|I step in the booth, I'm a bull inside a China shop|Mollywhoppin', watch another cotton pickin' body drop|Every time we rock, yo they actin' like it's Mardi Gras|'Til the party stop, skirt off like she that Ferrari drop|Soul Cycle pumpin' that Earth, Wind & Fire ba-di-ah|Coolin' 'pon the dock, à la marina, hard body yacht|You seen another rapper cleaner, mami? Prob'ly not|How it feel to be the best that did it, I admit it|I'm visitin' from planet Bring-These-Niggas-Death-In-Minutes|And y'all know I'm exquisite, wicked as Wilson Pickett|The sickness I exhibit, I'm too legit to quit it|I don't fake it 'til I make it, I take it to the limit and break it|Never timid, what I'm 'bout, I represent it|Infinite just like Chace is, been a million places|Conversation is how beautiful my face is|People hated on how sophisticated my taste is|Then I pulled up on these mothafuckas in a spaceship|Pantomime, I'm made of elements you can't combine|I'm at a level of intelligence you can't define|Einstein, Shakespeare, Voltaire, Tesla|Recording artist slash psychology professor|I preach for the East, never fold under pressure|The beast from the East and I glide like Clyde Drexler|Ayo, my new name is eighty five X's|'Cause I'm the rap game certified specialist|When I was reckless I was worried 'bout the guest list|I'm helpin' rappers everywhere fulfill a death wish|Yo, Flex, I'm glad we made contact|My nigga Osse know this shit for Combat|Brain matter contain too much data|I tell a story like fingerprints and blood splatterYou might also like48Embed"
Black Thought,Twofifteen,2018,"Twofifteen Lyrics[Intro: Sample]|""Hey dis|C'est pas vrai, dis|Pince-moi, dis (Twofifteen)|C'est comme si je n'avais jamais dansé avant""||[Verse]|Yo, the big wheel keep turnin' like Ike's and Anna Mae's|The church kitchen hustlin' dinners every Saturday|Pull over, let me grab a plate, I tend to gravitate|Towards how fish dinners from a styrofoam platter taste|My granddaddy sported plaid Donny Hathaways|Hustlin' for everything we had 'til he passed away|When I would ask him 'bout what path to take|He used to laugh and say, ""No man is an island but I'm a castaway""|Casualties, I seen 'em like the French Foreign Legion|On the streets, they used to carry out bizarre procedures|In jean jackets and Jabbar Adidas|Back when local R&B was just as soulful as orthopedics|Me and my man twistin' up some reefer and wishin'|We knew all the town hitmen and the likes of Sam Christian|On the edge of existence, man, listen|Understand, respect and fear was the all-American ambition|For badass kids in the laundromat, foldin' a load|Well, lo and behold, a whole 'nother fork in the road|My wish for them is that the truth is eventually told|Out on the corner, where whatever you can sell is sold|I heard murder ran this vast, deserted land|Since back when Burning Man was blacks in Birmingham|Before the presidential election diversion scam|Matter fact, before they clapped Franz Ferdinand|You gossip on Jay and Beyoncé or Kim and Kanye|But keep risin' to the top, what my mind say|Picture my daughter drinkin' water where the sign|Say, ""For colored girls,"" I ain't talkin' Ntozake Shange|Who said it’s Senegal? I was a king in general|Rich in every resource, precious metal and mineral|Before the devil entered the land of the plentiful|With that Jamaican funk, gotta get it into who|For generations under God, indivisible|Psych ward patients, vampires in a interview|Become institutionalized, what a nigga do|But what we had to do to survive, none of them could do|Who the technical culprit? I don't mess with no vultures|I'm electrical voltage, not the regular dosage|Too obsessive compulsive, I'm a fuckin' explosive|Mixed message in a bottle, I left with the postman|I'm that arachnophobia, black petroleum|Ceremoniously holy when at the podium|Even though it's hotter than weapons-grade plutonium|The people tryna check for the return of the Ichiban|Obi-Wan, universe, you owe me one solid|My homie Gonzalez, only know gun violence|On the corner where they probably on they 21 Savage|Catch two in your cabbage, Young Cesar Chavez|Division one, yo, wait a min', where we get our rhythm from?|Continuum, still swingin' like a pendulum|Here the women come, sing it like Sarah Vaughan|Heard 9th up in a house from North Carilon'|Ain't no mannequin challenge, but y'all paralyzed|It's gettin' cold outside, a word from the wise|Y'all niggas better bundle up|But I bet it be a hotter summer, not for nothin'|Yo, the cops get down, especially when it come to us|Nigga better be a Rockefeller|Get that out your pocket fella, sang acapella|Ain't a damn thing really changed as far as I can tell it|Another soul with no name, the helicopters hunted|Look like a couple of days before the doctor comin'|But that's my little cousin, watch him for me|I think the world tryna sock it to me|It kinda feel like everything is out of pocket for me|Who keep it a hundred when everything's partial?|Dignity and sanity is what the game cost you|Wake up to the paddles on your chest, we had lost you|I'm just paintin' a picture like Kerry James Marshall|I'm just takin' a picture like Carrie Mae Weems|So smile and say cheese, we in 2018|In a pyramid scheme, nightmares and day dreams|From the runaway slave to a modern day king|[Outro: Sample]|""Hey dis|C'est pas vrai, dis|Pince-moi, dis|C'est comme si je n'avais jamais dansé avant""You might also like6Embed"
Black Thought,9th vs. Thought,2018,"9th vs. Thought Lyrics[Intro]|Twofifteen|Twenty-one pound|Uh||[Verse 1]|I'm not a typical arrogant American on prescribed medicine|I'm sick as I ever been|Rollin' out of the dealership in a McLaren|These rappers is Peter Pan, I'm Pan-African|Space invader blackin' 'em|Mixin' Alexander McQueen with Haider Ackermann|Real rapture in the form of a living man|I don't give a damn, not a mortal could test me|See, I don't get examed|I'm a high priest and a wild beast|Once warrior, now chief—the mouthpiece of the foul East|And I’ma rock 'em, sock 'em robot HOF, I drop bombs|Any flow I got come at you like .coms|You should know I'm not, for the run of the mill drill|I'm still trill, the flame thrower, the real deal|I don’t coincide with the oddness|Your highness is where the pantheon of the gods is, I promise|I'm known for being brutally honest|If lyricism is spiritual to you, then rewind this|I'ma kill 'em, but it ain't about to be with kindness|I believe the industry about to see a conquest|Changin' of the mindset|Money just a concept, never been a object|Even when my mother was livin' up in the projects|Now my ratin' is higher than young Richard Pryor get|Still speakin' my mind, just in a different dialect|[Interlude 1]|It takes two to make anthropology|The student and the studied|That being the case, it is time for the studied to examine the student and to evaluate its own self||[Verse 2]|I said, I seen it all, I had it all and I ain't mad at all|This rapper toss gravitas like a cannonball|Stayin' up all night, throwin' my sleep pattern off|I need a doctor on call to keep Adderall|Position of my commission is trilateral|You fuckin' with me, you trippin' for tryin' that at all|I mess around, make the call, get the gat involved|I know people, it's a small world after all|My credit card say it's onward at the mall|My broad lookin' like she Cinderella at the ball|Reborn every January like a Capricorn|From downtown, no Ryan Lewis and Macklemore|It's yours truly, I'm Paul Mooney, I'm George Clooney|I'm fully immersed in the craft, bringin' awards to me|The bass player said he gon' sue me|I gave the finger to him, the Lord gave a round of applause to me|My soul winnin', I've been goaltendin'|Cold sentence, scroll pennin’, nigga gone 'til it’s no limit|The vision came to me so vivid|My observation was if money for the takin', I'ma go and get it|Y'all know my everyday lay no costume|I murk rappers and they can't play no possum|Another studio but it's the same old outcome|I told my nigga Spon Vicious, ""Baby, we got one""|Listen|You might also like[Interlude 2]|Accurate scholarship and free, dedicated artists would reveal a singularly important thing|Racism was and is not only a mark of ignorance|It was and is a monumental fraud3Embed"
Black Thought,Dostoyevsky,2018,"Dostoyevsky Lyrics[Verse 1: Black Thought]|Yeah, the universe let the planets align|Spent 10k and the card didn’t decline|Bartender, one Casamigos  and lime|I'm celebrating gracefully, getting better with time|I ain't even halfway through this incredible ride|But like, I'm kind of doing an incredible job|When I was eighteen living beyond my means|I was afraid of my dreams, looking at the finer things|Wishing I could l flip to a microchip from a paper clip|Upgrade to a spaceship from a basic whip|Cash rules everything, I just wanted a taste of it|Fast food hurrying, saving time, not wasting it|Self-saboteur, speaking it to my paramour|Torch rappers like I'm igniting the aerosol|Maintaining the wherewithal that embarrass y'all|Game-changer, the way I shredded your cabbage off|Explaining is changing apples to applesauce|When we were young, innocence was ours, but that was lost|Where I reside is the dark side of the glory|The fury I manipulate is the arc of the story|Written without a ghostwriter to author it for me|This is crime and punishment, I'm the judge and the jury|Listen, Dostoyevsky|[Verse 2: Rapsody]|I swam with crocs, fished with sharks|May never pop charts, but I know I'm popular|I was built to run the game, I came up playing guard|With young niggas between 5'5"" and 6 foot 4|I banked over both, tryna bank over some more|And ball out in something gorgeous that'll keep me in court|Where they’ll judge like y'all does, y'all don't know me enough|Y'all still owe us for what all y'all did to the Cold Crush|To my donuts, I'm shooting J Dillas and what|I wanna cop when I get loot and recoup|I had to go through hella doors so in short that's why I only want two|But I ain't got Jay number, I CC 'em the proof|'Cause everything I pictured in my head has always come true|They say you need vision to see eye to eye with the Druids|Spent 25 hundred on sheep skin, let it seep in|I ain't turn starboy in a weekend|It took more like 7 years, make a sane man drink Everclear|It ain’t ever clear if we ever guaranteed a year|Fruits of your labor, huh, you work hard to get it|Jamla stitched on the motherfucking ROC fitted|Before the big lights it had to start with the scrimmage|Know that it'd come sooner or later, I'm Trae Young, nigga|Huh, I'm Trae Young, nigga||[Verse 3: Black Thought]|Uh, I said Dostoyevsky meets Joe Pesci|Tired of staring at a glass half empty|Turning me from Dr. Sebi to cocking semi|It got me clutching my machete from the Serengeti already|Wild Styles and Fab Five Freddy|I'm a stranger in Moscow, don't ask how deadly is the ummah|Patrice Lumumba, Kwame Nkrumah|To the Tripoli shores from the halls of Montezuma|Stop intruder, I'm built on facts, I'm not your rumor|A malignant tumor, slid through in a suede Puma|The steady heavy legendary, all praise is overdue|Same cloth as the chosen few, rap Noble Drew|I guarantee you know more music by the suckers|It's not a victimless crime if anybody suffers|In a system that was designed for them to try to cuff us|Well, what’s the use of 'em trying when can’t nobody touch us?|Unless it's fabricated, probably drug related|But love or hate it, I will not be subjugated|When they screamin' “You the greatest that did it,” what’s underrated?|As if every other player who spit it was unrelated|If every man's a temple, the circumstance is simple|So to be transcendental, I do enhance the mental|This is elder statesmen conversation|Take a look into them books from down in the basement, yeahYou might also like3Embed"
Black Thought,Conception,2018,"Conception Lyrics[Chorus: Reek Ruffin]|Where I go, where I go from here?|Oh I, know I, could be nowhere|And trust that all that money's good for nothin’ if you scared|Singin', yeah, yeah||[Verse 1: Black Thought]|Look|I am no fashion model but|I got fresh for photographers|The camo coat had the collar up|'Cause my emotions was bottled up|And though the ocean did not erupt|It turned up ’til it's loud enough|To just make somethin' out of us|Pass the shadow of a doubt in us|Godly, geometry and calculus|That I can move any mountain with|A nigga gotta be an alchemist|Tryna create another avenue of revenue|Or several because I'm in love with havin' you|Security is just a whole 'nother animal|I can't assume Xanadu had a panic room|I wish the man in the moon had a manual|And gratitude for the wishes I granted you|A lifetime, finally I'm understandin’ you|The lifelines that delines in a hand or two|And how it’s difficult to undo the damage you've done|Once the codes run under the scanner too|So if you capture the flame and it’s painful|You just charge that to the game|'Cause it's shameful to just fall back and complain|That you fractured the laws of attraction again|Focus on a more passionate plane|No conception's immaculate, man|[Chorus: Reek Ruffin]|Where I go, where I go from here?|Oh I, know I, could be nowhere|And trust that all that money’s good for nothin' if you scared|Singin', yeah, yeah||[Verse 2: Black Thought]|Once again to the well, I went|While the soul man screamed bloody hell out there|I'm tryna decode the meaning of the spell I'm in|And I don't even know what fucking hotel I'm in|I checked in as the monarch of mel-a-nin|The el-a-phant, my body is a shell I'm in|Piecin' myself together, teachin' myself to never|Let one loss divorce my devel-op-ment|Reminds me of Ego Trippin' like Nikki Giovanni|Wishin' the system might deliver me a body|Cum laude, the rug on the floor was from Saudi|The message I'd hung on the door was unrowdy|No dowry, the price of it all was one cowrie|Now we the last flophouse on The Bowery|Human traffickin', moving Africans|Still grappling with fantasies, fill the bracket in|And if you capture the flame, and it's painful|Then just charge that to the game|'Cause it's shameful to just fall back and complain|That you fractured the laws of attraction, again|Focus on a more passionate plane|Estimate a more accurate frame|Of time, a frame of mind attached to the sane|No conception's immaculate, man|You might also like[Chorus: Reek Ruffin]|Where I go, where I go from here?|Oh I, know I, could be nowhere|And trust that all that money's good for nothin' if you scared|Singin', yeah, yeah|Where I go, where I go from here?|Oh I, know I, could be nowhere|And trust that all that money's good for nothin' if you scared|Singin', yeah, yeah3Embed"
