rapper,song,year,lyrics
N.O.R.E.,Nothin’ (Remix),2002,"Nothin’ (Remix) Lyrics[Verse 1]|[Foxy Brown]|Ayo yoyoyo one two one two (OH!)|Brooklyn is definetly in the building tonight y'all!|This is the remix, I'm in the best shape of my life y'all|Oh yes I mean..|Home girl I came to party (okay)|Young mans watchin my body (ohh!)|He's a haggle and no I'm not baggin him (uhh ooh!)|But you don't want the girls to come over and start askin him|What you wanna do, nigga? (Nothin')|What you tryin to do, nigga? (Nothin')|What you wanna do, nigga? (Nothin')|What you tryin to do (Yeah!)|I'll show you how to do this hun, what?|How y'all want it my pumps is 900|These ain't polo, nigga, these is manolo|Twist Rovers y'all runnin's over|I grooves on with a mean diddy bop|And an H-Todd jean and a good shoe on now|Catch me in the hood stylin proper|Them dudes say I spit like a dude in a bitch body|[Noreaga]|Home boy, I'm drunk in the club and won't hurl|Home boy, I'm leavin the club with white girl|Home boy, get out of my face and just taste|Home boy, I'm leavin this spot with new case|UH-OH, see these niggas gotta stay in they lanes|With a clown ass Posse and they ain't insane|At the white boy club, while I'm buyin the bar|They like hey now you still an all star (Heh Heh)||[Hook]|Playboy, we came to party (ohh!)|Your bitch was tryna fuck me (ohh!)|She's a haggler naw I'm not taggin her (uhh ohh!)|But you don't want them boys to come over and start askin ya (ohh!)|What you wanna do? (Nothin')|What you tryna to do? (Nothin')|What y'all wanna do? (Nothin')|What the fuck y'all tryna to do||[Verse 2]|[Capone]|Well I'm known to keep it thorough in the MC field|No respect in 01, in 02 you kneel|Cuz I shoot to get loot, when its time to perform|Brought fire to the set, when they turn my mic on|I'll rap a second time, and put two in the air|E-MONEY the bridge &  murder unit is here|Nigga front and get popped, ain't no fuckin with my dough|Girls with my jock, with my dope intro|You might also like[Maze]|Ooh I like the way she movin in her pradas|She got a booty like and African (YEEAH)|I bet her last name ain't Bambatta (NOOO)|Now get ya diamonds (YEEAH), if you ain't knowin Lefrak|We sayin show up, you still sayin holla|[Muze]|Homeboy, we ain't come to party|We came to buy ya drinks|Til ya hurl and ya mink|When you drunk brainless, make you relinquish|Everything you came with, this is the remix!||[Hook]|[Bridge: repeat 8X]|La la la la la la la la la (ohh!)||[Verse 3]|P. Diddy (Noreaga)|You know its rough, rugged, hard cuz I'm P|(You can't touch Pone and you can't touch me)|(You faggots) No con rappers on quest|(Forget your headphones, boy your gonna need a vest)|You know I flips it in the trucks and the coupes|(See my wife ain't home, but my hookers is loose)|I keeps a haggler inside an accura|(And all my niggas, they gotta start baggin her)|[Muze]|Yo step, hold up, twist the dro up|Switch the flow up, might hit ya ho up|Cuz ya girl was lookin at me|One x, she's really freaky|[Maze]|Hey y'all M-A-Z-E|We the shit man thats too hard|I'mma rub out my enemies, hatin|Crush the industry, get kid in bought them all like the..||[Hook]|[Bridge: repeat 8X]|La la la la la la la la la (ohh!)|[P. Diddy]|As we proceed, to give you what you need!Embed"
N.O.R.E.,Baby Girl,2012,"Baby Girl Lyrics[Verse 1: Noreaga]|His-and-her cars, his-and-her sinks|Cartier watches, his-and-her minks|We was miserable together|And we used to hide out, now we visible together|Hand me the bullets while I load my gun|She helped me hustle, helped me cop my Ones|Pretty face, stomach thin|And got a head on her shoulders, it's a win-win|When I first met her, she was driving Acura|I never rode with her, followed right in back of her|Baby from Jers, I think Elizabeth|She was always smart and spoke articulate|She warned me, don't be possessive|I was falling in love, showing my effort|Thugs fall in love too, fuck that|She said a chick called her phone -- boo, fuck that!|[Hook: Cassie]|I need somebody that'll ride for me|Are you that man?|I need somebody that'll die for me|Can you understand?|All the love and the pain|Through the sunshine and through the rain|If you can|Then let me hear you say|I'm your baby girl|Tell me I'm your baby girl|I need to be your baby girl|Tell me I'm your baby girl|I need to be your baby girl|Tell me I'm your baby girl|I need to be your baby girl|Tell me I'm your baby girl|Tell me I'm your baby girl||[Verse 2: Noreaga]|True story..|Met in Miami, my mind in New York though|I was fatter back then, a  big torso|See, out with her friends, they ate at Larrios|I brought them sangria, I told them savia|Ask me menage, I'm rolling dolo|No entourage, I need a solo|Her and her friends asked me for a picture|I said, hell yeah, let me get in there with ya|Exchanged numbers, that was a smart move|Met in New York, we had our first date|Drinks at a bar, of course I came late|I'm just looking in her eyes, mami so shy|I tried to tell her that I'm different from them other guys|I'm a real one, so you can let your guard down|I'm a real one, baby you with God now|I'm a real one, baby you with God now|You might also like[Hook: Cassie]|I need somebody that'll ride for me|Are you that man?|I need somebody that'll die for me|Can you understand?|All the love and the pain|Through the sunshine and through the rain|If you can|Then let me hear you say|I'm your baby girl|Tell me I'm your baby girl|I need to be your baby girl|Tell me I'm your baby girl|I need to be your baby girl|Tell me I'm your baby girl|I need to be your baby girl|Tell me I'm your baby girl|Tell me I'm your baby girl||[Verse 3: Noreaga]|Years later, we still together, still thugging it|And we moved to the ocean and both loving it|If I could do it again, I wouldn't change shit|I brung her to my hood when it's dangerous|And she even cooked meals for my nephew|I never said thank you; that moment is special|The most beautifulest thing on the planet|Our love's for real, don't take that for granted|And I would walk across the earth for you|You're the best thing that happened to me, that's why I'm loyal|To me, you're more precious than oil|You never say no, that's why we both spoiled|[Hook: Cassie]|I need somebody that'll ride for me|Are you that man?|I need somebody that'll die for me|Can you understand?|All the love and the pain|Through the sunshine and through the rain|If you can|Then let me hear you say|I'm your baby girl|Tell me I'm your baby girl|I need to be your baby girl|Tell me I'm your baby girl|I need to be your baby girl|Tell me I'm your baby girl|I need to be your baby girl|Tell me I'm your baby girl|Tell me I'm your baby girlEmbed"
N.O.R.E.,She’s Mine,2018,"She’s Mine Lyrics[Refrain: Tory Lanez]|Shawty make me feel like the bestest|Make me feel like fuck all my exes|Make me feel like my last was a bozo|Got these bitches still trickin' off the logo|Ohhh, ha-ha, she pick it up and I'ma put it downtown|I'll be the realest nigga that she found|She keep a .40 on it just in case it goes down, oh yeah||[Verse 1: Tory Lanez]|Just like I bought it nigga, you know I teach you all the rules, she my daughter nigga|You know I keep it with her too, that's what I taught her nigga|And last night, she fucked around, I nearly fought a nigga|You know, keep that day one like I'm a plug nigga|35s on a nigga, you can't stop a nigga|Me and N.O.R.E. got a story, got a battle for shawty|She tryna fuck me and Dolla, get a seven for me|[Refrain: Tory Lanez]|Shawty make me feel like the bestest|Make me feel like fuck all my exes|Make me feel like my last was a bozo|Got these bitches still trickin' off the logo|Ohhh, ha-ha, she pick it up and I'ma put it downtown|I'll be the realest nigga that she found|She keep a .40 on it just in case it goes down, oh yeah||[Verse 2: N.O.R.E.]|Haven't heard of Tory Lanez, vocals is in|I got the Maybach with the Phantom and the chauffeur is in|Givenchy sprayed on the leather seats and Georgia, she a better peach|I brought my sand with me 'cause my sand from a better beach|They legalized bud and that's in Canada|I'ma have my lady with me like my manager|We gon' lock it all down, lock the parameter|You can't measure this love without diameter||[Chorus: N.O.R.E.]|She's mine|She's mine, she's mine, she's mine|I don't wanna sound crazy but|She's mine|She's mine, she's mine, she's mine|I don't wanna sound crazy but|You might also like[Post-Chorus: N.O.R.E.]|In the crib, I'm with her|In the mall, I'm with her|In the corner, I'm with her|I guess I just prefer|In the crib, I'm with her|In the mall, I'm with her|In the corner, I'm with her|I guess I just prefer, oh||[Refrain: Tory Lanez]|Shawty make me feel like the bestest|Make me feel like fuck all my exes|Make me feel like my last was a bozo|Got these bitches still trickin' off the logo|Ohhh, ha-ha, she pick it up and I'ma put it downtown|I'll be the realest nigga that she found|She keep a .40 on it just in case it goes down, oh yeah||[Verse 3: N.O.R.E.]|This is grownup rap (rap)|LeFrak, the place that I grew up at (yup, yo)|I got love for a lot of y'all (what)|My baby girl is realer than a lot of y'all|Feel like the A-Team, every time we face crime|We separate, it's cool 'cause we FaceTime|I'm rubbin' her hips, I love her waistline|So I'ma hit her with the hook and a bass line|[Chorus: N.O.R.E.]|She's mine|She's mine, she's mine, she's mine|I don't wanna sound crazy but|She's mine|She's mine, she's mine, she's mine|I don't wanna sound crazy but||[Post-Chorus: N.O.R.E.]|In the crib, I'm with her|In the morning, I'm with her|In the corner, I'm with her|I guess I just prefer|In the crib, I'm with her|In the morning, I'm with her|In the corner, I'm with her|I guess I just prefer, oh||[Refrain: Tory Lanez]|Shawty make me feel like the bestest|Make me feel like fuck all my exes|Make me feel like my last was a bozo|Got these bitches still trickin' off the logo|Ohhh, ha-ha, she pick it up and I'ma put it downtown|I'll be the realest nigga that she found|She keep a .40 on it just in case it goes down, oh yeah||[Outro: N.O.R.E.]|Ay yo, this is for all the homies out there living that life man|You be living that life, thinking that your homies gon' hold you down|I'ma tell you, when you get locked down and when nobody around|It's just gonna be your queen there, so treat your queen fair|You figure see all that?|Ya boy Nory man, hold it down, cup of season, half a gut|YaahowEmbed"
N.O.R.E.,Uno Más Remix,2018,"Uno Más Remix Lyrics[Intro: N.O.R.E]|Part 2!|Ayy!||[Chorus: Miguel & N.O.R.E]|Come have a drink with me, baby|Uno más, one more|Just fill, don't think with me, baby|Singin' all night, all night 'til we go|I'll be the shrink you need lately (Nah, nah, nah, nah)|Just one more clink with me, baby (Yo, yo)|[Verse 1: N.O.R.E.]|You don't want war, we all want more|More hardcore drinks before I'm on tour|Got the kush in the cones, you know I stuff Raw|For encore, big balling wherever I ball|I'ma keep bragging on how I got here|20 year career it's always sincere|These dudes are just one hit wonders|You don't know who I am? Go ask your mothers|You got OG's, you ask your brothers|They will tell you what I [?] summers|And they gon' tell you that N.O.R.E. play to win|2018 feels like '98 again||[Chorus: Miguel]|Come have a drink with me, baby|Uno más, one more|Just fill, don't think with me, baby|Singin' all night, all night 'til we go|I'll be the shrink you need lately|Just one more clink with me, baby||[Verse 2: Wiz Khalifa]|Talk slow chief, my pockets so deep|Grind all week, I hardly ever sleep|Shit ain't ever sweet, but since the hotel|Top notch freak, top me off please|Talking bout legendary, talk about me|Talk about P and they N-O-R-E|I play the game just like I been here before|Left the team now she ain't winning no more|You might also like[Chorus: Miguel]|Come have a drink with me, baby|Uno más, one more|Just fill, don't think with me, baby|Singin' all night, all night 'til we go|I'll be the shrink you need lately|Just one more clink with me, baby||[Bridge: Pharrell]|I peeped what you goin' through, baby|You don't know, but it is in your eyes|I think you need a 180|The total opposite'll be nice||[Chorus: Miguel]|Come have a drink with me, baby|Uno más, one more|Just fill, don't think with me, baby|Singin' all night, all night 'til we go|I'll be the shrink you need lately|Just one more clink with me, baby||[Verse 3: J Alvarez]|Otro trago mas…y enciende|Otro trago mas…otro trago mas|Que viva mi gente|Baby conmigo pásala bien|Sabes que te voy a tratar a cien|Hagamos travesuras|Si parece una locura|[?]|Soy el caldero y el sartén|Barbie yo soy ken|Fuego pa’ la hoja, te toco y te moja’|Llegamos y el lugar se desaloja|Te doy hasta que termine [?]|Si no es ferragamo es valentino|Mami somos gangster pero finos|La mesa con dj y botellas|Y de camino tomate otro red bull si mañana|[?]|Da te otro trago (Uno mas)|Y vamos a viajar sin que lo notes (Uno mas)|Y que tus labios|Quiero que pidas que yo te controle (Uno mas)|[Outro: J Alvarez]|Latino stand up|J Álvarez|El dueño del sistema mami|Young Boss Entertainment|On top of the world music|Dimelo NORE|We ready|La fama que caminaEmbed"
N.O.R.E.,Put ’Em Up,2003,"Put ’Em Up Lyrics[N.O.R.E.]|Star Trak (Star Trak)|Star Trak (Star Trak)|Millitainment!! Millitainment (Man)|My nigga David Banner in the buildin' (Man...man)|Bounce bounce (Man)|Bounce bounce (Man)|Bounce bounce||[Hook 1: Pharrell]|Are you a P-I-M-P?|But can't no nigga put the pimpin' like me|I get em up get em up (up)|I get them hoes and put em up (up)|I'm here with N-O-R-E|And can't nobody rip a club like we|Put em up put em up (up)|Get your set and put em up put em up (up)|Get your fingers put em up put em up (up)|Get your rag and put em up put em up (up)|Man|[Hook 2: N.O.R.E.]|Bounce bounce (Man)|Bounce bounce (Man)|Bounce bounce (Man)|Bounce bounce||[N.O.R.E.]|Now it ain't N.O.R.E. to be on time|But I rock a rhyme that's right on slime, it's N.O.R.E|(It's N.O.R.E., N.O.R.E.) I'm just chillin' wit my shorty (shorty)|Drinkin' on a forty (forty), private stock old English (English)|Bout to get some naughty, O.P.P. no D-E-D|All she need is me up in the N-Y-C||[Hook 1]||[Hook 2]||[N.O.R.E.]|Now it ain't N.O.R.E. to be on time|But I rock a rhyme that's right on slime, it's N.O.R.E|(It's N.O.R.E., N.O.R.E.) Half mo, full mo|Wear a thong, g-code|Gettin' bent off that liquor|Till our colons thick and old|Stay trippin' on them hoes...we be illin'|And them whores doin' shows...top billin'|Stay packin' fo' fo's...ain't no concealin'|Peoples throwin' those bows....so how you feelin'|You might also like[Hook 1]||[Hook 2 x2]||[N.O.R.E.]|Now it ain't N.O.R.E. to be on time|But I rock a rhyme that's right on slime, it's N.O.R.E|(It's N.O.R.E., N.O.R.E.) Bangin' goin' crazy|Bangin' black Mercedes|Why I'm bangin' on them corners|Bangin' all your ladies|And she just wanna ride|Get up in that coupe and slide|Run around the corners lyin'|Say she Bonnie, said I'm Clyde (What?)|But I'm that type of guy|Have yo chicken bakin' pie|And she really wanna fuck me|I can see it in her eye||[Hook 1]||[Hook 2 x2]Embed"
N.O.R.E.,It’s Not a Game,1998,"It’s Not a Game Lyrics[Intro: Noreaga]|Yea, this is, this is ain't no game man|A lot of people look from the outside in|Thinking that it's easy, man|You know what I'm saying, not realizing we work too|You know what I mean, we working everyday hard|Getting our hands dirty just like y'all|But y'all think y'all better||[Verse 1: Musolini]|Yo, yo, yo, yo, yo, yo|I pledge allegiance to money, weed, jewels, hoes, and big guns|While you dealing in crumbs and stacking funds|Squeezing the ones, so jealous sons have 'em speaking in tongues|Headed for these slums, screaming at the top they lungs|Bitch made cats, find 'em wherever you at|Your man in you face will stab you in the back|Life's a bitch, so rub up and fuck it|You live your life, you gotta love it|Six double o, used to whip a bucket|Left the strip cause niggas like five seven tips|Hood of loose lips, iced my necklace to my wrists|Long with the stones on my fists|Niggas hating me, cause I got chips|Left the hood rich|Nutin but diamond dis, head from a bitch|In the back of a thugged out whip|Why not shit|Devilish, your crabs ain't shit|Mad at this, certain gentle wrist|[Chorus: Maze]|It's not a game nigga|We move in and move out|Most niggas try to follow the route|But they can't see what we see|Thugged out like wherever we be|M-A-Z-E, N.O.R.E., Musolini||[Verse 2: Noreaga]|Now that's that shit that I'm talking about and shit|Same niggas that you fucking wit|Fucking wit them cats that you don't fuck wit|Whatcha supposed to do?|Both of them are part of the crew|Can't choose side (true)|I don't know, I don't like to go that road|If that's your click, I suggest that you stay wit them yo|While some say: ""break up to make up""|I say: ""stick together god, until y'all cake up""|Bitches meet me at the crown plaza|On they period, it don't matter|I'm in the head something serious|This ain't a game god, yo it never was|I get super high, while y'all niggas get a buzz|My associates that I use to sit, chill wit|Now it's only family I like to deal wit|That I like to build wit|Get high, hold steel wit|So let's do this, all my niggas run through this|You might also like[Chorus: Maze]|It's not a game nigga|We move in and move out|Most niggas try to follow the route|But they can't see what we see|Thugged out like wherever we be|M-A-Z-E, N.O.R.E., Musolini||[Verse 3: Maze]|The money attitudes the cay in|To many snakes in the way|A getting paid playing laid-back on my days in|I want to enter fortune but which way in|Wit out getting lost in a storm|My pen pages reflect Maze|Why steps from his H on, shades beyond the grave|Golden braids hang from my physical|Bitches scare me|Move mystical enchanting branson weed at me|I'm like fan of B|Vanish from the scene in a blur|But barely seen, clearly heard in my action|And act civil, my palm sizzle from the heat in my hand|We're in your land like a hard drizzle|To reach my pinnacle is minimal|Sinister style, thugged out, nigga sending you foul|[Chorus: Maze]|It's not a game nigga|We move in and move out|Most niggas try to follow the route|But they can't see what we see|Thugged out like wherever we be|M-A-Z-E, N.O.R.E., MusoliniEmbed"
N.O.R.E.,The Assignment,1998,"The Assignment Lyrics[Intro]|Word up, Busta Bus, my motherfuckin nigga, man. (Bus) Yeah, this one nigga|Right there||[Verse 1: Noreaga]|What, what, yo, you know N.O.R.E., type a nigga stay real trump|I ain't the type to fight a nigga, just blaze you up|What the fuck? All you niggas wanna say what, what|While you halfway thugs soundin' halfway butt|If you ain't with Busta Bus then shut the fuck up|Niggas is snakes, in other words just like jakes|Yo, I sell raps, used to sell crack on crates|It's like a stock that shot, oh look what it dropped|Yo, I hate to have to send my niggas all in you spot|Like Spliff Star, shootin' right all in your car|Busta Bus plug the engine, with bananas|Even if they lose our sight we still got cameras|We play the game like the movie, smoke Lucy|B.I.G. gone, but my favorite song still Juicy|[Verse 2: Busta Rhymes]|Yo, ya-yo, yo closed caption, son don't even know what's happenin'|Before the 2nd thought, make you feel the wrath of my clappin'|(Boom!) Fire flashin';, two holes up in your head matchin'|Dope fiend in the corner, itch from eight scars scratchin'|(Huh) We make the nutter butter, thick creamy shit from the gutter|Paranoid these niggas, flip and make they heartbeat flutter|You's a sucker, (ha) lace you up with my box-cutter|Your mother love your other son like you ain't even his brother|Pussy nigga, I flip up to the max on you, nigga|Pose the violent threat immediately, black on you nigga|Ski maskin', fuck whatever question you askin'|Busta Rhyme and Nore connect on the train, we attachin'|Hold your corner, violatin 'cross the border (huh)|Try to catch my jewel, spyin' with your tape recorder|Fuck is wrong with you?! Don't you know we raw till the end?|Battlefield shit, Flipmode Squad, CNN||[Chorus: Busta Rhymes (Noreaga)]|Busta Rymes (What, what!) Noreaga (What, what!) Flipmode (What, what!)|Thugged Out (What, what!) Spliff Star (What, what!) Busta Rhymes (What, what!)|Noreaga (What, what!) Thugged Out (What, what!) Flipmode (What, what!)|Busta Rhymes (What, what!) Noreaga (What, what!) Thugged Out (What, what)|Spliff Star (What, what!) Flipmode (What, what!) Busta Rhymes (What, what!)|Noreaga (What, what!)|You might also like[Verse 3: Maze]|(What, what) Yo, it's the same as any, in this game you wanna lose|Jump out the Ac, run up with the Uz', don't move Magically Maze|Lyrically invade like a SWAT raid, top grade rockin' wallaby suede|I'm always coppin', poppin', three in the air|For my niggas not here|Locked in Whitney, tipsies|Specifically, and twist me when it's Cristy||[Verse 4: Noreaga]|Let me go again, make sure the shit's soakin'|Thugged Out and Flipmode is like next of kin|Yo, we do what up, sendin' 'em niggas that will screw it up|What! Handle your business, God, even if ?Kalu? what up|I rock Clarks, on and off, like John Starks|What? Shoot at your face, God, aim at your heart|Yo, from Indiana to Atlanta, God we got this|Jose Luis, thugs just put me in the hotlist|I rip shows, but never gotta go at hoes|Stay travellin', playin' click, just stay froze|I got the left arm, stay in the game like Montan'|My thug charm is everywhere now, dot com|Hear me anytime, you can access it|W dot Nore, yo, suck my dick|Peep me with Akinyele, yo, fuckin' for free|On some thug shit, my thugs stay fuckin' with me|What!|[Verse 5: Spliff Star]|Yo, every battle|Nigga I got your gat, so let me splatter|Into smithereens|Throw some bullets in his jeans|Another thug story, I bust my gun for N.O.R.E|Snap a nigga neck, now the law lookin' for me|I'm thugged out, bugged out, blow your fuckin' mug out|No di-doubt, I see you can't eat what you dish out|Watch, I reach in your soul, nigga and pull the bitch out|Watch my tech rise, feel the shells that it spit out|I'm warnin' you, send twenty niggas deep to corner you|Dressed in black|From Brook' to Iraq|Blastin' Mack 10's, I be killin' ya Benz|Live coverage at ten, on CNN||Chorus *order differs slightly*||What,what!Embed"
N.O.R.E.,The Jump Off,1998,"The Jump Off LyricsWoh-woh yea|Eh yo timbland its the jump off right here man|Woh-woh-woh|It's queen bee|It's the jump off||Verse 1]|I been gone for a minute now im back at the jump off {JUMP OFF}|Goons in the club in case something jump off|I'm back up for the high for the pump off|In the graveyard is where you get dumped off|All we wanna do is party {WOO}|And by everybody at the bar barcardi {WOO}|Black barbie dressed in bogardi {OW}|I'm tryna leave in somebodies ferrari {ERRR}|Spread love thats what a real mob do|Keep it gangsta look out for my people|I'm the wicked bitch of the east ya betta|Keep the peace {EH YO}|Or out come the beast|We the best there was room for improvement|My prescence is felt like a black ever movement|7 quarter to 8 to back to back {BACK TO BACK}|Got ya sittin on chrome 7x flat|[Hook]|This is for my peeps with the Bentleys the Hummers the Benz|Escalade 23 inch rims|Jumpin out the Jaguar wit the Timbs|Keep ya bred up|And live good East coast West coast worldwide|All my playas in the hood stay fly|And if you ballin let me hear you say right {right}||[Verse 2]|It's Lil Kim and Timbaland shit ya drawers {C'MON}|Special delivery from you to yours {MAN}|I rep the bitches he rep the boys|If you rep yo hood then make some noise|I got my eye on the guy in the orange coat {HEY}|Don't he know queen bee got the ill deep throat|Let me show you what im all about|How i make a sprite can dissapear in my mouth {WOO}|Shake up the dice throw down ya ice|Bet it all playa fuck the price|Money ain't a thing throw it out like rice|Been around the world pop the same thing twice|Rub on my tits|Squeeze on my ass|Gimme some head step on the gas {AHH}|Pop the cork and roll up the ash {ROLL IT}|You know what we about sex drugs and cash|You might also like[Hook]|This is for my peeps with the Bentleys the Hummers the Benz|Escalade 23 inch rims|Jumpin out the Jaguar wit the Timbs|Keep ya bred up|And live good East coast West coast worldwide|All my playas in the hood stay fly|And if you ballin let me hear you say right {right}||Verse 3]|And to the world of the playboy pin up girl|Butt naked dressed in nothin but pearls|You want to meet me cause you know I'm freaky|And you wanna eat me cause you say I'm sexy|Got a man in Japan that i do in tahiti|Beleive me sweetie i got enough to feed the needy|No need to be greedy|I got mad friends that pretty {HEY}|Chicks by the layers|All different flavas|MAMI-OSO thats how this thing go|Now everybody come get wit the limboy|Shake ya body-body|Move yo ya body-body|On the dance floor dont hurt no body-body|I'm the one who puts the range in the rover|When i'm steppin out the range {yo it's over}|Comin through in the brooklyn mid gear|We gon do this jus like when big poppa was here|[Hook]|This is for my peeps with the Bentleys the Hummers the Benz|Escalade 23 inch rims|Jumpin out the Jaguar wit the Timbs|Keep ya bred up|And live good East coast West coast worldwide|All my playas in the hood stay fly|And if you ballin let me hear you say right {right}||[Verse 4]|[Mr. Cheeks]|Jigga what, yea keep it real, yea world wide stay fly yea yea right right queen|Bee l.v 2ooo fuckin 3 why not, we makin it hot comin through blow the spot com|On eh yo she back at it why wouldn't she be...b.i.g, freajy tah||[Fade]Embed"
