rapper,song,year,lyrics
Redman,Tonight’s Da Night,1993,"Tonight’s Da Night Lyrics[Intro: Redman & Hurricane G]|Mic check, I can get smooth to any groove|Relax the tongue, let my mic take a cruise|Around the planet, pack 'em in like Janet|Jackson, she's askin' if I can slam it, I'm—|Yo, yo, Redman, man, what the fuck, man?|Get the fuck off that punk smooth shit, man|Get with that rough shit, man, you know how we do||[Verse 1: Redman]|Mic check, I walk around the streets with a black TEC-9|By the waistline, kickin' the hype shit|I never claim to be the best type of rapper|But have to show them motherfuckers what I'm after|I'm after the gold, then after that, the platinum|Beef after that, Hurricane G packs the gat, son|Trigger, bang, bang, yo, bust the slang, what my name?|It's the Redman on the funk train|Psych, you're motherfuckin' right, tonight's the night|To do what I wanna do, to do it like dynamite|The work perfected, when the funk been injected|I roughen up the rough draft to like make your head split|Punk, pass the forty and the blunt and don't front|On the block, 'cause when you do front, brothers are gettin' stomped|I'm not an addict, more like Puff the Magic|Then pass it when I'm through 'cause my crew (Gots to have it)|I don't claim to be a big rap star|'Cause no matter who you are, you'll still catch a bullet scar|So listen up and take heed to what I'm sayin'|'Cause tonight's the night and me and my niggas ain't playin'|[Interlude]|Fat black bitch, nasty|Bush bear, booga breath bitch|Nasty, talk to your tits bitch|With them nasty Africans, Mr. Bojangles|Turned up shoes havin' ass|Lemming leprechaun haircut motherfucker||[Verse 2: Redman]|You wanna see me get cool, please, save it for the breeze|'Cause the lyrics and tracks make me funky like cottage cheese|Fuck the smooth shit, I get down with the boom bip|Like Q-Tip, I kick more styles than Bruce shoes kick|But tonight's the night what I write tonight|This type of funk with the flavor like Mike 'n' Ike's|Hanging out with my niggas, my niggas|The Pack Pistol Posse keep they fingers on the triggers|I keep the forty between my lap, coolin', rollin' down the highway|Blunt system pumps 'cause it's Friday|Roll over to pick my boys up, we raise a lot of noise|'Cause we can do that black, so ""Get the Bozack"", Jack|Remember, I do the type of evil that men do|Like cursin' out my window at a bitch and her friend too|So turn the volume up a notch|And watch the ba-bump|Ba-bump, make your speakers pop|That's the funk, when it pumps it makes your rump|Jump, jump, jump, jump, jump, jump|But if you wanna see a fly but frantic|Cool romantic more slicker than my man Rick|You better check the Yellow Pages under smooth shit|'Cause Red ain't down for the bullshit|Niggas fucked up by lettin' me make an album (How come, rude boy?)|To get on the mic and let my fuckin' style run|You might also like[Interlude]|Nasty fuckin' green thumb Jolly Green niggas|Tango mango, pickin' havin' ass|Nasty epileptic disease crazy havin' ass|Johnny Cash, afro havin'|Jack of Spades, boots havin'|Tony Danza, shoes wearin' ass||[Verse 3: Redman]|B-b-b-black by popular demand, I expand|My hand to the mic and let my mouth kick the flim flam|I get sex, I get wreck, I puff mad blunts|I get vexed, I break necks, punch out gold fronts, chump, you—||[Outro]|Yo, fuck that, yo, turn this shit off, man (Turn that shit off)|Turn that shit down man|Turn this shit off, G|Boom the new record on, know what I'm sayin'?23Embed"
Redman,Dunfiato,2014,"Dunfiato Lyrics[Intro]|Hey, hey|Muddy fucking waters mixtape, man|I'm high as a bitch  up in this motherfucker|I need a beat, I need a fuckin' beat|I don't need no turn up beat, I need some elements|Some Hip-hop|Let's get back to some elements and shit (yeah)|Josh, I like that man. You like that man?|Let's turn that shit up man (yeah)|Lyrical wordplay for y'all. I feel good on this one, man|This is how real emcees do it, you know?|Yeah, I like that shit a lot man|D'un fiato!|Rome, York, we in the building|Check it out (yo)|[Verse 1: Redman]|When I hit the bong I'm Godzilla taking over Hong Kong|Eating wantan wid' a shotgun in long johns|It's not unsung|No story here to tell, I'm just ready|I'm a student before the school bell|That prevail my wordplay|Thirsty, I bust all three Ks on Martin Luther King birthday|Berkeley College, for twenty dollars|If I got it, smoke, here enquire my knowledge|A little psychotic, I know|Rate me, I'm Michael Jordan in the final four fighting with Wayne Gretzky|I'm not relevant, let's see|Who's spittin?|Some of y'all Coke and Pepsi, I can't tell the difference|I'm Darryl when I'm pitchin'|Before the white girl had 'em twitchin'|Now the rap game in my kitchen|Easy pickens|Rebel wid' a cause|My mind is like fuck with mine, I'll put your mind on the wall|I'm on tour gettin' bread and tattoos and your job is giving Tic Tacs in bathrooms|I hate gossip, I'll mash up your media moshpit|Release a ba-boom in the chat room|My weed bags are vacuum that smuggle|Off of one blunt, a bitch gon' fuck you (HAHAHA)|Chicks Tivo the meatloaf, when I hit they belly Doc droppin' all dimes (RICO!)|Take precautions|I got a Paul Bearer that build coffins for all rappers and nonsense|Nonchalantly I'm thinkin' darker than a convict conscience|That's why I'm sweating in the armpits, that's where the bomb is|The gang rate in my city is like the 80s where Kendrick Lamar live|I gotta' harvest the purple at my apartment, across the park I sell pounds to Cartman|I think like an orphan, I'm in a zone|But it's freestyle so these words might need a home|Executive net, I demand respect, check, don't even talk to me or text the wrong tone (OKAY)|Stay at bay, um and delay|When I ride out, pull pins from these hand grenades|You can be amazed or hate it|But either way I get it heated like Kanye and Sway|I'm done wid' it, I had fun wid' it|Stay back and tell your girl come get it|She had Mr. Right, now she want Mr. Wrong|Now she swing along, like Serena armsYou might also like9Embed"
Redman,Can’t Wait,1994,"Can’t Wait Lyrics[Intro: Dave Rockin' Reel, Roz Noble & Redman]|Possibly a lot of rain this afternoon, with thunderstorms, highs in the mid eighties and lows about seventy-five degrees|It's 11:30 a.m. on WFDS, We're From the Darkside Radio|This is Dave Rockin' Reel, as we take a caller|Caller, you're on the air|Yeah, yeah, yeah, and this is Roz from Newark and I wanna hear that tune by Redman, ""Can't Wait"", that tune the bomb, yo|You got it, coming from The Darkside Radio, this is ""Can't Wait""|Woo, yo, yo, yo, comin' to you live|Smokin' mad Phillies with my niggas from the Hoodaville section|And all my niggas from the Weequahic section, word is bond|Somebody said Jamaica, Queens in this motherfucker|I don't give a fuck, we gon' set it off like this|Jersey in the fuckin hid-ouse, for your mid-outh|[Verse 1: Redman]|I'm like rah-rah, like I had cerebral palsy|My flows be's wet like all you girls' drawers be|Crack the Phill's, spread the buddha then the hiddash|Roll it up and then ask, ""Who chipped in for the ten bag?""|Et cetera, I roll my blunts with two textures|Pick up fifty bags and then I smoke all the extras|It's the truth, like vodk' one-eighty proof|Don't drop your drawers, I'll fuck through your daisy dukes (True)|Put your fingers up in the air if you're high (High)|I walk by (By), so f' a drive (Drive)|I swing up in it, batting average is half as|Good as Reggie Jackson's, that's why you talk backwards|And, uh, chumps be on some Bogart shit like Humphrey|You couldn't beat me if you ran with 21 Jump Street|Or 90210, fuck it, yo|In the movies I'm the nigga puffin' buddha in the back row|[Chorus: Mary Jane Girls, Big Daddy Kane & Redman]|I can't wait to get it on|(Check it out, y'all)|I can't wait to get it on|(You don't stop, keep on)|I can't wait to get it on|(Check it out, y'all)|I can't wait to get it on|(Woo)|(You don't stop, keep on)|I can't wait to get it on|(Check it out, y'all)|I can't wait to get it on|(You don't stop, keep on)|I can't wait to get it on|(Check it out, y'all)|I can't wait to get it on|(You don't stop, keep on)|You might also like[Verse 2: Redman]|I'm just a smoky boy, I'm from the Land of the Lost|You can't see me, like Charlie Angels' boss, I'm often|Coolin 'round the blid-docks, I rock 'round the clid-dock|My glid-dock cocked, from here to 16th and Lenox|Ask Roger Thomas if I'm gettin scopic|I was milk like two tits, now I'm butter like Blue Bonnet|Now who got the funk? (We got the funk)|Ayy, ayy, ayo well I got the weed (We got the blunts)|I never sniffed, I used to puff woolas in a jam|Back in '88, when it was twenties to the gram|Brizzail, you couldn't feel me in Braille, hell|I write my names on walls in smoke spots when I'm buyin' L|The fly guy with the Force like Luke Sky'|Down for a menage e' trois bitch if you're fly|The Funkadelic, been rockin' mics since the fourth grade|I Terminate like X and I Terminate like Schwarzeneg'|Dum-di-dum, rock like Buju Banton|Soup like wonton, funk by the tons, d-rums, please|My whole crew's making cheese|Tonight's the night, baby, so suck up on these, and it's on|[Chorus: Mary Jane Girls & Big Daddy Kane]|I can't wait to get it on|(Check it out, y'all)|I can't wait to get it on|(You don't stop, keep on)|I can't wait to get it on|(Check it out, y'all)|I can't wait to get it on|(You don't stop, keep on)|I can't wait to get it on|(Check it out, y'all)|I can't wait to get it on|(You don't stop, keep on)|I can't wait to get it on|(Check it out, y'all)|I can't wait to get it on|(You don't stop, keep on)|[Verse 3: Redman]|I said I, catch the A-train, to the left (Aha)|Smoke the choc', I set shit off like Boba Fett (Aha)|Big up to all my niggas in the housing projects (Woo)|I'm runnin' up in ya, continue to split your guts|Grab the rail, if you get scared of my lines when I rock well|Got Whit's like Pernell, shit's the bomb like Akinyele|Rickety rocket, mind deep as the Loch Ness|Waste niggas like toxic, wet like galoshes|Can I handle my biz'? (Yes, you can)|I cause chaos, and bring a lot of Def to Jams|Yes I can, now act stupid, I'll pop the trunk, cla-clunk|Now give me a ba-bump, ba-bump|Ooh cool, smooth like two blue suede shoes|Y'all faggots slept on my Huffman and Koos|Word to Dan, Tan, Pillow, and Cool B|Switchin' speeds like Bruce Lee ridin' a Fuji in a movie|I drop it on the one, fuck the two, three|Funky like a box of coochies on loose leaf||[Outro: Redman]|Yo, yo, yo, I said, ""Switchin' up speeds like Bruce Lee ridin' a Fuji in a movie""|Huh, I be sayin' some shit|Now, if you didn't get it|Laugh now, and then figure the shit out when you get home|Hahahaha8Embed"
Redman,I’ll Bee Dat!,1998,"I’ll Bee Dat! Lyrics[Intro]|Yo, fuck you|Yo, yo, fuck you|Yo, yo, yo, yo, yo, yo, yo, fuck you|Yo, yo, yo, yo, yo, fuck you|Yo, Sim Simma, who got the keys to my Bimmer?|Jack move, that's how we act when we team up|Hey, yo, yo, yo, yo, yo, stretch it out, nigga|Let the motherfucker pass us that blunt, nigga|They heard what that nigga say, ""Puff puff pass, motherfucker""|""Puff puff pass, motherfucker""|Yo, yo, yo, yo, yo|[Verse 1]|Sim Simma, who got the key to my Bimmer?|Jack move, that's how we act when we team up|Throw your triple beam up, this is fish scale|I bailed out the county with counterfeit bills|My slang be high range Brick City|Watch how you sniff, son, I'm highly octane|All you hear is bang, bang (Bang, bang)|Yo, remember you, bitch? Shit, I forget my last name|It's all about game, nuttin' else, for delf|Walk through the woods then stomp on your foot|With high, I take out any comp in the hood|Gorilla impact in this rap habitat|Get you steppin' in your Air Max, bounce|You cockin' it back but where it at? Bounce|I got a six pack of Heineken and Big Kap on the wheels|In two laps, I give Stella Her Groove Back||[Chorus]|My middle name must be Fuck You|'Cause every time I walk by|Niggas be like, ""Fuck you""|I'll be dat, I'll be dat, I'll be dat, I'll be dat|My first name must be He Ain't Shit|'Cause every time I'm in a car|Bitches be like, ""He ain't shit""|I'll be dat, I'll be dat, I'll be dat, I'll be dat (Yo, yo, yo)|You might also like[Verse 2]|I heard the party goin' on in there, yeah|Well, let me shake my stankin' ass in there, yeah|Soon as I walk in, dogs are barkin' (Arf, arf, arf)|Haters play the back, I stay in front like handicapped parkin'|Startin' arsons from, Jers' to Arkan-|-Sas me coughin' out that dread apartment|Roll up to the jam with the front end bent up|Watch them chickens, 'fo' end up gettin' salmonella|I'm ghetto like D&D, fuckin' wit' D|You be on Banned From TV Part III|In a heartbeat, tiger, straight out the cup|You're light in the ass, son, you weigh 'bout a buck|But I'm one-ninety physique|Two-hundred and thirty-fo' pounds total when I'm carryin' the heat|Not platinum on wax but, platinum in the streets|Any nigga that disagree, smack him in the teeth|Then I bag his little piece, rockin' the ice|Give it to the projects, gonna rob him tonight|(Why you actin like dat?) The weed made me do it|Devil's Advocate hot, it take days to do it|My crew do drugs Duane Reade couldn't breed|Dry me in the sun, I'll amount to ten keys|Redbones I'm bonin', MC's be clonin'|That's before Doc stretch up and mornin' yawnin'|[Chorus]|My middle name must be Fuck You|'Cause every time I'm in the hood|Niggas be like, ""Fuck you""|I'll be dat, I'll be dat, I'll be dat, I'll be dat|My first name must be He Ain't Shit|'Cause every time I'm in my car|Bitches be like, ""He ain't shit""|I'll be dat, I'll be dat, I'll be dat, I'll be dat||[Bridge]|Niggas and you bitches|Puff puff give (Haha)|Niggas and you bitches|Puff puff give||[Verse 3]|Yo, yo, if you gotta be a monkey, be a gorilla|It's four AM, I'm off a tab and still a|World rap biller, push a big Benz|With a chickenhead, drawers hangin' from my antenna|I'll be goddamned if a nigga take mine|On foot, shit, put rollerblades on|Mind your business (Uh-huh)|The nine with swiftness (Uh-huh)|I'll pull it, stretch it like Fonda Fitness|I'm a everyday nigga like I'm Toyota|Your A&R hope we don't drop the same quarter|Wrapped the puta in a Hefty Two-Ply|(Yo, he ain't from Chi) So haul ass back to Utah||[Chorus]|My middle name must be Fuck You|'Cause every time I'm in the hood|Niggas be like, ""Fuck you""|I'll be dat, I'll be dat, I'll be dat, I'll be dat|My first name must be He Ain't Shit|'Cause every time I'm in the car|Bitches be like, ""He ain't shit""|I'll be dat, I'll be dat, I'll be dat, I'll be dat|My middle name must be Fuck You|'Cause every time I'm in the hood|Niggas be like, ""Fuck you""|I'll be dat, I'll be dat, I'll be dat, I'll be dat|My first name must be He Ain't Shit|'Cause every time I'm in the car|Bitches be like, ""He ain't shit""|I'll be dat, I'll be dat, I'll be dat, I'll be dat (Fuck you)|Fuck you||[Outro]|Yeah, yeah, yeah, yeah, yeah|It's W Fuck All Y'all Radio, ya man Big Tigga|I'll be dat, ya heard? Yo (Fuck you)|It's like thirty degrees down here in D.C|All my niggas strap the Timbs up|Get out the puffy coats and all of that|And I'll see all you chickenhead ass bitches at the club later|I'll be there, ha|I'll be dat6Embed"
Redman,Pick It Up,1996,"Pick It Up Lyrics[Hook]|(Get on down)|Pick it up, pick it up|Pick it up, pick it up|(Get on down)|Pick it up, pick it up|Pick it up, pick it up|If you find a bag of weed on the floor motherfucker|What the fuck you gon' do?|(Get on down)|Pick it up, pick it up|Pick it up, pick it up|(Get on down)|Pick it up, pick it up|[Verse 1: Redman]|While I crack a cold Beck's and keep the hoes in check|The double-S vest nigga wreck the discotheque|Sit back relax and while my Squad kick tacks|Then tap your man back and be like ""Did you see that??""|Ahh yes, comin from the North South East West|Hold your nose and take a deep breath, recess|We bless, mics, three times a day|Three times a night, it all equals subliminal sequels|Strictly laughing at MC's|Lyrics for years that run more than ten deep|Niggas be like ""Ahh he changed his style up""|Shut the fuck up, ya still a dick-ridah|It's '96 so get wit' it|Keep that back-in-the-day shit when that other Squad was Hit-tin|Listen, must we forget, I originated|All that wild shit, that rrraahh rrraaoowww shit|That jump up and ready to fuck shit up now shit|Brick City!! Is where I get down kid|Peace to all my buddah smokers on Prince|Fuck what ya heard, Brick City runs shit||[Hook]|(Get on down)|P.P.P. got the Glocks and tecs|And Def Squad always got some fly shit on deck|(Get on down)|Say what? Got some fly shit on deck|(Get on down)|Say WHAT? Got some fly shit on deck|P.P.P. got the Glocks and tecs|And Def Squad always got some fly shit on deck|(Get down)|You might also like[Verse 2: Redman]|First of all, MC's be on my balls, straight up|Pubic hairs and everything, lick the whole plate up|Bay Area, roll up your Las Vegas|To all MC's, I love it that you hate us|Drop skills that might send wind chill factors|Back through Patterson, J.C|And Hacken-sack|Step uncorrect and get blackened|The assassin, find da MC's by the jazz men|I don't tote guns I tote funds|While you still puzzled how my antidote runs|Your whole vocabulary's played out, admit it|Still wack if it came out my mouth and I spit it (Get on down)|You remind me of school on a Sunday|No class, beatin all King's down|Doin over seventy, in a Hyundai, blast|Give em a good reason to open Alcatraz back|Nobody got the Red shook|Been a weirdo ever since the doctor said PUSH|Def Squad skills make it hard to overlook me|That's why the hardcore promoters still book me|You shook G... word up... hah hah...||[Hook]|(Get on down)|If you see a bag of weed on the floor motherfucker|What the fuck you gon do|Pick it up, pick it up|(Get on down)|If you see a bitch passed out on the fuckin' ground|What the fuck you gon do|Pick her up, pick her up|(Get on down)|I keep it fly y'all|Fly fly y'all (5X)|(Get on down)|[Verse 3: Redman]|Aiyyo, don't ride the dick of these real MC's|We pull Joints like Spike and blow crews to degrees|Then we buy G's with a half a pound of dope MC's|We bag for cheese just to get weed|Smoke indoneez I'm milky like Magnese|Oh-seven-one-oh-three, rest them car thieves|Guzzlin quart for sports of all sorts|Nonchalant spark buddah on the front porch|At courts, F-U-N-K-D-O-C|S-P-O-T, feel the Solo type remedy|Then freeze.... (Get on down) hah, ha-hah|Where was I? Oh yes|Sippin on Cristal with fingers up your bitch dress|Don't play close cause jealousy make folks act loc|Another nigga smoked from impression|Second guessin my verbal weapon, you're lettin|Spit, sixteen bits, come equipped|And I still walk around with the hooked up|Motorola flip on my hip, fuck the government|Drop shit, it's a microscopic topic|How I stay mo' bent than McDonald arches|And uptown got the la-la spots|And bad ass hoes with 54-11 Reeboks|But still, I walk around with the grill|Cause niggas be blinded by this hip-hop shit for real|I ain't havin that, I'm clappin shit|Fuck this rappin shit, I cause accidents|To any, MC who wonder what got in me|To get busy, it's simply Ginger and Remi|It don't stop, Def Squad crew is hot|Fillin up your brain with supreme octane, and it's on|(Get on down)1Embed"
Redman,Time 4 Sum Aksion,1992,"Time 4 Sum Aksion Lyrics[Intro]|Nineteen-ninety-motherfuckin'-two|Straight from Jersey, the Phillie blunt lives on|Yo, B, tell 'em how this shit goin' down||[Chorus: B-Real & Big Daddy Kane]|Time, time for some, time for some action, just|Time, time for some, time for some action, just|Time, time for some, time for some action, just (Come on)|Time, time for some, time for some action, just (Yeah)|Time, time for some, time for some action, just|Time, time for some, time for some action, just|Time, time for some, time for some action, just|Time, time for some, time for some action, just|Time, time for some, time for some action, just (Lights, camera, action)|[Verse 1]|(Let's get ready to rumble)|In this corner we have the funk bodysnatcher|P-Funkadelic and I gat ya|Hard enough that I can chew a whole bag of rocks|Chew an avenue, chew an off street and off block|Then turn around and do the same damn thing to a soloist|'Cause Reggie Noble's pissed|I crush the whole brain frame|'Cause you couldn't maintain the funk|That have your rap style for lunch, chump|'Cause '92, I take a whole crew|Give them a punch of the funk|Knock all of their gold tooth loose (Pow)|To show you what type of stuff I'm on, you can't puff or sniff it|Because I was born with it|The Funkadelic Devil, hit you with the rap level of ten|Then one, two, three, you're pinned|I get action, so everybody jump wit' your rump|If you like the way it sounds punk, pump it in your back trunk|And let loose with the juice when I do rock|I'm too hot, some say I got more Juice than 2Pac|Straight outta Jersey|You heard me, my brother, I'm laughin'|Time for some action|You might also like[Chorus: B-Real]|Time, time for some, time for some action, just|Time, time for some, time for some action, just|Time, time for some, time for some action, just|Time, time for some, time for some action, just|Time, time for some, time for some action, just|Time, time for some, time for some action, just|Time, time for some, time for some action, just|Time, time for some, time for some||[Verse 2]|Lights, camera, cock back the hammer (Explosion)|Straight from the Land of the Lost|I'ma hit you with the funk force|That make you run your rap style back to the crack aisle, brotha|Then strike a pose like Madonna|My mom's kicked me out because I did what I want ta|The original P-Funk, chump, dump a trunk of funk|In your skull caps 'cause my jaw snaps with the raw rap|So color me bad, plus color me black|For the funk that I pack, Red freak it to the funk track|(The funky fly stuff)|Come on and let me kick|(The funky fly stuff)|Just to show you where the hell I come from|I get dumb with the one, one, two|Check my rep from my hip when I have sex (Like this)|Make you twist to the list|Of a funky brain cell when it's puffed on a spliff|And all that, the hi hat, go buy that|Listen, look, oops, brother, where your eyes at?|They on the floor, pick 'em up|While I pour lyric funk down your brain, punk|Listen to my name, chump|(Redman ready to rock)|I got a Glock, then pow, your body is all over the block|Tryin' to step to this, the exorcist, kick it|I get mad wicked when Twin cock the biscuit|And blow your head off|Just for asking ""Who's the one rapping?"" (Poo-pow)|Time for some action|[Chorus: B-Real]|Time, time for some, time for some action, just|Time, time for some, time for some action, just|Time, time for some, time for some action, just|Time, time for some, time for some action, just (Yeah)|Time, time for some, time for some action, just|Time, time for some, time for some action, just|Time, time for some, time for some action, just|Time, time for some, time for some action||[Interlude]|Yo, 1992, Redman gets paid|Yeah, know what I'm sayin'?|We not goin' for the Okee Doke, believe that|Hit Squad is definitely in the house (In the house)|For the brothers that don't be knowin', what's up?|Word is bond, I gotta show them the flava||[Outro]|Back to the funk track like Black Sheep|My man jump say, uh|""Who's the Redman? Where's the Redman?""|I kill, I smother, I get down with the (Yo, yo, yo, chill)|Yo, yo, Red, yo, chill, G|Chill, akh|It's over man|Yo, you don't gotta say no more, it's over5Embed"
Redman,Sourdeezal,2012,"Sourdeezal LyricsGilla... House... Gillahouse||[Hook]|I smoke purp to the haze|Smoke haze to the cheese|Smoke cheese to the kush|Smoke kush to the sourdeezal|And I ain't feeling... anything|When I roll the bomb, alright alright, its Gillahouse||[Verse 1 - Redman]|Rollin up the marijuana bud|Jack Herer, Uh in the blood|Redman, my codename Cheech|Hash burns all in my carseats|I was a Baby Boy"" like Tyrese|Hittin the L before ""Rock the Bells"", release|Mr. Green, yeah thats me, got the knockout bud, the muhammad a-leaf|Young as a Bob Marley when I speak|Po-po I hide the bud in the briefs|The highest of highs, your boys on fire|Smokin with me is like trying to ""Get Him to the Greek""|420, I light up the kief, I'm a Wiz at getting the Curren$y in the streets|Bill Clinton said he hit weed in his speech|I smoke sour everyday of the week nigga, PREACH|[Hook]|I smoke purp to the haze|Smoke haze to the cheese|Smoke cheese to the kush|Smoke kush to the sourdeezal|And I ain't feeling... anything|When I roll the bomb, alright alright, its gillahouse||[Bridge] (Redman & Ready Roc)|LET'S GO|Smoke with you. [Okay]|The fire. [Gillahouse in the building]|Come smoke with me [Brickcity!]|Let's go get higher|This booooomb, its a sensation|Now breathe it in, all in your system|YEAH||[Verse 2 - Ready Roc]|Blunt filled with kush, cheese, purple, and sour diesel|I call that smoking reefer|I keep weed in my system, and truth be told I get higher than Blake Griffin|And just imagine what I'm sipping, to drink this your gonna need a prescription|So it better be highgrade if you selling me|And never start no cypher without telling me|Cup empty, I need a refill|Something to chase this E pill|I hit my dealer at 3 AM|I wonder if he got hash still|Cause Gillahouse is what I'm reppin'|I stay high, get fly, I'm a Jetson|Now I'm on my high horse like a Western|And I never leave the house without protection|That's something that pastor can't preach|But that's something a jail could teach|To get high we put our money on weed, and we probably spend it all cause the sour ain't cheap|CHIEF|You might also like[Hook]|I smoke purp to the haze|Smoke haze to the cheese|Smoke cheese to the kush|Smoke kush to the sourdeezal|And I ain't feeling... anything|When I roll the bomb, alright alright, its Gillahouse1Embed"
